Date_Extracted,Published_Date,Heading,URL,Body_Snippet,Source_Site
11/5/2026,Unknown,WE FITNESS SOCIETY,https://wefitnesssociety.com/,"WE Fitness Thailand, your partner in achieving sustainable wellness through personalized fitness experiences, professional trainers, and innovative workouts ...",wefitnesssociety.com
11/5/2026,Unknown,WE Fitness Society (@WeFitnessOfficial) - Facebook,https://www.facebook.com/WeFitnessOfficial/?locale=th_TH,FLASH SALE! 5 วันเท่านั้น ถึงเวลากลับมาดูแลตัวเองอีกครั้ง เริ่มต้นฟิตได้ง่าย ๆ เพียง 55 บาท* 1–5 พฤษภาคม 2569 เท่านั้น เริ่มต้นสุขภาพที่ดีวันนี้ https://page.line.me/ztr2426t #WESOCIETY # ...,www.facebook.com
11/5/2026,Unknown,WE Fitness Thailand | Bangkok - Facebook,https://www.facebook.com/WESocietyRy/?locale=th_TH,"WE Fitness Thailand, Bangkok. 2626 likes · 80 talking about this · 24119 were here. Yoga Studio.",www.facebook.com
11/5/2026,Unknown,WE Fitness Society | LINE Official Account,https://page.line.me/ztr2426t,WE SOCIETY. Bangkok Metropolis Bangkok บริษัท วี ฟิตเนส จำกัด 243/3 ห้องเลขที่ C401-A ชั้น 4 ถนนรัชดาภิเษก แขวงลาดยาว เขตจตุจักร. Chat.,page.line.me
11/5/2026,Unknown,"งาน หางาน สมัครงาน WE Fitness Co., Ltd. (บริษัท วี ฟิตเนส จำกัด) - JobThai",https://www.jobthai.com/th/company/143677,วิธีการเดินทาง. สำนักงานใหญ่ สามารถเดินทางมาด้วย BTS สถานนี รัชโยธิน ทางออกที่ 1 เดินมาในส่วนของ อเวนิว หาร้านไก่บอนชอน แล้วขึ้นลิฟท์ข้างร้าน ขึ้นมาชั้น 4 ออกลิฟท์มาเลี้ยวซ้าย.,www.jobthai.com
11/5/2026,Unknown,"หางาน สมัครงานจาก WE Fitness Co.,Ltd. (บริษัท วี ฟิตเนส จำกัด) อัปเดต ...",https://jobbkk.com/jobs/profileurgent/54222,WE SOCIETY คือสังคมของคนไทยที่รักสุขภาพ เต็มไปด้วยบรรยากาศที่ สนุก สดใส ร่าเริง (ENJOYMENT) พนักงานของเราไม่ได้เป็นแค่ผู้ให้บริการ แต่คือ เพื่อนและที่ปรึกษาด้านสุขภาพ (FRIENDLINESS) ...,jobbkk.com
11/5/2026,21 มี.ค. 2559,WE fitness สมัครไปเหมือนโดนโกง - Pantip,https://pantip.com/topic/34936512,สรุปนะครับ : น้ำที่ควรจะมีทั้งวัน เพราะมันคือปัจจัยนึงที่สำคัญมากตอนเล่น >> มีให้แค่วันล่ะ 4-5 ชม. ค่า personal trainer >> สรุปได้แค่ 1 ชม.ครึ่ง เพราะไม่ได้บอกอะไรเลย บอกว่า ...,pantip.com
11/5/2026,Unknown,WE Fitness #wefitness #linedancefitness #dancefitness ...,https://www.instagram.com/reel/DXtkCISkTBV/,Come join the movement! Step in fitness Line dance classes every Thursday!! Experience the benefits of dance fitness . more.,www.instagram.com
11/5/2026,Unknown,We Fitness added a new photo.,https://www.facebook.com/wefitnesss/photos/d41d8cd9/1398656385610229/,"May is here and the weather tends to warm up just like our workouts! •Outdoor workouts begin •Specialty class on 5/1, 5/5, 5/11, & 5/25 •5/25 we will only ...",www.facebook.com
11/5/2026,"Apr 18, 2026","We,The Collective Fitness",https://classpass.com/studios/wethe-collective-fitness-ave-oak-park,"Check out We,The Collective Fitness on ClassPass. See reviews, schedules and easily book at discounted rates.",classpass.com
11/5/2026,2 months ago,ON SUNDAYS WE FITNESS RACE 6am Sunday Crew 50min ...,https://www.instagram.com/reel/DVm1TgQESnR/,"ON SUNDAYS WE FITNESS RACE 6am Sunday Crew 50min E10MOM | Building that race ready capacity. RUN/ SKI/ ROW/ BIKE into WALL BALLS, SLED PUSH, SANDBAG LUNGE, ...",www.instagram.com
11/5/2026,Unknown,We Fitness added a new photo.,https://www.facebook.com/wefitnesss/photos/d41d8cd9/1397850882357446/,"We hope you had an amazing birthday workout and even better day! May be an image of smiling, activewear and text that says '+FITNESS #.",www.facebook.com
11/5/2026,Unknown,Photo by WE Fitness & Unisex Gym (@wefitness9),https://www.instagram.com/p/DXBBcH3gSCP/,"Photo by WE Fitness & Unisex Gym on April 11, 2026. May be a. 11 likes ... Join WE Fitness & Unisex Gym on Instagram. Sign up for Instagram · Sign up ...",www.instagram.com
11/5/2026,2 days ago,A personal trainer is so much more than someone who counts ...,https://www.instagram.com/reel/DYFDGMiT3NG/,"At Titanium Fitness, we offer coach-led strength training, cycling, and small group fitness classes designed to help you stay consistent—even on the hard days.",www.instagram.com
11/5/2026,Unknown,We Fitness (วี ฟิตเนส) Esplanade Ratchadapisek ชั้น 2 - Wongnai,https://www.wongnai.com/businesses/210031rv-we-fitness-esplanade-ratchadapisek,สาขานี้จะอยู่ที่ชั้น2Esplanade Ratchdapisek การเดินทาง มาได้ทั้งรถส่วนตัว จอดที่ห้างหรือจะมาทางMRTก็อยู่ใกล้สถานีศูนย์วัฒนธรรม สาขานี้แบ่งเป็น3ชั้น แบ่งเป็นชั้นเครื่องออกกำลังกายแบบต่างๆมีเยอะมาก ...,www.wongnai.com
11/5/2026,30 พ.ย. 2568,WE Fitness Society - Facebook,https://www.facebook.com/WeFitnessOfficial/posts/%E0%B8%9F%E0%B8%B4%E0%B8%95%E0%B8%81%E0%B9%88%E0%B8%AD%E0%B8%99%E0%B8%9B%E0%B8%B5%E0%B9%83%E0%B8%AB%E0%B8%A1%E0%B9%88-%E0%B8%A3%E0%B9%88%E0%B8%B2%E0%B8%87%E0%B9%83%E0%B8%AB%E0%B8%A1%E0%B9%88%E0%B8%81%E0%B9%88%E0%B8%AD%E0%B8%99%E0%B9%83%E0%B8%84%E0%B8%A3-%E0%B9%80%E0%B8%A3%E0%B8%B4%E0%B9%88%E0%B8%A1-699-%E0%B9%80%E0%B8%97%E0%B9%88%E0%B8%B2%E0%B8%99%E0%B8%B1%E0%B9%89%E0%B8%99-%E0%B9%80%E0%B8%82%E0%B9%89%E0%B8%B2%E0%B8%84%E0%B8%A5%E0%B8%B2%E0%B8%AA%E0%B9%84%E0%B8%94%E0%B9%89%E0%B8%81%E0%B8%A7%E0%B9%88%E0%B8%B2-4000-%E0%B8%84%E0%B8%A5%E0%B8%B2%E0%B8%AA%E0%B9%80%E0%B8%94%E0%B8%B7%E0%B8%AD%E0%B8%99-/1291780712977640/,ตอบโจทย์ทุกไลฟ์สไตล์ พร้อมคลาสใหม่ๆ ที่ท้าทายตัวคุณ ตารางคลาสระหว่างวันที่ 11-17 พ.ค. 69 ✓ สนใจสุขภาพดี รับสิทธิ์ทดลองออกกำลังกายกับเรา คลิกที่นี่ >> https://page.line.,www.facebook.com
11/5/2026,1 พ.ค. 2569,Bangkok's top Pilates studios - Time Out,https://www.timeout.com/bangkok/sports-and-fitness/top-pilates-studios-in-bangkok,"Low-impact, full-body workouts take many forms here, in group or private classes that fit everyone – from absolute beginners to seasoned ...",www.timeout.com
11/5/2026,17 ก.ค. 2567,สัมผัสประสบการณ์เหนือระดับกับ WE SOCIETY ⚡️ สมัครสมาชิกประเภท ...,https://www.facebook.com/WeFitnessOfficial/videos/%E0%B8%AA%E0%B8%B1%E0%B8%A1%E0%B8%9C%E0%B8%B1%E0%B8%AA%E0%B8%9B%E0%B8%A3%E0%B8%B0%E0%B8%AA%E0%B8%9A%E0%B8%81%E0%B8%B2%E0%B8%A3%E0%B8%93%E0%B9%8C%E0%B9%80%E0%B8%AB%E0%B8%99%E0%B8%B7%E0%B8%AD%E0%B8%A3%E0%B8%B0%E0%B8%94%E0%B8%B1%E0%B8%9A%E0%B8%81%E0%B8%B1%E0%B8%9A-we-society-%EF%B8%8F%E0%B8%AA%E0%B8%A1%E0%B8%B1%E0%B8%84%E0%B8%A3%E0%B8%AA%E0%B8%A1%E0%B8%B2%E0%B8%8A%E0%B8%B4%E0%B8%81%E0%B8%9B%E0%B8%A3%E0%B8%B0%E0%B9%80%E0%B8%A0%E0%B8%97-unlimited-%E0%B8%A7%E0%B8%B1%E0%B8%99%E0%B8%99%E0%B8%B5%E0%B9%89%EF%B8%8F-%E0%B8%A3%E0%B8%B1/1542704259923203/,... ฟิตเนส #สังคมคนรักสุขภาพ #pilates | WE Fitness Society | Facebook. Log in · Video. 󱡘. WE Fitness Society.,www.facebook.com
11/5/2026,Unknown,We Fitness Society Official (@we_society) / Posts / X - Twitter,https://x.com/we_society,FOLLOW US ♪ TIKTOK WE FITNESS SOCIETY กดติดตามเราไว้ ไม่พลาดคลิปเด็ด ทริคการออกกำลังกายสนุกๆ แบบฉบับออกกำลังกายอารมณ์ดี รวมไว้แล้วที่นี่!! ง่ายๆ แคปภาพหน้าจอ รอลุ้นรางวัล คลิก >> ...,x.com
11/5/2026,Unknown,WE SOCIETY - แอปพลิเคชันใน Google Play,https://play.google.com/store/apps/details?id=com.wefitness.app&hl=th&referrer=utm_source%3Dgoogle%26utm_medium%3Dorganic%26utm_term%3Dwe+fitness,WE Society คือแอปสำหรับสมาชิก WE Society ที่ออกแบบมาเพื่อช่วยดูแลการออกกำลังกายของคุณให้เป็นเรื่องง่ายและสะดวกในทุกวัน แอปนี้รวบรวมทุกสิ่งที่สมาชิก WE Society ต้องการไว้ในที่เดียว,play.google.com
11/5/2026,Unknown,We Fitness Society (@wefitnesssociety) - Threads,https://www.threads.com/@wefitnesssociety,Officially WE Fitness Society | วีฟิตเนส เราให้คุณมากกว่าสถานที่ออกกำลังกาย ✨ รับสิทธิ์ทดลองออกกำลังกายกับเรา คลิกที่นี่ . bit.ly ...,www.threads.com
11/5/2026,13 พ.ค. 2561,สมัครสมาชิกที่ WE FITNESS SOCIETY วันนี้ ชำระเพียงเดือนละ ... - Facebook,https://www.facebook.com/WeFitnessOfficial/posts/%E0%B8%AA%E0%B8%A1%E0%B8%B1%E0%B8%84%E0%B8%A3%E0%B8%AA%E0%B8%A1%E0%B8%B2%E0%B8%8A%E0%B8%B4%E0%B8%81%E0%B8%97%E0%B8%B5%E0%B9%88-we-fitness-society-%E0%B8%A7%E0%B8%B1%E0%B8%99%E0%B8%99%E0%B8%B5%E0%B9%89-%E0%B8%8A%E0%B8%B3%E0%B8%A3%E0%B8%B0%E0%B9%80%E0%B8%9E%E0%B8%B5%E0%B8%A2%E0%B8%87%E0%B9%80%E0%B8%94%E0%B8%B7%E0%B8%AD%E0%B8%99%E0%B8%A5%E0%B8%B0-1300-%E0%B8%9A%E0%B8%B2%E0%B8%97-%E0%B8%81%E0%B8%B1%E0%B8%9A%E0%B8%9B%E0%B8%A3%E0%B8%B0%E0%B9%80%E0%B8%A0%E0%B8%97%E0%B8%AA%E0%B8%A1%E0%B8%B2%E0%B8%8A/1919401304746408/,ตอบโจทย์ทุกไลฟ์สไตล์ พร้อมคลาสใหม่ๆ ที่ท้าทายตัวคุณ ตารางคลาสระหว่างวันที่ 11-17 พ.ค. 69 ✓ สนใจสุขภาพดี รับสิทธิ์ทดลองออกกำลังกายกับเรา คลิกที่นี่ >> https://page.line.,www.facebook.com
11/5/2026,23 ธ.ค. 2559,WE Fitness แพงมั้ยครับ - Pantip,https://pantip.com/topic/35940841,สนใจไหมค่ะ พอดีเป็นสมาชิกอยู่ที่ปิ่นเกล้าแต่ไม่ค่อยได้เล่น ราคา 2100 บาทต่อเดือน เล่นได้ทุกชนิดของเครื่องเล่นที่นั้น เดือนมกรา จ่ายไปแล้วถ้าสนใจเล่นฟรีนะค่ะไม่คิดเงินค่ะ ...,pantip.com
11/5/2026,Unknown,โปรโมชั่น ส่วนลด WE Fitness Society วี ฟิตเนส โซไซตี้ อัพเดท พฤษภาคม 2026,https://salehere.co.th/we-fitness,"หาเวลามาออกกำลังกายที่ We Fitness มีเครื่องเล่น และคลาสต่างๆให้เลือกเยอะ ‍♂️ สมัครสมาชิก We Fitness เริ่มแค่ 1,390 บาท/เดือน หรือ เข้าคลาสฮิตได้มากมาย เริ่มแค่ 1,990 บาท/เดือน # ...",salehere.co.th
11/5/2026,Unknown,We_Fitness_Ratchada - Instagram,https://www.instagram.com/we_fitness_ratchada/,828 followers · 680 following · 302 posts · @we_fitness_ratchada: “พวกเรา professional trainer จาก we fitness สาขาเอสพลานาดรัชดา ”,www.instagram.com