Topic_Type,Date_Extracted,Published_Date,Heading,URL,Body_Snippet,Source_Site
Organic Search Result,2026-06-01,7 ม.ค. 2026,ไทยพาณิชย์ Logo,https://www.pinterest.com/ideas/%E0%B9%84%E0%B8%97%E0%B8%A2%E0%B8%9E%E0%B8%B2%E0%B8%93%E0%B8%B4%E0%B8%8A%E0%B8%A2%E0%B9%8C-logo/934936565692/,Scb Logo · Thai Airways Logo Design · Thailand Logo Png · K Bank Logo · Scb Bank Logo · First Financial Bank Logo Png · Thailand Logo · Bangkok Bank Logo · Hdfc ...,www.pinterest.com
Organic Search Result,2026-06-01,6 ม.ค. 2026,SCB EIC มองเศรษฐกิจไทยปี 2569 โตแค่ 1.5% ต่ำสุดในรอบ ...,https://www.brandbuffet.in.th/2026/01/scb-eic-forecasts-2026-thailands-economy/,SCB EIC ประเมินเศรษฐกิจไทยในปี 2569 จะขยายตัวเพียง 1.5% ลดลงจาก 2% ในปี 2568 ซึ่งนับว่าต่ำสุดในรอบ 3 ทศวรรษ (ไม่นับช่วงวิกฤติ) สะท้อนแรงกดดันจากปัจจัยภายนอก เช่น ...,www.brandbuffet.in.th
Organic Search Result,2026-06-01,21 ม.ค. 2026,"SCB ประกาศเป้าหมายปี'69 การเติบโตของสินเชื่อ ""ตัวเลขหลัก ...",https://www.prachachat.net/finance/news-1954031,บริษัท เอสซีบี เอกซ์ จำกัด (มหาชน) หรือ SCB แจ้งตลาดหลักทรัพย์ฯ ถึงเป้าหมายของบริษัทสำหรับปี 2569 เพื่อเป็นข้อมูลเปิดเผยต่อผู้ถือหุ้นและนักลงทุน. - -Advertisement- -.,www.prachachat.net
Organic Search Result,2026-06-01,Unknown,"ข่าวหุ้นธุรกิจ on Instagram: ""SCB จุดเด่นปันผลสูง ยีลด์กว่า 8 ...",https://www.instagram.com/reel/DUAXBGRCWWh/,"3 likes, 0 comments - kaohoon on January 26, 2026: ""SCB จุดเด่นปันผลสูง ยีลด์กว่า 8% #SCB #หุ้นธนาคาร #ปันผลสูง #DividendYield #กลุ่มการเงิน #ผลตอบแทนผู้ถือหุ้น #หุ้นปันผล ...",www.instagram.com
Organic Search Result,2026-06-01,6 ม.ค. 2026,SCB บริการแย่มาก ขอเตือนคนที่คิดกำลังจะเปิดบัญชี,https://pantip.com/topic/43685118,ธนาคารไทยพาณิชย์ ธนาคารกสิกรไทย SCB EASY. อุตส่าห์โทไปถามว่าต้อง เตรียมเอกสารอะไรบ้าง ก็บอกมาไม่ครบ พอตอนไปสาขาก็บอกว่าช่วยไม่ได้ต้องไปเตรียม ...,pantip.com
Organic Search Result,2026-06-01,Unknown,ประวัติธนาคารไทยพาณิชย์: จุดเริ่มต้นที่สำคัญ,https://www.tiktok.com/@scbthailand/video/7599999851853516053,"2206 ถูกใจ,21 ความคิดเห็นวิดีโอ TikTok จาก SCB Thailand (@scbthailand): ""ศึกษาประวัติธนาคารไทยพาณิชย์ ธนาคารประวัติศาสตร์ของคนไทย พร้อมเนื้อหาที่น่าสนใจเกี่ยวกับการเงินในไทย ...",www.tiktok.com
Organic Search Result,2026-06-01,Unknown,เริ่มปีใหม่...ปล่อยให้เงินทำงานแทนเรา 💰 ถ้าลงทุนในดัชนี S&P ...,https://www.facebook.com/scb.thailand/posts/%E0%B9%80%E0%B8%A3%E0%B8%B4%E0%B9%88%E0%B8%A1%E0%B8%9B%E0%B8%B5%E0%B9%83%E0%B8%AB%E0%B8%A1%E0%B9%88%E0%B8%9B%E0%B8%A5%E0%B9%88%E0%B8%AD%E0%B8%A2%E0%B9%83%E0%B8%AB%E0%B9%89%E0%B9%80%E0%B8%87%E0%B8%B4%E0%B8%99%E0%B8%97%E0%B8%B3%E0%B8%87%E0%B8%B2%E0%B8%99%E0%B9%81%E0%B8%97%E0%B8%99%E0%B9%80%E0%B8%A3%E0%B8%B2-%E0%B8%96%E0%B9%89%E0%B8%B2%E0%B8%A5%E0%B8%87%E0%B8%97%E0%B8%B8%E0%B8%99%E0%B9%83%E0%B8%99%E0%B8%94%E0%B8%B1%E0%B8%8A%E0%B8%99%E0%B8%B5-sp-500-%E0%B8%9B%E0%B8%B5-2016-%E0%B8%9C%E0%B9%88%E0%B8%B2%E0%B8%99%E0%B9%84%E0%B8%9B-10-%E0%B8%9B%E0%B8%B5-%E0%B9%80/1374413031391146/,... INDEX FUND ทั่วโลกจาก SCB ลงทุน EASY ที่แอป SCB EASY ➡️ เพิ่มเติม >> https://www.scb.co.th/th/personal-banking/investment/fund/mutual-funds/index-fund ...,www.facebook.com
Organic Search Result,2026-06-01,Unknown,อิสระอีกขั้นของการทำธุรกรรมทางการเงินด้วยบัญชีเงินฝากแบบ SCB ...,https://www.youtube.com/watch?v=7WDQBATqU-4,... SCB EASY • อุ่นใจกว่า ไม่ต้องกลัวสมุดคู่ฝากหาย • ง่ายกว่า แจ้งความเคลื่อนไหวบัญชีผ่าน Line SCB Connect • เปลี่ยนเป็นบัญชีเงินฝาก* แบบ E PASSBOOK ได้ทุก ...,www.youtube.com
Organic Search Result,2026-06-01,21 ม.ค. 2026,SCB ปี 68 กำไรสุทธิ 4.74 หมื่นลบ. เติบโต 8% หลัง ...,https://www.share2trade.com/news/52096/scb-%E0%B8%9B%E0%B8%B5-68-%E0%B8%81%E0%B8%B3%E0%B9%84%E0%B8%A3%E0%B8%AA%E0%B8%B8%E0%B8%97%E0%B8%98%E0%B8%B4-474-%E0%B8%AB%E0%B8%A1%E0%B8%B7%E0%B9%88%E0%B8%99%E0%B8%A5%E0%B8%9A-%E0%B9%80%E0%B8%95%E0%B8%B4%E0%B8%9A%E0%B9%82%E0%B8%95-8-%E0%B8%AB%E0%B8%A5%E0%B8%B1%E0%B8%87%E0%B8%81%E0%B8%B3%E0%B9%84%E0%B8%A3%E0%B9%80%E0%B8%87%E0%B8%B4%E0%B8%99%E0%B8%A5%E0%B8%87%E0%B8%97%E0%B8%B8%E0%B8%99%E0%B9%80%E0%B8%9E%E0%B8%B4%E0%B9%88%E0%B8%A1%E0%B8%82%E0%B8%B6%E0%B9%89%E0%B8%99-%E0%B8%A3%E0%B8%B2%E0%B8%A2%E0%B9%84%E0%B8%94%E0%B9%89%E0%B8%84%E0%B9%88%E0%B8%B2%E0%B8%98%E0%B8%A3%E0%B8%A3%E0%B8%A1%E0%B9%80%E0%B8%99%E0%B8%B5%E0%B8%A2%E0%B8%A1%E0%B8%AB%E0%B8%99%E0%B8%B8%E0%B8%99%E0%B8%9E%E0%B8%B8%E0%B9%88%E0%B8%87,"นายอาทิตย์ นันทวิทยา ประธานเจ้าหน้าที่บริหาร บริษัท เอสซีบี เอกซ์ จำกัด (มหาชน) หรือ SCB เปิดเผยว่า ผลประกอบการปี 2568 ของบริษัทมีกำไรสุทธิ 47,488 ล้านบาท เพิ่มขึ้น 8.1% จากปีก่อน จากการเพิ่มขึ้น ...",www.share2trade.com
Organic Search Result,2026-06-01,8 ม.ค. 2026,ช้อปซูเปอร์ สตาร์ทความคุ้ม เกินลิมิต รับคืนรวมสูงสุด 15%*/** ผ่าน ...,https://centralfoodwholesale.co.th/promotion/scb-card-x-8jan26/,ลงทะเบียนผ่านแอป CardX App. หรือ บัตรเครดิต CardX และ SCB PRIVATE BANKING / SCB FIRST / SCB PRIME. พิมพ์ SUPER วรรค หมายเลขบัตรเครดิต 12 หลักสุดท้าย ส่ง ...,centralfoodwholesale.co.th
Organic Search Result,2026-06-01,26 ม.ค. 2026,SCB คาดค่าเงินบาทวันนี้ 30.85-31.10 บาท/ดอลลาร์,https://www.hoonvision.com/investment/scb-%E0%B8%84%E0%B8%B2%E0%B8%94%E0%B8%84%E0%B9%88%E0%B8%B2%E0%B9%80%E0%B8%87%E0%B8%B4%E0%B8%99%E0%B8%9A%E0%B8%B2%E0%B8%97%E0%B8%A7%E0%B8%B1%E0%B8%99%E0%B8%99%E0%B8%B5%E0%B9%89-30-85-31-10-%E0%B8%9A/,SCB คาดค่าเงินบาทวันนี้ 30.85-31.10 บาท/ดอลลาร์. แชร์: Facebook twitter line link คัดลอกลิงค์. เผยแพร่วันที่ 26 มกราคม 2569. หุ้นวิชั่น –กลุ่มงานตลาดการเงิน ...,www.hoonvision.com
Organic Search Result,2026-06-01,12 ม.ค. 2026,SCBX Group Announces Leadership Transition at Siam ...,https://www.thaipr.net/en/finance_en/3682566,"SCB X Public Company Limited (SCBX) today announced an upcoming leadership transition at Siam Commercial Bank (SCB), a strategic subsidiary of the SCBX ...",www.thaipr.net
Organic Search Result,2026-06-01,19 ม.ค. 2026,CONSENSUS: SCB หุ้นปันผลตัวแม่ DIV Yield 8% คุม NPL,https://www.ryt9.com/s/iq05/12781896,โบรกเกอร์เชียร์หุ้น บมจ.เอสซีบี เอกซ์ [SCB] ชูเป็นหุ้นปันผลตัวท็อปที่มีการจ่ายปันผลอย่างสม่ำเสมอและผลตอบแทนจากปันผลสูงถึง.,www.ryt9.com
Organic Search Result,2026-06-01,9 ม.ค. 2026,"SCB x FWD เปิดตัว ""เซฟวิ่งทูไนน์ตี้"" ออม 9 ปี คุ้มครองยาวถึงอายุ 90",https://www.nationtv.tv/pr-news/business/pr-news/378971895,"SCB x FWD เปิดตัว ""เซฟวิ่งทูไนน์ตี้"" ออม 9 ปี. นายชาญวิทย์ รุ่งเรืองลดา ผู้ช่วยผู้จัดการใหญ่ ผู้บริหารสายงาน Insurance Product ธนาคารไทยพาณิชย์ กล่าวว่า ในยุคที่เศรษฐกิจมีความไม่แน่นอน ...",www.nationtv.tv
Organic Search Result,2026-06-01,8 ม.ค. 2026,ช้อปซูเปอร์ สตาร์ทความคุ้ม เกินลิมิต รับคืนรวมสูงสุด 15%*/** ผ่าน ...,https://centralfoodwholesale.co.th/promotion/scb-card-x-8jan26/,ลงทะเบียนผ่านแอป CardX App. หรือ บัตรเครดิต CardX และ SCB PRIVATE BANKING / SCB FIRST / SCB PRIME. พิมพ์ SUPER วรรค หมายเลขบัตรเครดิต 12 หลักสุดท้าย ส่ง ...,centralfoodwholesale.co.th
Organic Search Result,2026-06-01,Unknown,SCB Feel Thailand with the First Thai Bank,https://www.instagram.com/p/DT4VA7kE9u3/,successchannelonline. ไทยพาณิชย์ ตอกย้ำผู้นำดิจิทัลแบงก์กิ้ง ยกระดับ SCB Connect ด้วยเทคโนโลยี AI ผู้ช่วยที่พร้อมเคียงข้างทุกเรื่องการเงิน,www.instagram.com
Organic Search Result,2026-06-01,9 ม.ค. 2026,ไทยพาณิชย์ เตรียมผลัดใบ 'กฤษณ์ จันทโนทก' แจ้งไม่ต่อสัญญา ...,https://moneyandbanking.co.th/2026/218831/,TagsSCBธนาคารไทยพาณิชย์. Previous Article. แบงก์ชาติ – แบงก์ เตรียมคุมเข้ม ... SCB มีผล 1 พ.ค. 69. 5 พฤษภาคม 2026 12:16 น. ไทยพาณิชย์ ช่วย SME ลดต้นทุน ...,moneyandbanking.co.th
Organic Search Result,2026-06-01,21 ม.ค. 2026,"SCB ประกาศเป้าหมายปี'69 การเติบโตของสินเชื่อ ""ตัวเลขหลัก ...",https://www.prachachat.net/finance/news-1954031,บริษัท เอสซีบี เอกซ์ จำกัด (มหาชน) หรือ SCB แจ้งตลาดหลักทรัพย์ฯ ถึงเป้าหมายของบริษัทสำหรับปี 2569 เพื่อเป็นข้อมูลเปิดเผยต่อผู้ถือหุ้นและนักลงทุน. - -Advertisement- -.,www.prachachat.net
Organic Search Result,2026-06-01,Unknown,โครงการของขวัญพี่ให้น้องปีที่ 7 โดย SCBX,https://www.tiktok.com/@scbthailand/video/7593136822335704340,"445 ถูกใจ,วิดีโอ TikTok จาก SCB Thailand (@scbthailand): ""ร่วมส่งความสุขให้กับเด็กๆ โรงเรียนตำรวจในกาญจนบุรีในโอกาสวันเด็กแห่งชาติ! #ของขวัญพี่ให้น้อง #วันเด็กแห่งชาติ #SCBX""",www.tiktok.com
Organic Search Result,2026-06-01,21 ม.ค. 2026,SCB โบรกฯ คาดกำไร Q4/68 ที่ 1.09 หมื่นลบ. -ปันผลโดดเด่น,https://thunhoon.com/scb-broker-profit-q4-200126,"#SCB #ทันหุ้น-บริษัท เอสซีบี เอกซ์ จำกัด (มหาชน) หรือ SCB เตรียมจะประกาศผลดำเนินงานไตรมาส 4/68 ในวันพรุ่งนี้(21 ม.ค.69) ซึ่งโบรกเกอร์คาดการณ์ว่าจะมีกำไรอยู่ที่ประมาณ 10,660 ถึง 10,996 ...",thunhoon.com
Organic Search Result,2026-06-01,8 ม.ค. 2026,หุ้นกู้ปี 2569 SCB แนะล็อกระยะยาว 5–10 ปี รับดอกเบี้ยขาลง,https://www.thansettakij.com/finance/648495,หุ้นกู้ปี 2569 SCB แนะล็อกระยะยาว 5–10 ปี รับดอกเบี้ยขาลง. นายรุ่งโรจน์กล่าวถึงผลกระทบจากการปรับลดอัตราดอกเบี้ยนโยบายล่าสุด (17 ธ.ค. 2568) ว่า การตัดสินใจลดดอกเบี้ยลง ...,www.thansettakij.com
Organic Search Result,2026-06-01,6 ม.ค. 2026,SCB PRIVATE BANKING - Dining Privilege,https://www.scb.co.th/th/privatebanking/private-privileges/dining-experiences/lifestyle-dining/dining-privilege,"1,200 บาท / ไตรมาส. เงื่อนไข: ธนาคารขอสงวนสิทธิ์ในการมอบสิทธิประโยชน์นี้ให้แก่ผู้ถือบัตรเครดิต SCB PRIVATE BANKING ...",www.scb.co.th
Organic Search Result,2026-06-01,Unknown,"ข่าวหุ้นธุรกิจ on Instagram: ""SCB จุดเด่นปันผลสูง ยีลด์กว่า 8 ...",https://www.instagram.com/reel/DUAXBGRCWWh/,"3 likes, 0 comments - kaohoon on January 26, 2026: ""SCB จุดเด่นปันผลสูง ยีลด์กว่า 8% #SCB #หุ้นธนาคาร #ปันผลสูง #DividendYield #กลุ่มการเงิน #ผลตอบแทนผู้ถือหุ้น #หุ้นปันผล ...",www.instagram.com
Organic Search Result,2026-06-01,4 ม.ค. 2026,บัตรเครดิต CardX Ultra Platinum,https://www.cardx.co.th/credit-card/details/ultra-platinum,ประสบการณ์ช้อประดับพรีเมียม พิเศษทุกวันเสาร์. แลกคะแนนรับส่วนลดเพิ่มรวมสูงสุด 40%*/** กับ SCB WEALTH Credit Card by CardX.,www.cardx.co.th
Organic Search Result,2026-06-01,Unknown,This video summarizes the SCB vs. TISCO case study: Are ...,https://www.youtube.com/shorts/sKsQuMyBXJ8,คลิปนี้วิเคราะห์สถานการณ์ล่าสุด: คลิปนี้สรุป กรณีศึกษา SCB vs TISCO สถิติหุ้นแบงก์เน้นโตหรือปันผล? พร้อมอธิบายแนวโน้มและประเด็นสำคัญ ให้มือใหม่เข้าใจง่าย และนำไปปรับใช้ได้จริง ✓ เหมาะสำหรับคนที่: ...,www.youtube.com
Organic Search Result,2026-06-01,27 ม.ค. 2026,The Age of Artificial Agreement,https://www.scbx.com/en/scbx-exclusive/artificial-agreement/,... SCB X Public Company Limited | SCBX. SCBX Update. SCBX Business. Sustainability. Work with SCBX. About SCBX. Investor Relations. EN. TH EN. Main menu. SCBX ...,www.scbx.com
Organic Search Result,2026-06-01,6 ม.ค. 2026,East Ernad SCB Mscore - แอปพลิเคชันใน ...,https://play.google.com/store/apps/details?id=com.mscore.easternad&hl=th,แอปพลิเคชัน Mscore Mobile Banking ของ SCB สาขา East Ernad ช่วยให้คุณเข้าถึงบัญชีของคุณบนโทรศัพท์ Android ได้แล้ว คุณสามารถทำธุรกรรมทางการเงินได้จากทุกที่ทุกเวลา!,play.google.com
Organic Search Result,2026-06-01,Unknown,สำรวจเทรนด์ธุรกิจไทยปี 2026: K-Shape Recovery,https://www.tiktok.com/@scbthailand/video/7597003111324011796,"55 ถูกใจ,วิดีโอ TikTok จาก SCB Thailand (@scbthailand): ""ค้นพบกลุ่มธุรกิจที่เติบโตและกลุ่มที่ต้องปรับตัวในปี 2026 พร้อมคาดการณ์อนาคตเศรษฐกิจไทย! #เศรษฐกิจไทย #เทรนด์ธุรกิจ ...",www.tiktok.com
Organic Search Result,2026-06-01,26 ม.ค. 2026,วัดกำลัง! KBANK-SCB ใครเด่น?,https://www.hoonvision.com/hoonset/%E0%B8%A7%E0%B8%B1%E0%B8%94%E0%B8%81%E0%B8%B3%E0%B8%A5%E0%B8%B1%E0%B8%87-kbank-scb-%E0%B9%83%E0%B8%84%E0%B8%A3%E0%B9%80%E0%B8%94%E0%B9%88%E0%B8%99/,หุ้นวิชั่น – บล.เอเชียพลัส ระบุว่า สำหรับบทวิเคราะห์ฉบับนี้ เป็นการวัดกันระหว่าง KBANK กับ SCB ว่าใครน่าสนใจกว่ากัน ทั้งในมุมงบ 4Q68 รวมถึงโอกาสในอนาคต และ Valuation. *Impact Insight.,www.hoonvision.com
Organic Search Result,2026-06-01,21 ม.ค. 2026,SCB ปี 68 กำไรสุทธิ 4.74 หมื่นลบ. เติบโต 8% หลัง ...,https://www.share2trade.com/news/52096/scb-%E0%B8%9B%E0%B8%B5-68-%E0%B8%81%E0%B8%B3%E0%B9%84%E0%B8%A3%E0%B8%AA%E0%B8%B8%E0%B8%97%E0%B8%98%E0%B8%B4-474-%E0%B8%AB%E0%B8%A1%E0%B8%B7%E0%B9%88%E0%B8%99%E0%B8%A5%E0%B8%9A-%E0%B9%80%E0%B8%95%E0%B8%B4%E0%B8%9A%E0%B9%82%E0%B8%95-8-%E0%B8%AB%E0%B8%A5%E0%B8%B1%E0%B8%87%E0%B8%81%E0%B8%B3%E0%B9%84%E0%B8%A3%E0%B9%80%E0%B8%87%E0%B8%B4%E0%B8%99%E0%B8%A5%E0%B8%87%E0%B8%97%E0%B8%B8%E0%B8%99%E0%B9%80%E0%B8%9E%E0%B8%B4%E0%B9%88%E0%B8%A1%E0%B8%82%E0%B8%B6%E0%B9%89%E0%B8%99-%E0%B8%A3%E0%B8%B2%E0%B8%A2%E0%B9%84%E0%B8%94%E0%B9%89%E0%B8%84%E0%B9%88%E0%B8%B2%E0%B8%98%E0%B8%A3%E0%B8%A3%E0%B8%A1%E0%B9%80%E0%B8%99%E0%B8%B5%E0%B8%A2%E0%B8%A1%E0%B8%AB%E0%B8%99%E0%B8%B8%E0%B8%99%E0%B8%9E%E0%B8%B8%E0%B9%88%E0%B8%87,"นายอาทิตย์ นันทวิทยา ประธานเจ้าหน้าที่บริหาร บริษัท เอสซีบี เอกซ์ จำกัด (มหาชน) หรือ SCB เปิดเผยว่า ผลประกอบการปี 2568 ของบริษัทมีกำไรสุทธิ 47,488 ล้านบาท เพิ่มขึ้น 8.1% จากปีก่อน จากการเพิ่มขึ้น ...",www.share2trade.com
Organic Search Result,2026-06-01,1 ม.ค. 2026,สิทธิพิเศษสำหรับบัตรเครดิต CardX และ SCB - Amway,https://amway.co.th/landing/creditcard-scb-fullypaid?srsltid=AfmBOopGUrUweNynB1LfXcuUUakez_ZUwtkmmSuE-0U64GTOV-t1Uu9H,*ยกเว้น บัตรเครดิต CardX FAMILY PLUS / SCB FAMILY PLUS. *ไม่จำกัดจำนวนคะแนนเพื่อแลกรับเครดิตเงินคืน. *คะแนน POINTX ที่สามารถแลกได้ จะต้องเป็นคะแนนที่ยังคงอยู่ในบัตร ...,amway.co.th
Organic Search Result,2026-06-01,21 ม.ค. 2026,SCB โชว์กำไรปี 2568 แตะ 4.7 หมื่นล้าน โต 8% รับพอร์ตลงทุน ...,https://today.line.me/th/v3/article/NvRljXp,บริษัท เอสซีบี เอกซ์ จำกัด (มหาชน) หรือหุ้น SCB ประกาศมีกําไรสุทธิอยู่ที่ 47488 ล้านบาทในปี 2568 เพิ่มขึ้น 8.1% ทั้งจากพอร์ตการลงทุนของธนาคารและ S...,today.line.me
Organic Search Result,2026-06-01,21 ม.ค. 2026,SCB PRIME - Travel Insurance,https://www.scb.co.th/th/scbprime/prime-privileges/travel-experiences/travel-insurance,รับส่วนลดเบี้ยประกัน 15% เมื่อสมัครประกันเดินทางต่างประเทศ รายปีผ่านแอป SCB EASY.,www.scb.co.th
Organic Search Result,2026-06-01,Unknown,"""SCB"" กำไรพุ่ง 4.7 หมื่นล้าน ตั้งสำรองลด | TNN ชั่วโมงทำเงิน | 22 ...",https://www.youtube.com/watch?v=631Xv9rLAQQ,"""SCB"" กำไรพุ่ง 4.7 หมื่นล้าน ตั้งสำรองลด | TNN ชั่วโมงทำเงิน | 22-01-69 . ""SCB"" กำไรพุ่ง 4.7 หมื่นล้าน ตั้งสำรองลด กลุ่ม ""เอสซีบี เอกซ์"" ยานแม่ของธนาคารไทยพาณิยช์ ประกาศงบปี 2568 ...",www.youtube.com
Organic Search Result,2026-06-01,12 ม.ค. 2026,"SCB เตรียมพร้อมเปลี่ยนผ่านผู้นำแบงก์หลัง ""กฤษณ์ จันทโนทก"" ...",https://www.infoquest.co.th/2026/560275,โดยกระบวนการสรรหาประธานเจ้าหน้าที่บริหารชย์คนใหม่นั้น ตามแผนการสืบทอดตำแหน่ง (Succession Planning) คณะกรรมการ SCB ร่วมกับ คณะกรรมการ ธนาคารไทยพาณิชย์ ได้พิจารณาคัดเลือกบุคคลที่ ...,www.infoquest.co.th
Organic Search Result,2026-06-01,Unknown,กลุ่ม SCBX โดยธนาคารไทยพาณิชย์จัดโครงการ “ของ (ขวัญ) พี่ให้ ...,https://www.facebook.com/scb.thailand/videos/%E0%B8%82%E0%B8%AD%E0%B8%87-%E0%B8%82%E0%B8%A7%E0%B8%B1%E0%B8%8D-%E0%B8%9E%E0%B8%B5%E0%B9%88%E0%B9%83%E0%B8%AB%E0%B9%89%E0%B8%99%E0%B9%89%E0%B8%AD%E0%B8%87%E0%B8%9B%E0%B8%B5%E0%B8%97%E0%B8%B5%E0%B9%88-7/1365740594742855/,ตอนนี้แอ๊ปเข้าไม่ได้ 17.36. 5mo. SCB Thailand. 󱢏. ขณะนี้บริการแอป SCB EASY ทำรายการได้ปกติค่ะ หากท่านไม่สามารถเข้าใช้งานหรือโอนเงินไ ด้ ขอแนะนำวิธีแก้ไขเบื้องต้นดังนี้ค่ะ 1.ปิดการใช้งานแอป ...,www.facebook.com
Organic Search Result,2026-06-01,Unknown,SCB x FWD Saving to Ninety 90/9 - Life Insurance #scbxfwd ...,https://www.instagram.com/reel/DThIeHUk7Uu/,"17 likes, 0 comments - natthiness on January 14, 2026: ""SCB x FWD Saving to Ninety 90/9 - Life Insurance #scbxfwd #scb Talent @sossss24 Mua @natthiness ...",www.instagram.com
Organic Search Result,2026-06-01,16 ม.ค. 2026,SCBX ก้าวขึ้นสู่อันดับ 6 “Top 50 Companies in Thailand 2026 ...,https://www.scbx.com/th/news/rank-6-company-to-work/,SCB ธุรกิจธนาคารพาณิชย์ SCB 10X ธุรกิจร่วมลงทุนและร่วมสร้างธุรกิจสตาร์ทอัพและเทคโนโลยีทางการเงิน Abacus Digital ธุรกิจวิเคราะห์ข้อมูล โดยใช้กระบวนการ ...,www.scbx.com
