Topic_Type,Date_Extracted,Published_Date,Heading,URL,Body_Snippet,Source_Site
Organic Search Result,2026-06-01,14 ม.ค. 2026,SCB Planet Plus App,https://www.scb.co.th/th/personal-banking/digital-banking/scb-planetplus,1. ดาวน์โหลดแอป SCB PLANET PLUS ได้ที่ App store และ Google Play · 2. เลือก “แอป SCB EASY” เพื่อลงทะเบียนขอใช้บริการ · 3. ระบุรหัส PIN บนแอป SCB EASY เพื่อยืนยันตัวตน · 4. เลือก ...,www.scb.co.th
Organic Search Result,2026-06-01,16 ม.ค. 2026,SCB PRIME - SCB Investment Center,https://www.scb.co.th/th/scbprime/prime-privileges/scb-investment-center,"SCB Investment Center ; ไอคอนสยาม. ชั้น 4. 02-117-2682. 11.00 - 18.00 น. ; เซ็นทรัลเวิลด์. ชั้น 5. 02-255-5744. 11.00 - 18.00 น. ; เซ็นทรัล เอ็มบาสซี. ชั้น 4. 02-160-5750, 02- ...",www.scb.co.th
Organic Search Result,2026-06-01,12 ม.ค. 2026,SCB FIRST - Special Reward Points,https://www.scb.co.th/th/scbfirst/first-privileges/special-reward-point-and-mileade-plus,เพิ่มรางวัลและเพิ่มค่าให้กับทุกยอดการใช้จ่าย รับคะแนนสะสม POINTX Rewards 1 คะแนน สำหรับทุกการใช้จ่าย 25 บาท ผ่านบัตรเครดิต SCB FIRST เพื่อแลกของรางวัลสุดพิเศษได้มากขึ้น และพิเศษยิ่งขึ้นกับของ ...,www.scb.co.th
Organic Search Result,2026-06-01,Unknown,SCB Thailand,https://www.facebook.com/scb.thailand/posts/the-new-chapter-of-your-wealth-%E0%B8%AA%E0%B8%B9%E0%B9%88%E0%B8%84%E0%B8%A7%E0%B8%B2%E0%B8%A1%E0%B9%80%E0%B8%AB%E0%B8%99%E0%B8%B7%E0%B8%AD%E0%B8%A3%E0%B8%B0%E0%B8%94%E0%B8%B1%E0%B8%9A%E0%B8%AD%E0%B8%B5%E0%B8%81%E0%B8%82%E0%B8%B1%E0%B9%89%E0%B8%99%E0%B9%81%E0%B8%AB%E0%B9%88%E0%B8%87%E0%B8%84%E0%B8%A7%E0%B8%B2%E0%B8%A1%E0%B8%A1%E0%B8%B1%E0%B9%88%E0%B8%87%E0%B8%84%E0%B8%B1%E0%B9%88%E0%B8%87-%E0%B8%A3%E0%B8%B1%E0%B8%9A%E0%B8%AA%E0%B8%B4%E0%B8%97%E0%B8%98%E0%B8%B4/1360749642757485/,ขณะนี้บริการ SCB EASY App ทำรายการได้ปกติค่ะ หากท่านไม่สามารถเข้าใช้งานหรือโอนเงินได้ ขอแนะนำวิธีแก้ไขเบื้องต้นดังนี้ค่ะ 1.ปิดการใช้งาน SCB EASY App แล้วทดลองเข้าใช้งานใหม่อีกครั้ง 2.,www.facebook.com
Organic Search Result,2026-06-01,21 ม.ค. 2026,เริ่มต้นชีวิตการเงินอย่างมั่นใจ ด้วยบัตรเดบิตใบแรกของคุณ,https://www.scb.co.th/th/personal-banking/stories/tips-for-you/smart-start-debit-card,เริ่มใช้บริการดิจิทัล — ผูกบัตรกับแอป SCB EASY เพื่อจ่ายบริหารวงเงิน และเปิด/ปิดการใช้งานออนไลน์ได้ทันที (เช่น เปิดการใช้จ่ายต่างประเทศเมื่อจำเป็น). วิธีการเลือกบัตรเดบิตที่เหมาะสมสำหรับคุณ. บัตรเดบิต ...,www.scb.co.th
Organic Search Result,2026-06-01,Unknown,"ขั้นตอนการลงทะเบียน โครงการ ""ปิดหนี้ไว ไปต่อได้"" สำหรับลูกค้า ...",https://www.facebook.com/scb.thailand/posts/%E0%B8%82%E0%B8%B1%E0%B9%89%E0%B8%99%E0%B8%95%E0%B8%AD%E0%B8%99%E0%B8%81%E0%B8%B2%E0%B8%A3%E0%B8%A5%E0%B8%87%E0%B8%97%E0%B8%B0%E0%B9%80%E0%B8%9A%E0%B8%B5%E0%B8%A2%E0%B8%99-%E0%B9%82%E0%B8%84%E0%B8%A3%E0%B8%87%E0%B8%81%E0%B8%B2%E0%B8%A3-%E0%B8%9B%E0%B8%B4%E0%B8%94%E0%B8%AB%E0%B8%99%E0%B8%B5%E0%B9%89%E0%B9%84%E0%B8%A7-%E0%B9%84%E0%B8%9B%E0%B8%95%E0%B9%88%E0%B8%AD%E0%B9%84%E0%B8%94%E0%B9%89%E0%B8%AA%E0%B8%B3%E0%B8%AB%E0%B8%A3%E0%B8%B1%E0%B8%9A%E0%B8%A5%E0%B8%B9%E0%B8%81%E0%B8%84%E0%B9%89%E0%B8%B2-scb-%E0%B8%AB%E0%B8%B2%E0%B8%81%E0%B8%A1%E0%B8%B5%E0%B8%82%E0%B9%89%E0%B8%AD%E0%B8%AA%E0%B8%87%E0%B8%AA%E0%B8%B1%E0%B8%A2%E0%B8%AB%E0%B8%A3%E0%B8%B7%E0%B8%AD/1357551759743940/,"ขั้นตอนการลงทะเบียน โครงการ ""ปิดหนี้ไว ไปต่อได้"" สำหรับลูกค้า SCB หากมีข้อสงสัยหรือต้องการคำแนะนำเพิ่มเติม ติดต่อได้ที่ 02-777-7777 กด 99 ⚠️...",www.facebook.com
Organic Search Result,2026-06-01,22 ม.ค. 2026,SCBX ผนึกกำลัง KakaoBank และ WeBank Technology ...,https://www.scbx.com/th/news/scbx-kakaobank-webank-virtual-bank/,ธุรกิจธนาคารพาณิชย์ SCB 10X ธุรกิจร่วมลงทุนและร่วมสร้างธุรกิจสตาร์ทอัพและเทคโนโลยีทางการเงิน Abacus Digital ธุรกิจวิเคราะห์ข้อมูล โดยใช้กระบวนการวิเคราะห์ข้อมูลขั้นสูง (Advanced Data ...,www.scbx.com
Organic Search Result,2026-06-01,23 ม.ค. 2026,KS : SCB เงินปันผลดี แต่ upside จำกัด,https://www.kasikornsecurities.com/th/research/thai-stocks/company-analysis/research-20260123-476,✓SCB รายงานกำไรไตรมาส 4/2568 ที่ 1.01 หมื่นลบ. ลดลง 16% QoQ และ 13% YoY ผล ... ✓SCB ยังประกาศเป้าหมายทางการเงินปี 2569 ผ่านเว็บไซต์ตลาดหลักทรัพย์ฯ โดยประกอบด้วย,www.kasikornsecurities.com
Organic Search Result,2026-06-01,20 ม.ค. 2026,Fund Nav | SCB Asset Management ...,https://www.scbam.com/en/fund/nav,SCB TREASURY MONEY PLUS OPEN END FUND (CLASS B). Code. SCBTMFPLUS-B. Date. 28/05/2026. Value*. 11.7102. Change*. 0.0002. Change (%). 0.0017. Bid*. 11.7103 ...,www.scbam.com
Organic Search Result,2026-06-01,Unknown,ทุกการใช้จ่าย…คุ้มขึ้นได้ ด้วยบัตร Debit LET’S SCB ที่มีดีลส่วนลด ...,https://www.facebook.com/scb.thailand/videos/%E0%B8%97%E0%B8%B8%E0%B8%81%E0%B8%81%E0%B8%B2%E0%B8%A3%E0%B9%83%E0%B8%8A%E0%B9%89%E0%B8%88%E0%B9%88%E0%B8%B2%E0%B8%A2%E0%B8%84%E0%B8%B8%E0%B9%89%E0%B8%A1%E0%B8%82%E0%B8%B6%E0%B9%89%E0%B8%99%E0%B9%84%E0%B8%94%E0%B9%89-%E0%B8%94%E0%B9%89%E0%B8%A7%E0%B8%A2%E0%B8%9A%E0%B8%B1%E0%B8%95%E0%B8%A3-debit-lets-scb-%E0%B8%97%E0%B8%B5%E0%B9%88%E0%B8%A1%E0%B8%B5%E0%B8%94%E0%B8%B5%E0%B8%A5%E0%B8%AA%E0%B9%88%E0%B8%A7%E0%B8%99%E0%B8%A5%E0%B8%94%E0%B8%9E%E0%B8%B2%E0%B8%A3%E0%B9%8C%E0%B8%97%E0%B9%80%E0%B8%99%E0%B8%AD%E0%B8%A3%E0%B9%8C%E0%B9%80%E0%B8%A2%E0%B8%AD%E0%B8%B0%E0%B8%A1%E0%B8%B2%E0%B8%81/1800921823915003/,󱢏. ขณะนี้บริการ SCB EASY App ทำรายการได้ปกติค่ะ หากท่านไม่สามารถเข้าใช้งานหรือโอนเงินไ ด้ ...,www.facebook.com
Organic Search Result,2026-06-01,30 ม.ค. 2026,SCB Thailand (@scb_thailand),https://www.threads.com/@scb_thailand,เข้าแอป SCB EASY ก็รู้ยอดเงินคงเหลือในบัญชีเองได้ทันที ไม่ต้องไปแบงก์ มีเวลาไปอิ่มฟินต่อกับอาหารจานโปรด 🍽️. เช็กยอดเงินคงเหลือ เงินเข้า-ออก แค่คลิกแอป SCB EASY หรือพิมพ์ “เช็กยอดเงินฝาก ...,www.threads.com
Organic Search Result,2026-06-01,1 ม.ค. 2026,CardX | Mass Rapid Transit Authority of Thailand,https://www.mrta.co.th/en/promotion/18592,บัตรเครดิต CardX และ บัตรเครดิต SCB รับเครดิตเงินคืน สูงสุด 15%*/**เมื่อแตะจ่าย ด้วยบัตรเครดิตคาร์ดเอกซ์ หรือรูดจ่าย ที่ห้องออกบัตรโดยสาร ตั้งแต่ 300 บาทขึ้นไปต่อใบเสร็จ.,www.mrta.co.th
Organic Search Result,2026-06-01,23 ม.ค. 2026,10 บัตรเครดิต SCB อันไหนดี ปี 2026 อนุมัติเร็ว วงเงินสูง,https://th.my-best.com/50568,"บัตรเครดิต SCB เป็นบัตรที่ออกโดยธนาคารไทยพาณิชย์ (SCB) และปัจจุบันดำเนินการโดย CardX มาพร้อมสิทธิประโยชน์หลากหลาย เช่น สะสมคะแนน, เครดิตเงินคืน, หรือส่วนลดพิเศษในหมวดหมู่ต่างๆ เช่น ...",th.my-best.com
Organic Search Result,2026-06-01,1 ม.ค. 2026,โปรโมชั่นและอีเวนต์ - สิทธิพิเศษสำหรับบัตรเครดิต CardX และ SCB,https://powerpass.kingpower.com/th/promotions/bankpromotion-alllocation-scb-2026,บัตรเครดิต CardX และบัตรเครดิต SCB WEALTH by CardX หมายรวมถึงบัตรเครดิตของธนาคารไทยพาณิชย์ จำกัด (มหาชน) (“ธนาคาร”) ที่โอนธุรกิจไปยังคาร์ดเอกซ์ซึ่งยังไม่ได้เปลี่ยนหน้าบัตรใหม่ด้วย; ผู้ถือบัตร ...,powerpass.kingpower.com
Organic Search Result,2026-06-01,22 ม.ค. 2026,SCB CardX - My Lotus's - โลตัส,https://my.lotuss.com/partner/bank-scb/th,บัตรเครดิต CardX และ SCB จัดโปรฮีลใจต้อนรับ PAYDAY ให้คุณช้อปคุ้มๆ ที่ โลตัส ทุกสาขา และโลตัสออนไลน์. arrow-up. Logo. download-apple ...,my.lotuss.com
Organic Search Result,2026-06-01,16 ม.ค. 2026,SCB PRIME - SCB Investment Center,https://www.scb.co.th/th/scbprime/prime-privileges/scb-investment-center,"SCB Investment Center ; ไอคอนสยาม. ชั้น 4. 02-117-2682. 11.00 - 18.00 น. ; เซ็นทรัลเวิลด์. ชั้น 5. 02-255-5744. 11.00 - 18.00 น. ; เซ็นทรัล เอ็มบาสซี. ชั้น 4. 02-160-5750, 02- ...",www.scb.co.th
Organic Search Result,2026-06-01,Unknown,"ขั้นตอนการลงทะเบียน โครงการ ""ปิดหนี้ไว ไปต่อได้"" สำหรับลูกค้า ...",https://www.facebook.com/scb.thailand/posts/%E0%B8%82%E0%B8%B1%E0%B9%89%E0%B8%99%E0%B8%95%E0%B8%AD%E0%B8%99%E0%B8%81%E0%B8%B2%E0%B8%A3%E0%B8%A5%E0%B8%87%E0%B8%97%E0%B8%B0%E0%B9%80%E0%B8%9A%E0%B8%B5%E0%B8%A2%E0%B8%99-%E0%B9%82%E0%B8%84%E0%B8%A3%E0%B8%87%E0%B8%81%E0%B8%B2%E0%B8%A3-%E0%B8%9B%E0%B8%B4%E0%B8%94%E0%B8%AB%E0%B8%99%E0%B8%B5%E0%B9%89%E0%B9%84%E0%B8%A7-%E0%B9%84%E0%B8%9B%E0%B8%95%E0%B9%88%E0%B8%AD%E0%B9%84%E0%B8%94%E0%B9%89%E0%B8%AA%E0%B8%B3%E0%B8%AB%E0%B8%A3%E0%B8%B1%E0%B8%9A%E0%B8%A5%E0%B8%B9%E0%B8%81%E0%B8%84%E0%B9%89%E0%B8%B2-scb-%E0%B8%AB%E0%B8%B2%E0%B8%81%E0%B8%A1%E0%B8%B5%E0%B8%82%E0%B9%89%E0%B8%AD%E0%B8%AA%E0%B8%87%E0%B8%AA%E0%B8%B1%E0%B8%A2%E0%B8%AB%E0%B8%A3%E0%B8%B7%E0%B8%AD/1357551759743940/,"ขั้นตอนการลงทะเบียน โครงการ ""ปิดหนี้ไว ไปต่อได้"" สำหรับลูกค้า SCB หากมีข้อสงสัยหรือต้องการคำแนะนำเพิ่มเติม ติดต่อได้ที่ 02-777-7777 กด 99 ⚠️...",www.facebook.com
Organic Search Result,2026-06-01,13 ม.ค. 2026,port SCB - SO GREEN,https://sogreen.asia/port-scb/,Courtyard SCB Bank. ผลงานการจัดสวน อาคาร ธนาคารไทยพาณิชย์ สำนักงานใหญ่. “ ตาข่ายดักทรัพย์ “ ( The Catcher ) เป็นสัญลักษณ์แห่งความมั่งคั่ง มั่งมี ร่ำรวย ...,sogreen.asia
Organic Search Result,2026-06-01,1 ม.ค. 2026,คู่มือการใช้งาน SCB Academy - สำนัก สุขภาพ ดิจิทัล,https://bdh.moph.go.th/site/wp-content/uploads/2025/12/%E0%B8%84%E0%B8%B9%E0%B9%88%E0%B8%A1%E0%B8%B7%E0%B8%AD%E0%B8%81%E0%B8%B2%E0%B8%A3%E0%B9%83%E0%B8%8A%E0%B9%89%E0%B8%87%E0%B8%B2%E0%B8%99-SCB-Academy.pdf,หัวข้อ. หน้า. ขันตอนการเข้าสู่ระบบ.................................................................................................... 3. ขันตอนการลงทะเบียนหลักสูตร.,bdh.moph.go.th
Organic Search Result,2026-06-01,1 ม.ค. 2026,บัตรเครดิต ไม่มีค่าธรรมเนียมรายปี CardX UP2ME รับคะแนน X3 ...,https://www.cardx.co.th/credit-card/details/cardx-up2me,CardX UP2ME บัตรเครดิตคะแนน X3 ยกระดับประสบการณ์การให้บริการบัตรเครดิตที่ ฟรีค่าธรรมเนียม และให้อิสระในการเลือกกำหนดหมวดการใช้จ่ายเพื่อรับคะแนนสะสมเองได้ สมัครง่ายผ่านแอป SCB EASY.,www.cardx.co.th
Organic Search Result,2026-06-01,14 ม.ค. 2026,ผู้จัดการรักษาความปลอดภัย - SCB – Siam Commercial Bank,https://bebee.com/th/jobs/scb-siam-commercial-bank-bangkok-bangkok-city--theirstack-685117586,"SCB – Siam Commercial Bank · การเงินและประกันภัย. 3,294 ประกาศ.",bebee.com
Organic Search Result,2026-06-01,23 ม.ค. 2026,Economic outlook / SCB EIC Monthly insight / ประเด็น ...,https://www.scbeic.com/th/detail/product/eic-monthly-0126,SCB EIC ประเมินเศรษฐกิจไทยปี 2026 จะโตต่ำเพียง 1.5% โดยเฉพาะช่วงครึ่งแรกของปีที่เศรษฐกิจไทยจะขยายตัวในอัตราต่ำกว่า 1%,www.scbeic.com
Organic Search Result,2026-06-01,19 ม.ค. 2026,Newsroom,https://www.scb10x.com/news,"SCB 10X ประกาศจัดงาน “REDeFiNE TOMORROW 2026” เวทีสัมมนา DeFi & Web3 ระดับโลก ครั้งที่ 7 · SCB 10X Invests in Gradient Fund V, Expanding Global AI Investment Strategy.",www.scb10x.com
Organic Search Result,2026-06-01,4 ม.ค. 2026,SCB เปิด 3 นวัตกรรม AI มุ่งสู่เบอร์ 1 ด้านดิจิทัลแบงก์,https://www.beartai.com/watch/scb-%E0%B9%80%E0%B8%9B%E0%B8%B4%E0%B8%94-3-%E0%B8%99%E0%B8%A7%E0%B8%B1%E0%B8%95%E0%B8%81%E0%B8%A3%E0%B8%A3%E0%B8%A1-ai-%E0%B8%A1%E0%B8%B8%E0%B9%88%E0%B8%87%E0%B8%AA%E0%B8%B9%E0%B9%88%E0%B9%80%E0%B8%9A/,SCB ปักธงผู้นำดิจิทัลแบงก์ พัฒนาบริการที่เข้าถึงใจเข้าถึงคุณ ตอกย้ำกลยุทธ์ Digital Bank with Human Touch เสริมแกร่งด้วย Al 360 องศาเพื่อยกระดับประสบการณ์ทางการเงิน เปิดตัว 3 นวัตกรรม 1.,www.beartai.com
Organic Search Result,2026-06-01,28 ม.ค. 2026,Telesales - Myworkdayjobs.com,https://peopleplus.wd3.myworkdayjobs.com/en-US/SCB_Careers/job/Telesales_JR-0064170,"If you are an active SCB employee, please apply through Workday by searching ""Find Jobs"". If this is your first time applying you will need to create a ...",peopleplus.wd3.myworkdayjobs.com
Organic Search Result,2026-06-01,Unknown,ขณะนี้บริการแอป SCB EASY ทำรายการได้ปกติค่ะ หากท่านไม่ ...,https://x.com/scb_thailand/status/2017593940514640033,ขณะนี้บริการแอป SCB EASY ทำรายการได้ปกติค่ะ หากท่านไม่สามารถเข้าใช้งานหรือโอนเงินได้ ขอแนะนำวิธีแก้ไขเบื้องต้นดังนี้ค่ะ 1. ปิดการใช้งานแอป SCB EASY แล้วทดลองเข้าใช้งานใหม่อีกครั้ง,x.com
Organic Search Result,2026-06-01,24 ม.ค. 2026,SCB สรุปคำแนะนำการลงทุนและประมาณการกำไร,https://thunhoon.com/scb250126,#ทันหุ้น #SCB รวมข้อมูลบทวิเคราะห์จากบริษัทหลักทรัพย์ สรุปคำแนะนำการลงทุน ราคาเป้าหมาย และประมาณการผลการดำเนินงาน.,thunhoon.com
Organic Search Result,2026-06-01,21 ม.ค. 2026,SCB กำไรปี 68 โต 8.1% แตะ 4.74 หมื่นลบ.,https://www.hoonvision.com/hoonset/scb-%E0%B8%81%E0%B8%B3%E0%B9%84%E0%B8%A3%E0%B8%9B%E0%B8%B5-68-%E0%B9%82%E0%B8%95-8-1-%E0%B9%81%E0%B8%95%E0%B8%B0-4-74-%E0%B8%AB%E0%B8%A1%E0%B8%B7%E0%B9%88%E0%B8%99%E0%B8%A5%E0%B8%9A/,"หุ้นวิชั่น-ทีมข่าวหุ้นวิชั่น รายงาน บริษัท เอสซีบี เอกซ์ จำกัด (มหาชน) หรือ SCB เปิดเผยว่า บริษัทฯ มีกำไรสุทธิปี 2568 จำนวน 47,488 ล้านบาท เพิ่มขึ้น 8.1% จากปีก่อน ...",www.hoonvision.com
Organic Search Result,2026-06-01,20 ม.ค. 2026,โดนอายัดบัญชี ของscb ทำยังไงได้บ้างง,https://pantip.com/topic/43046984,สวัสดีค่ะ บัญชี scb พึ่งโดนอายัตเมื่อคืนที่ผ่านมา เช้ามาเลยโทรถาม 02-777-7777 เขาแจ้งกับมาว่า บัญชีถูกอายัตจากหน่วยงานราชการ ทั้งๆ ที่เรายังไม่ได้ทำอะไรเลย มีวิธีแก้หรือต้องทำอย่างไรบ้าง ...,pantip.com
Organic Search Result,2026-06-01,6 ม.ค. 2026,Booking,https://branch-register-az.scb.co.th/,SCB Logo. ระบบจองเวลาเข้ารับบริการที่สาขา. 1. เลือกประเภท. บริการ เลือกสาขาและ. วันเข้ารับบริการ. ข้อมูล. ผู้เข้ารับบริการ. ตรวจสอบ. ข้อมูล. เลือกประเภทบริการ. ประเภท ...,branch-register-az.scb.co.th
Organic Search Result,2026-06-01,Unknown,🍵 มีแอป SCB EASY มีเวลาดี ๆ ทุกวัน รวมหลากหลายบริการทาง ...,https://www.instagram.com/p/DUC8mHmE-d_/,สิ้นเดือน... เหมือนสิ้นใจ น่ากินจัง... แต่เงินจะมีพอไหม? FISH STEAK SCB EASY เช็กยอดเงินผ่านแอป SCB EASY... รู้ยอดเงินคงเหลือ มีเวลาอร่อยฟินต่อได้ทันที ...,www.instagram.com
Organic Search Result,2026-06-01,Unknown,ถ้าอยากรู้เลขบัญชีสินเชื่อบ้าน สินเชื่อรถของ SCB ดูได้เองง่าย ๆ ผ่าน ...,https://www.instagram.com/reel/DULC-rLkyTw/,"English Transcript. Want to know your own SCB loan account number? Do it easily yourself on LINE SCB Connect. Follow these steps. Press the Manage Data menu, ...",www.instagram.com
Organic Search Result,2026-06-01,22 ม.ค. 2026,SCB Grow Together ปรับพอร์ตเดือนมกราคม 2026 : เพิ่มตราสาร ...,https://www.finnomena.com/scbam/scb-grow-together-jan-2026/,SCB Grow Together ปรับพอร์ตเดือนมกราคม 2026 : เพิ่มตราสารหนี้โลก และหุ้นเทคโนโลยีจีน · มุมมองการลงทุน (January 2026) · การปรับพอร์ต.,www.finnomena.com
Organic Search Result,2026-06-01,28 ม.ค. 2026,SCB Financial Markets คาดกรอบเงินบาท 31.00-31.25 บ. ...,https://today.line.me/th/v3/article/LXpG9Y0,กลุ่มงานตลาดการเงิน ธนาคารไทยพาณิชย์ (SCB Financial Markets) ประเมินค่าเงินบาทวันนี้เคลื่อนไหวในกรอบ 31.00-31.25 บาท/ดอลลาร์.,today.line.me
Organic Search Result,2026-06-01,Unknown,เมื่อโลกกำลังเปลี่ยนไป พอร์ตการลงทุนต้องปรับตาม | Mission ...,https://www.facebook.com/scb.thailand/videos/%E0%B9%80%E0%B8%A1%E0%B8%B7%E0%B9%88%E0%B8%AD%E0%B9%82%E0%B8%A5%E0%B8%81%E0%B8%81%E0%B8%B3%E0%B8%A5%E0%B8%B1%E0%B8%87%E0%B9%80%E0%B8%9B%E0%B8%A5%E0%B8%B5%E0%B9%88%E0%B8%A2%E0%B8%99%E0%B9%84%E0%B8%9B-%E0%B8%9E%E0%B8%AD%E0%B8%A3%E0%B9%8C%E0%B8%95%E0%B8%81%E0%B8%B2%E0%B8%A3%E0%B8%A5%E0%B8%87%E0%B8%97%E0%B8%B8%E0%B8%99%E0%B8%95%E0%B9%89%E0%B8%AD%E0%B8%87%E0%B8%9B%E0%B8%A3%E0%B8%B1%E0%B8%9A%E0%B8%95%E0%B8%B2%E0%B8%A1-mission-investable/1200659542045572/,More videos you may like. พาเดินเที่ยว PLAKA ย่านเก่าแก่ของ ...,www.facebook.com
Organic Search Result,2026-06-01,15 ม.ค. 2026,‎Krungthai NEXT - You Might Also Like - App Store - Apple,https://apps.apple.com/kw/app/krungthai-next/id436753378?see-all=customers-also-bought-apps&platform=iphone,krungsri · SCB EASY · ttb touch · Bangkok Bank Mobile Banking · K PLUS · MAKE by KBank แอปจัดการเงิน · BAAC Mobile.,apps.apple.com
Organic Search Result,2026-06-01,Unknown,"SCB, a leading dividend-paying stock, offers an 8% dividend ...",https://www.youtube.com/watch?v=SaxPiRf59b0,SCB หุ้นปันผลตัวแม่ DIV Yield 8% คุม NPL อยู่หมัด อยู่หมัด 00:00 โบรกฯเชียร์ซื้อ SCB 00:24 เปิดรายการ 00:40 3 เหตุผลที่ทำไมควรซื้อ 01:49 ราคาเป้าหมาย #infoquest #STOCK WATCH ...,www.youtube.com
Organic Search Result,2026-06-01,9 ม.ค. 2026,จับตา SCB ปันผลครึ่งหลังปี 68 โบรกฯ ชี้ยีลด์เด่นกว่า 6.5% คาด ...,https://www.share2trade.com/news/51774/%E0%B8%88%E0%B8%B1%E0%B8%9A%E0%B8%95%E0%B8%B2-scb-%E0%B8%9B%E0%B8%B1%E0%B8%99%E0%B8%9C%E0%B8%A5%E0%B8%84%E0%B8%A3%E0%B8%B6%E0%B9%88%E0%B8%87%E0%B8%AB%E0%B8%A5%E0%B8%B1%E0%B8%87%E0%B8%9B%E0%B8%B5-68-%E0%B9%82%E0%B8%9A%E0%B8%A3%E0%B8%81%E0%B8%AF-%E0%B8%8A%E0%B8%B5%E0%B9%89%E0%B8%A2%E0%B8%B5%E0%B8%A5%E0%B8%94%E0%B9%8C%E0%B9%80%E0%B8%94%E0%B9%88%E0%B8%99%E0%B8%81%E0%B8%A7%E0%B9%88%E0%B8%B2-65-%E0%B8%84%E0%B8%B2%E0%B8%94%E0%B8%88%E0%B9%88%E0%B8%B2%E0%B8%A2%E0%B8%AA%E0%B8%B9%E0%B8%87%E0%B8%96%E0%B8%B6%E0%B8%87%E0%B8%AB%E0%B8%B8%E0%B9%89%E0%B8%99%E0%B8%A5%E0%B8%B0-919-%E0%B8%9A%E0%B8%B2%E0%B8%97,ขณะที่นักวิเคราะห์บริษัทหลักทรัพย์พายจำกัด (มหาชน) แนะนำ ซื้อราคาเป้าหมาย 146.00 บาท โดยคาดกำไรสุทธิปี 2568 เติบโต 10% แต่จะปรับลดลง 2% ในปี 2569 จุดเด่นของ SCB อยู่ที่คุณภาพสินเชื่อแข็งแกร่ง ...,www.share2trade.com
