Topic_Type,Date_Extracted,Published_Date,Heading,URL,Body_Snippet,Source_Site
Organic Search Result,2026-06-01,1 ม.ค. 2026,SCB PRIVATE BANKING - After You,https://www.scb.co.th/th/privatebanking/private-privileges/dining-experiences/lifestyle-dining/after-you,ธนาคารขอสงวนสิทธิ์ในการมอบสิทธิประโยชน์นี้ให้แก่ผู้ถือบัตรเครดิต SCB PRIVATE BANKING บัตรหลักที่เปิดใช้งานบัตรแล้ว และมียอดเงินฝาก และ/หรือ เงินลงทุนกับธนาคาร เฉลี่ยในเดือนก่อนหน้าเดือนที่ใช้เอกสิทธิ์ ...,www.scb.co.th
Organic Search Result,2026-06-01,16 ม.ค. 2026,SCBX ก้าวขึ้นสู่อันดับ 6 “Top 50 Companies in Thailand 2026 ...,https://investor.scbx.com/th/newsroom/press-releases/187762/scbx-ranks-6th-position-as-most-attractive-employer-among-new-generation-workforces-in-top-50-companies-in-thailand-2026,SCB · ไปที่ www.scbx.com · ค้นหา. th. EN · ภาพรวมธุรกิจ; ข้อมูลทางการเงิน. ข้อมูลสำคัญทางการเงิน · รายงานประจำรายไตรมาส · Factsheets. รายงานและเอกสารนำเสนอ. รายงาน ...,investor.scbx.com
Organic Search Result,2026-06-01,2 ม.ค. 2026,โม โม พาราไดซ์,https://www.cardx.co.th/credit-card/promotion/mo-mo-paradise-mar26-usc07,"บัตรเครดิต SCB PRIVATE BANKING / SCB FIRST / SCB PRIME : เมื่อมียอดใช้จ่ายตั้งแต่ 2,000 บาทขึ้นไป/เซลล์สลิป รับเครดิตเงินคืน 200 บาท*. บัตรเครดิต CardX ทุก ...",www.cardx.co.th
Organic Search Result,2026-06-01,Unknown,เปิดตัว SCB PLANET VISA Limited Edition หน้าบัตรใหม่ลาย FIFA ...,https://www.youtube.com/shorts/qEH1XbhU3TI,สายบอลตัวจริง ต้องมี! เปิดตัว SCB PLANET VISA Limited Edition หน้าบัตรใหม่ลาย FIFA World Cup(TM) Official Trophy จำนวนจำกัด สมัครได้แล้ว ตั้งแต่ 1 ธันวาคม 2568 – 31 มกราคม ...,www.youtube.com
Organic Search Result,2026-06-01,Unknown,ทุกการใช้จ่าย…คุ้มขึ้นได้ ด้วยบัตร Debit LET'S SCB ที่มี ...,https://www.facebook.com/scb.thailand/posts/%E0%B8%97%E0%B8%B8%E0%B8%81%E0%B8%81%E0%B8%B2%E0%B8%A3%E0%B9%83%E0%B8%8A%E0%B9%89%E0%B8%88%E0%B9%88%E0%B8%B2%E0%B8%A2%E0%B8%84%E0%B8%B8%E0%B9%89%E0%B8%A1%E0%B8%82%E0%B8%B6%E0%B9%89%E0%B8%99%E0%B9%84%E0%B8%94%E0%B9%89-%E0%B8%94%E0%B9%89%E0%B8%A7%E0%B8%A2%E0%B8%9A%E0%B8%B1%E0%B8%95%E0%B8%A3-debit-lets-scb-%E0%B8%97%E0%B8%B5%E0%B9%88%E0%B8%A1%E0%B8%B5%E0%B8%94%E0%B8%B5%E0%B8%A5%E0%B8%AA%E0%B9%88%E0%B8%A7%E0%B8%99%E0%B8%A5%E0%B8%94%E0%B8%9E%E0%B8%B2%E0%B8%A3%E0%B9%8C%E0%B8%97%E0%B9%80%E0%B8%99%E0%B8%AD%E0%B8%A3%E0%B9%8C%E0%B9%80%E0%B8%A2%E0%B8%AD%E0%B8%B0%E0%B8%A1%E0%B8%B2%E0%B8%81/1377689174396865/,SCB Thailand. 󱢏. ขณะนี้บริการ SCB EASY App ทำรายการได้ปกติค่ะ หากท่านไม่สามารถ ...,www.facebook.com
Organic Search Result,2026-06-01,13 ม.ค. 2026,"ประกาศจ่ายเงินปันผลกองทุน กองทุน SCBLT1, SCBLT1-2020, ...",https://www.scbam.com/th/announce/announce-13012026-2,SCB Easy. กองทุนส่วนบุคคล. เกี่ยวกับกองทุนส่วนบุคคล · กองทุนส่วนบุคคล โดย บลจ. ไทยพาณิชย์ · ข่าวสารและกิจกรรม · สาระน่ารู้ กองทุนส่วนบุคคล · SCBAM Private Fund Online.,www.scbam.com
Organic Search Result,2026-06-01,16 ม.ค. 2026,SCBX ก้าวขึ้นสู่อันดับ 6 “Top 50 Companies in Thailand 2026 ...,https://investor.scbx.com/th/newsroom/press-releases/187762/scbx-ranks-6th-position-as-most-attractive-employer-among-new-generation-workforces-in-top-50-companies-in-thailand-2026,SCB · ไปที่ www.scbx.com · ค้นหา. th. EN · ภาพรวมธุรกิจ; ข้อมูลทางการเงิน. ข้อมูลสำคัญทางการเงิน · รายงานประจำรายไตรมาส · Factsheets. รายงานและเอกสารนำเสนอ. รายงาน ...,investor.scbx.com
Organic Search Result,2026-06-01,6 ม.ค. 2026,SCB FIRST - Priority Pass Card,https://www.scb.co.th/th/scbfirst/first-privileges/travel-experiences/airport-lounge-access,ข้อกำหนดและเงื่อนไขการใช้ห้องรับรองพิเศษ ณ สนามบินทั่วโลกผ่านบัตร Priority Pass. ธนาคารขอสงวนสิทธิ์ในการมอบสิทธิประโยชน์นี้ให้แก่ผู้ถือ บัตรเครดิต SCB FIRST บัตรหลักที่เปิดใช้งานบัตรแล้ว และ ...,www.scb.co.th
Organic Search Result,2026-06-01,Unknown,โบนัสก้อนใหญ่ ให้เงินทำงานต่อ เลือกลงทุนอย่างชาญฉลาด ...,https://www.instagram.com/p/DUH_OzZExTh/,ต่อยอดเงินโบนัสให้เติบโต : หุ้นเทคโนโลยีดิจิทัล โอกาสจากโลกเทคโนโลยีแห่งอนาคต ▶️ SCBDIGI ลงทุนหุ้นที่ได้ประโยชน์จากเทคโนโลยี และ Digital Transformation ทั่วโลก ลงทุนง่ายผ่าน SCB EASY ...,www.instagram.com
Organic Search Result,2026-06-01,28 ม.ค. 2026,SCB ค่าเงินบาทวันนี้ 30.80-31.05 บาท/ดอลลาร์,https://www.hoonvision.com/investment/scb-%E0%B8%84%E0%B9%88%E0%B8%B2%E0%B9%80%E0%B8%87%E0%B8%B4%E0%B8%99%E0%B8%9A%E0%B8%B2%E0%B8%97%E0%B8%A7%E0%B8%B1%E0%B8%99%E0%B8%99%E0%B8%B5%E0%B9%89-30-80-31-05-%E0%B8%9A%E0%B8%B2%E0%B8%97-%E0%B8%94/,SCB ค่าเงินบาทวันนี้ 30.80-31.05 บาท/ดอลลาร์. แชร์: Facebook twitter line link คัดลอกลิงค์. เผยแพร่วันที่ 28 มกราคม 2569. หุ้นวิชั่น –กลุ่มงานตลาดการเงิน ...,www.hoonvision.com
Organic Search Result,2026-06-01,8 ม.ค. 2026,จับตา SCB ปันผลครึ่งหลังปี 68 โบรกฯ ชี้ยีลด์เด่นกว่า 6.5% คาด ...,https://today.line.me/th/v3/article/7N9aLPm,จับตา SCBนักวิเคราะห์คาดปันผลเด่น งวดครึ่งหลังปี 2568 จ่อจัดหนัก แจก หุ้นละ 9.19 บาท คิดเป็นยีลด์ 6.5%แถมปี 2568 จ่ายสูงต่อ คาดให้ยีลด์กว่า 8.3% นัก...,today.line.me
Organic Search Result,2026-06-01,28 ม.ค. 2026,SCB Julius Baer Unveils Global Economic Outlook for the ...,https://www.mitihoon.com/2026/01/28/612677/,"Mitihoon - SCB Julius Baer Securities Co., Ltd. hosted an exclusive seminar titled “Global Economic Outlook for the First Half of 2026” (Market Outlook.",www.mitihoon.com
Organic Search Result,2026-06-01,27 ม.ค. 2026,SCB คาดค่าเงินบาทวันนี้ 31.10-31.35 บาท/ดอลลาร์,https://www.hoonvision.com/investment/scb-%E0%B8%84%E0%B8%B2%E0%B8%94%E0%B8%84%E0%B9%88%E0%B8%B2%E0%B9%80%E0%B8%87%E0%B8%B4%E0%B8%99%E0%B8%9A%E0%B8%B2%E0%B8%97%E0%B8%A7%E0%B8%B1%E0%B8%99%E0%B8%99%E0%B8%B5%E0%B9%89-31-10-31-35-%E0%B8%9A-3/,SCB คาดค่าเงินบาทวันนี้ 31.10-31.35 บาท/ดอลลาร์. แชร์: Facebook twitter line link คัดลอกลิงค์. เผยแพร่วันที่ 27 มกราคม 2569. หุ้นวิชั่น –กลุ่มงานตลาดการเงิน ...,www.hoonvision.com
Organic Search Result,2026-06-01,1 ก.พ. 2026,รับส่วนลด 7%* เมื่อจองโรงแรมที่ร่วมรายการผ่าน Hotels.com,https://www.cardx.co.th/credit-card/promotion/hotels-feb26-onc11,**ไม่มียอดใช้จ่ายขั้นต่ำ และไม่จำกัดจำนวนคะแนนเพื่อแลกรับเครดิตเงินคืน. (ยกเว้น บัตรเครดิต CardX FAMILY PLUS / SCB FAMILY PLUS). ช่องทางการลง ...,www.cardx.co.th
Organic Search Result,2026-06-01,Unknown,ตอกย้ำความเชื่อมั่นจาก SCB ที่มอบให้แก่ Easy Money . ธนาคาร ...,https://www.instagram.com/p/DUFZPHqiWpD/,"4 likes, 0 comments - easymoney_th on January 28, 2026: ""ตอกย้ำความเชื่อมั่นจาก SCB ที่มอบให้แก่ Easy Money . ธนาคารไทยพาณิชย์เดินหน้าเสริมความแข็งแกร่งโครงสร้างการเงิน ...",www.instagram.com
Organic Search Result,2026-06-01,Unknown,ขออภัยในความไม่สะดวกค่ะ ขณะนี้บริการ SCB EASY App ...,https://x.com/scb_thailand/status/2016435649184936102,1.ปิดการใช้งาน SCB EASY App แล้วทดลองเข้าใช้งานใหม่อีกครั้ง 2.หากเปิดสัญญาณ WiFi อยู่ แนะนำให้ปิดและเชื่อมต่อโดยสัญญาณอินเทอร์เน็ต ทั้งนี้หากท่านยังไม่สามารถเข้าใช้งานได้ เพื่อให้เจ้าหน้าที่แนะนำขั้น ...,x.com
Organic Search Result,2026-06-01,13 ม.ค. 2026,SCB FIRST - Specialized Value-added Solutions,https://www.scb.co.th/th/scbfirst/first-privileges/wealth-management/specialized-value-added-solutions,และรุ่นรถยนต์ที่ร่วมโครงการได้ที่เจ้าหน้าที่ของธนาคาร; เงื่อนไขการพิจารณาอนุมัติสินเชื่อเป็นไปตามที่ธนาคารกำหนด. คุณสมบัติผู้สมัคร SCB ...,www.scb.co.th
Organic Search Result,2026-06-01,28 ม.ค. 2026,SCBX เปิดตัวรายงาน “thAI Consumer AI Adoption 2026” ครั้ง ...,https://www.scbx.com/th/news/thai-consumer-ai-adoption-report/,... SCB ธุรกิจธนาคารพาณิชย์ SCB 10X ธุรกิจร่วมลงทุนและร่วมสร้างธุรกิจสตาร์ทอัพและเทคโนโลยีทางการเงิน Abacus Digital ธุรกิจวิเคราะห์ข้อมูล โดยใช้กระบวนการ ...,www.scbx.com
Organic Search Result,2026-06-01,9 ม.ค. 2026,SCBX จ่อสรรหาผู้นำคนใหม่ หลัง “กฤษณ์” ซีอีโอ SCB ครบวาระ ...,https://today.line.me/th/v3/article/pe1Beae,อัพเดต 09 ม.ค. เวลา 06.24 น. • เผยแพร่ 09 ม.ค. เวลา 03.50 น. ติดตามแล้วติดตามติดตาม. กฤษณ์ จันทโนทก SCB ไทยพาณิชย์. SCBX เตรียมพร้อมเปลี่ยนผ่านผู้นำสร้างความต่อเนื่อง หลัง 'กฤษณ์ จันท ...,today.line.me
Organic Search Result,2026-06-01,Unknown,ทุกการใช้จ่าย…คุ้มขึ้นได้ ด้วยบัตร Debit LET'S SCB ที่มี ...,https://www.facebook.com/scb.thailand/posts/%E0%B8%97%E0%B8%B8%E0%B8%81%E0%B8%81%E0%B8%B2%E0%B8%A3%E0%B9%83%E0%B8%8A%E0%B9%89%E0%B8%88%E0%B9%88%E0%B8%B2%E0%B8%A2%E0%B8%84%E0%B8%B8%E0%B9%89%E0%B8%A1%E0%B8%82%E0%B8%B6%E0%B9%89%E0%B8%99%E0%B9%84%E0%B8%94%E0%B9%89-%E0%B8%94%E0%B9%89%E0%B8%A7%E0%B8%A2%E0%B8%9A%E0%B8%B1%E0%B8%95%E0%B8%A3-debit-lets-scb-%E0%B8%97%E0%B8%B5%E0%B9%88%E0%B8%A1%E0%B8%B5%E0%B8%94%E0%B8%B5%E0%B8%A5%E0%B8%AA%E0%B9%88%E0%B8%A7%E0%B8%99%E0%B8%A5%E0%B8%94%E0%B8%9E%E0%B8%B2%E0%B8%A3%E0%B9%8C%E0%B8%97%E0%B9%80%E0%B8%99%E0%B8%AD%E0%B8%A3%E0%B9%8C%E0%B9%80%E0%B8%A2%E0%B8%AD%E0%B8%B0%E0%B8%A1%E0%B8%B2%E0%B8%81/1377689174396865/,SCB Thailand. 󱢏. ขณะนี้บริการ SCB EASY App ทำรายการได้ปกติค่ะ หากท่านไม่สามารถ ...,www.facebook.com
Organic Search Result,2026-06-01,9 ม.ค. 2026,SCBX Group Announces Leadership Transition at Siam ...,https://www.mitihoon.com/2026/01/09/608778/,"Mitihoon – SCB X Public Company Limited (SCBX) today announced an upcoming leadership transition at Siam Commercial Bank (SCB), a strategic subsidiary of.",www.mitihoon.com
Organic Search Result,2026-06-01,4 ม.ค. 2026,SCB PRIVATE BANKING - บัตร SCB Planet,https://www.scb.co.th/th/privatebanking/private-privileges/travel-experiences/scb-planet,ลูกค้า SCB PRIVATE BANKING ที่สมัครบัตร SCB PLANET รับฟรี! เครดิตเงินคืนค่าธรรมเนียมแรกเข้า 200 บาท เมื่อเปิดใช้งานบัตร.,www.scb.co.th
Organic Search Result,2026-06-01,Unknown,ปิดบัญชีผู้เสียชีวิต ต้องใช้เอกสารอะไรบ้าง,https://www.youtube.com/shorts/vsOWMzI3WC4,ปิดบัญชีผู้เสียชีวิต ไม่ยุ่งยากซักนิด ต้องเตรียมเอกสารอะไรบ้าง คลิปนี้มีคำตอบมาให้ค่ะ ... สอบถามข้อมูลเพิ่มเติมติดต่อ SCB สาขาบิ๊กซี ลำพูน หรือ SCB ทุกสาขาทั่วประเทศได้ง่ายๆ ไม่ต้องรอสาย ไม่ต้องรอคิว ...,www.youtube.com
Organic Search Result,2026-06-01,13 ม.ค. 2026,SCB FIRST - Specialized Value-added Solutions,https://www.scb.co.th/th/scbfirst/first-privileges/wealth-management/specialized-value-added-solutions,และรุ่นรถยนต์ที่ร่วมโครงการได้ที่เจ้าหน้าที่ของธนาคาร; เงื่อนไขการพิจารณาอนุมัติสินเชื่อเป็นไปตามที่ธนาคารกำหนด. คุณสมบัติผู้สมัคร SCB ...,www.scb.co.th
Organic Search Result,2026-06-01,Unknown,SCB - ดอกเบี้ยพุ่งแรงแบบนี้! สูงสุด 4% ต่อปี*💰 ...,https://www.facebook.com/scb.thailand/photos/%E0%B8%94%E0%B8%AD%E0%B8%81%E0%B9%80%E0%B8%9A%E0%B8%B5%E0%B9%89%E0%B8%A2%E0%B8%9E%E0%B8%B8%E0%B9%88%E0%B8%87%E0%B9%81%E0%B8%A3%E0%B8%87%E0%B9%81%E0%B8%9A%E0%B8%9A%E0%B8%99%E0%B8%B5%E0%B9%89-%E0%B8%AA%E0%B8%B9%E0%B8%87%E0%B8%AA%E0%B8%B8%E0%B8%94-4-%E0%B8%95%E0%B9%88%E0%B8%AD%E0%B8%9B%E0%B8%B5%E0%B8%88%E0%B8%B1%E0%B8%87%E0%B8%AB%E0%B8%A7%E0%B8%B0%E0%B8%99%E0%B8%B5%E0%B9%89%E0%B8%95%E0%B9%89%E0%B8%AD%E0%B8%87%E0%B8%AD%E0%B8%AD%E0%B8%A1%E0%B9%80%E0%B8%87%E0%B8%B4%E0%B8%99-usd-%E0%B8%81%E0%B8%B1%E0%B8%9A%E0%B8%9A%E0%B8%B1%E0%B8%8D%E0%B8%8A%E0%B8%B5-e-fcd-%E0%B9%80%E0%B8%87%E0%B8%B4%E0%B8%99/1358314289667687/,สูงสุด 4% ต่อปี* จังหวะนี้ต้องออมเงิน USD กับบัญชี e-FCD เงินฝากเงินตราต่างประเทศ ที่แอป SCB EASY รับดอกเบี้ยพิเศษสูงสุด 4% ต่อปี* ✨ พิเศษ! ยกเว้นค่าธรรมเนียมรักษาบัญชี** เปิดบัญชีไม่มีขั้นต่ำ ไม่ ...,www.facebook.com
Organic Search Result,2026-06-01,21 ม.ค. 2026,แจ้งอัตราผลตอบแทน วันครบอายุโครงการ และวันรับซื้อคืนหน่วย ...,https://www.scbam.com/medias/fund-doc/redemp/SCBSB3M81.pdf,We would like to thank you for placing your trust in SCB Asset Management (SCBAM) to manage your investment below: Fund Name: SCB Sovereign Bond 3M81 (SCBSB3M81).,www.scbam.com
Organic Search Result,2026-06-01,5 ม.ค. 2026,TOP PICK Q1/2569 ADVANC BDMS SCB,https://thunhoon.com/q1050126,#ทันหุ้น #2026 #SET TOP PICK Q1/2569 ADVANC BDMS SCB. CGSI : กลยุทธ์ประเทศไทย ไตรมาส 1 ปี พ.ศ. 2569 มีแนวโน้มยังเผชิญความไม่แน่นอนทางการเมือง ...,thunhoon.com
Organic Search Result,2026-06-01,4 ม.ค. 2026,SCB PRIVATE BANKING - บัตร SCB Planet,https://www.scb.co.th/th/privatebanking/private-privileges/travel-experiences/scb-planet,ลูกค้า SCB PRIVATE BANKING ที่สมัครบัตร SCB PLANET รับฟรี! เครดิตเงินคืนค่าธรรมเนียมแรกเข้า 200 บาท เมื่อเปิดใช้งานบัตร.,www.scb.co.th
Organic Search Result,2026-06-01,23 ม.ค. 2026,SCB กรอบค่าเงินบาทวันนี้ กรอบ 31.00-31.25 บาท/ดอลลาร์ (23 ...,https://www.mitihoon.com/2026/01/23/611740/,มิติร้อน. SCB กรอบค่าเงินบาทวันนี้ กรอบ 31.00-31.25 บาท/ดอลลาร์ (23 มกราคม 2569). 23 มกราคม 2026 / เวลา 10:53 น.,www.mitihoon.com
Organic Search Result,2026-06-01,1 ก.พ. 2026,รับส่วนลด 7%* เมื่อจองโรงแรมที่ร่วมรายการผ่าน Hotels.com,https://www.cardx.co.th/credit-card/promotion/hotels-feb26-onc11,**ไม่มียอดใช้จ่ายขั้นต่ำ และไม่จำกัดจำนวนคะแนนเพื่อแลกรับเครดิตเงินคืน. (ยกเว้น บัตรเครดิต CardX FAMILY PLUS / SCB FAMILY PLUS). ช่องทางการลง ...,www.cardx.co.th
Organic Search Result,2026-06-01,27 ม.ค. 2026,SCB คาดค่าเงินบาทวันนี้ 31.10-31.35 บาท/ดอลลาร์,https://www.hoonvision.com/investment/scb-%E0%B8%84%E0%B8%B2%E0%B8%94%E0%B8%84%E0%B9%88%E0%B8%B2%E0%B9%80%E0%B8%87%E0%B8%B4%E0%B8%99%E0%B8%9A%E0%B8%B2%E0%B8%97%E0%B8%A7%E0%B8%B1%E0%B8%99%E0%B8%99%E0%B8%B5%E0%B9%89-31-10-31-35-%E0%B8%9A-3/,SCB คาดค่าเงินบาทวันนี้ 31.10-31.35 บาท/ดอลลาร์. แชร์: Facebook twitter line link คัดลอกลิงค์. เผยแพร่วันที่ 27 มกราคม 2569. หุ้นวิชั่น –กลุ่มงานตลาดการเงิน ...,www.hoonvision.com
Organic Search Result,2026-06-01,6 ม.ค. 2026,SCB บริการแย่มาก ขอเตือนคนที่คิดกำลังจะเปิดบัญชี,https://pantip.com/topic/43685118,ธนาคารไทยพาณิชย์ ธนาคารกสิกรไทย SCB EASY. อุตส่าห์โทไปถามว่าต้อง เตรียมเอกสารอะไรบ้าง ก็บอกมาไม่ครบ พอตอนไปสาขาก็บอกว่าช่วยไม่ได้ต้องไปเตรียม ...,pantip.com
Organic Search Result,2026-06-01,30 ม.ค. 2026,แจ้งขยายระยะเวลาการปรับลดค่าธรรมเนียมการขายหน่วยลงทุน ( ...,https://www.scbam.com/th/announce/announce-30012026,SCB Easy. กองทุนส่วนบุคคล. เกี่ยวกับกองทุนส่วนบุคคล · กองทุนส่วนบุคคล โดย บลจ. ไทยพาณิชย์ · ข่าวสารและกิจกรรม · สาระน่ารู้ กองทุนส่วนบุคคล · SCBAM Private Fund Online.,www.scbam.com
Organic Search Result,2026-06-01,Unknown,เอสซีบี เอกซ์ (SCBX) เปิดตัวรายงานวิจัยเชิงลึก “thAI Consumer ...,https://www.instagram.com/p/DUDbVkOD1r8/,more. May 18. OCR. нот NEWS UPDATE 0 SCB connect ไทยพาณิชย์ยกระดับ ณิว ไทย ดับ SCB Connect ด้วยเทคโนโลยี ด้วยเ โลยี ...,www.instagram.com
Organic Search Result,2026-06-01,Unknown,ท่านสามารถตรวจสอบข้อมูลสรุปบัญชีผ่านแอป SCB EASY ...,https://x.com/scb_thailand/status/2016068790950494548,SCB Thailand (@scb_thailand). 171 views. ท่านสามารถตรวจสอบข้อมูลสรุปบัญชีผ่านแอป SCB EASY ได้ ผ่านเมนู หน้าสรุปบัญชี โดยดูภาพรวมของบัญชีทั้งหมด พร้อมยอดเงินปัจจุบัน หรือจากเมนู ...,x.com
Organic Search Result,2026-06-01,12 ม.ค. 2026,SCB เปิดตัว Paradox CODE พลิกจุดย้อนแย้งสู่กำไรยั่งยืน | ทันหุ้น,https://today.line.me/th/v3/article/KwzlnVN,SCB เปิดตัว Paradox CODE พลิกจุดย้อนแย้งสู่กำไรยั่งยืน. ทันหุ้น. อัพเดต 12 ม.ค. เวลา 20.45 น. • เผยแพร่ 12 ม.ค. เวลา 20.45 น. ติดตามแล้วติดตามติดตาม. โฆษณา ...,today.line.me
Organic Search Result,2026-06-01,Unknown,เริ่มปีใหม่...ปล่อยให้เงินทำงานแทนเรา 💰 ถ้าลงทุนในดัชนี S&P ...,https://www.facebook.com/scb.thailand/posts/%E0%B9%80%E0%B8%A3%E0%B8%B4%E0%B9%88%E0%B8%A1%E0%B8%9B%E0%B8%B5%E0%B9%83%E0%B8%AB%E0%B8%A1%E0%B9%88%E0%B8%9B%E0%B8%A5%E0%B9%88%E0%B8%AD%E0%B8%A2%E0%B9%83%E0%B8%AB%E0%B9%89%E0%B9%80%E0%B8%87%E0%B8%B4%E0%B8%99%E0%B8%97%E0%B8%B3%E0%B8%87%E0%B8%B2%E0%B8%99%E0%B9%81%E0%B8%97%E0%B8%99%E0%B9%80%E0%B8%A3%E0%B8%B2-%E0%B8%96%E0%B9%89%E0%B8%B2%E0%B8%A5%E0%B8%87%E0%B8%97%E0%B8%B8%E0%B8%99%E0%B9%83%E0%B8%99%E0%B8%94%E0%B8%B1%E0%B8%8A%E0%B8%99%E0%B8%B5-sp-500-%E0%B8%9B%E0%B8%B5-2016-%E0%B8%9C%E0%B9%88%E0%B8%B2%E0%B8%99%E0%B9%84%E0%B8%9B-10-%E0%B8%9B%E0%B8%B5-%E0%B9%80/1374413031391146/,... INDEX FUND ทั่วโลกจาก SCB ลงทุน EASY ที่แอป SCB EASY ➡️ เพิ่มเติม >> https://www.scb.co.th/th/personal-banking/investment/fund/mutual-funds/index-fund ...,www.facebook.com
Organic Search Result,2026-06-01,13 ม.ค. 2026,ลืมบัญชีผู้ใช้/รหัสผ่าน? - SCB PVD Online,https://mypvd.scb.co.th/forgotPassword,หมายเหตุ : โปรดเลือกประเภทข้อมูลหมายเลขโทรศัพท์มือถือ หรือ อีเมล เพียงอย่างใดอย่างหนึ่ง แล้วระบุค่าให้ตรงกับประเภทข้อมูลที่ท่านเลือก ตามที่ท่านให้ไว้กับกรรมการกองทุนที่ส่งมายังนายทะเบียนเท่านั้น.,mypvd.scb.co.th
