Topic_Type,Date_Extracted,Published_Date,Heading,URL,Body_Snippet,Source_Site
Organic Search Result,2026-06-01,Unknown,ตอกย้ำความเชื่อมั่นจาก SCB ที่มอบให้แก่ Easy Money . ธนาคาร ...,https://www.instagram.com/p/DUFZPHqiWpD/,"4 likes, 0 comments - easymoney_th on January 28, 2026: ""ตอกย้ำความเชื่อมั่นจาก SCB ที่มอบให้แก่ Easy Money . ธนาคารไทยพาณิชย์เดินหน้าเสริมความแข็งแกร่งโครงสร้างการเงิน ...",www.instagram.com
Organic Search Result,2026-06-01,22 ม.ค. 2026,SCBกำไรQ4ต่ำคาด เงินปันผลยีลด์ 7%ค้ำ!,https://www.hoonvision.com/hoonset/scb%E0%B8%81%E0%B8%B3%E0%B9%84%E0%B8%A3q4%E0%B8%95%E0%B9%88%E0%B8%B3%E0%B8%84%E0%B8%B2%E0%B8%94-%E0%B9%80%E0%B8%87%E0%B8%B4%E0%B8%99%E0%B8%9B%E0%B8%B1%E0%B8%99%E0%B8%9C%E0%B8%A5%E0%B8%A2%E0%B8%B5/,ปรับประมาณการกำไรสุทธิปี 2026E/2027E ลง -3%/-1% จากการปรับ NIM ลง ทำให้ได้กำไรสุทธิปี 2026E อยู่ที่ 4.5 หมื่นล้านบาท ลดลง -5% YoY. คงคำแนะนำ “ซื้อ” SCB แต่ปรับราคาเป้าหมายลงมาอยู่ที่ ...,www.hoonvision.com
Organic Search Result,2026-06-01,Unknown,ZUS COFFEE เปิดสาขาที่ 13 ที่ SCB Park Plaza,https://www.tiktok.com/@tangkwaky/video/7597068453287087368,"33 ถูกใจ,22 ความคิดเห็นวิดีโอ TikTok จาก Tangkwaky (@tangkwaky): ""พบกับ ZUS COFFEE สาขาใหม่ ที่ SCB Park Plaza สำหรับคอกาแฟ อร่อย คุณภาพสูง ราคาไม่แพง!",www.tiktok.com
Organic Search Result,2026-06-01,Unknown,"""SCB"" กำไรพุ่ง 4.7 หมื่นล้าน ตั้งสำรองลด | TNN ชั่วโมงทำเงิน | 22 ...",https://www.youtube.com/watch?v=631Xv9rLAQQ,"""SCB"" กำไรพุ่ง 4.7 หมื่นล้าน ตั้งสำรองลด | TNN ชั่วโมงทำเงิน | 22-01-69 . ""SCB"" กำไรพุ่ง 4.7 หมื่นล้าน ตั้งสำรองลด กลุ่ม ""เอสซีบี เอกซ์"" ยานแม่ของธนาคารไทยพาณิยช์ ประกาศงบปี 2568 ...",www.youtube.com
Organic Search Result,2026-06-01,20 ม.ค. 2026,SCB ค่าเงินบาทประจำวันที่ 20 มกราคม 2569,https://www.mitihoon.com/2026/01/20/610678/,Tiktok : www.tiktok.com/@mitihoon. แท็ก; MAI · mitihoon · MitihoonNewsฃ · scb · SCBFM · SET · การลงทุน · การเงิน · ข่าว ...,www.mitihoon.com
Organic Search Result,2026-06-01,6 ม.ค. 2026,SCB FIRST - บัตร SCB Planet,https://www.scb.co.th/th/scbfirst/first-privileges/travel-experiences/scb-planet,ลูกค้า SCB FIRST ที่สมัครบัตร SCB PLANET รับฟรี! เครดิตเงินคืนค่าธรรมเนียมแรกเข้า 200 บาท เมื่อเปิดใช้งานบัตร.,www.scb.co.th
Organic Search Result,2026-06-01,27 ม.ค. 2026,SCB โผล่บิ๊กล็อต 4.1 ล้านหุ้น มูลค่า 573 ลบ. ราคาต่ำกว่ากระดาน,https://today.line.me/th/v3/article/Za8OVDr,ทั้งนี้ ราคาหุ้น SCB ปิดตลาดอยู่ที่ระดับ 138 บาท บวก 3 บาท หรือ 2.22% สูงสุดที่ระดับ 138.50 บาท ต่ำสุดที่ระดับ 136 บาท ด้วยมูลค่าการซื้อขาย 3.69 ล้านบาท. สำหรับภาพรวมรายชื่อผู้ถือหุ้นใหญ่ 14 อันดับ (ณ ...,today.line.me
Organic Search Result,2026-06-01,20 ม.ค. 2026,SCB โบรกฯ คาดกำไร Q4/68 ที่ 1.09 หมื่นลบ. -ปันผลโดดเด่น,https://thunhoon.com/scb-profit-q4-200126,SCB โบรกฯ คาดกำไร Q4/68 ที่ 1.09 หมื่นลบ. -ปันผลโดดเด่น. icon Share icon Share. Infographics | 20 มกราคม 2026.,thunhoon.com
Organic Search Result,2026-06-01,21 ม.ค. 2026,ธนาคารไทยพาณิชย์อัดฉีดสินเชื่อ 3000 ล้านบาท แก่อีซี่มันนี่,https://www.share2trade.com/news/52101/%E0%B8%98%E0%B8%99%E0%B8%B2%E0%B8%84%E0%B8%B2%E0%B8%A3%E0%B9%84%E0%B8%97%E0%B8%A2%E0%B8%9E%E0%B8%B2%E0%B8%93%E0%B8%B4%E0%B8%8A%E0%B8%A2%E0%B9%8C%E0%B8%AD%E0%B8%B1%E0%B8%94%E0%B8%89%E0%B8%B5%E0%B8%94%E0%B8%AA%E0%B8%B4%E0%B8%99%E0%B9%80%E0%B8%8A%E0%B8%B7%E0%B9%88%E0%B8%AD-3000-%E0%B8%A5%E0%B9%89%E0%B8%B2%E0%B8%99%E0%B8%9A%E0%B8%B2%E0%B8%97-%E0%B9%81%E0%B8%81%E0%B9%88%E0%B8%AD%E0%B8%B5%E0%B8%8B%E0%B8%B5%E0%B9%88%E0%B8%A1%E0%B8%B1%E0%B8%99%E0%B8%99%E0%B8%B5%E0%B9%88,"SCB-Easy money.jpg นายกฤษณ์ จันทโนทก ประธานเจ้าหน้าที่บริหาร ธนาคารไทยพาณิชย์ (SCB) กล่าวว่า ธนาคารได้สนับสนุนทางการเงิน 3,000 ล้านบาทภายใต้ อีซี่มันนี่ ...",www.share2trade.com
Organic Search Result,2026-06-01,Unknown,ยุคนี้แค่มีมือถือ ก็จัดการเรื่องบัญชีได้ ไม่ต้องพกสมุด ไม่ต้องกลัวหายแค่ ...,https://www.youtube.com/shorts/ehP9NKVEHik,... SCB EASY - เช็กเงินเข้าออกแบบ Real Time ผ่าน LINE SCB Connect - ขอหน้าสมุดบัญชีได้ทันทีทางแอป SCB EASY SCB E PASSBOOK เปลี่ยนง่าย ปลอดภัย ใช้เลขบัญชีเดิม ...,www.youtube.com
Organic Search Result,2026-06-01,6 ม.ค. 2026,SCB Financial Markets คาดกรอบเงินบาท 31.15-31.40 บ. ...,https://www.kaohoon.com/news/805534,กลุ่มงานตลาดการเงิน ธนาคารไทยพาณิชย์ (SCB Financial Markets) วันนี้เคลื่อนไหวในกรอบ 31.15-31.40 บาท/ดอลลาร์.,www.kaohoon.com
Organic Search Result,2026-06-01,27 ม.ค. 2026,SCBX Report: thAI Consumer AI Adoption 2026,https://www.scbx.com/th/scbx-exclusive/thai-consumer-ai-adoption/,ธุรกิจให้บริการในเชิงกลยุทธ์ด้าน Data และ AI ให้กับกลุ่มบริษัทเอสซีบี เอกซ์ MONIX ธุรกิจสินเชื่อดิจิทัลพลังเอไอที่สร้างโอกาสให้คนทำมาหากินได้การเงินดีมีสุข SCB ธุรกิจธนาคารพาณิชย์ SCB 10X ธุรกิจร่วมลงทุน ...,www.scbx.com
Organic Search Result,2026-06-01,15 ม.ค. 2026,กองทุน SCBS&P500E กับ SCBS&P500,https://pantip.com/topic/42030764,นอกจากซื้อกองทุน scb e class แล้วมีวิธีซื้อกองทุนให้ค่าธรรมเนียม 0% อีกไหมครับ. สมาชิกหมายเลข 3855882 · s&p500 กับ nasdaq100 เลือกตัวไหนดี. สมาชิกหมายเลข ...,pantip.com
Organic Search Result,2026-06-01,30 ม.ค. 2026,หนังสือชี้ชวนส่วนสรุปข้อมูลสำคัญ Factsheet กองทุนเ,https://www.scbam.com/medias/fund-doc/summary-prospectus/SCBCR1YAI_SUM.pdf,"วันทำการซื้อ: เสนอขายครั้งเดียวในช่วงเปิดเสนอ. ขาย IPO. เวลาทำการ: เปิดทำการ ถึง 15.30 น. SCB EASY APP ถึง 16.00 น. การซื้อครั้งแรกขั้นต่ำ: 500,000 บาท. การ ...",www.scbam.com
Organic Search Result,2026-06-01,20 ม.ค. 2026,SCB ค่าเงินบาทประจำวันที่ 20 มกราคม 2569,https://www.mitihoon.com/2026/01/20/610678/,Tiktok : www.tiktok.com/@mitihoon. แท็ก; MAI · mitihoon · MitihoonNewsฃ · scb · SCBFM · SET · การลงทุน · การเงิน · ข่าว ...,www.mitihoon.com
Organic Search Result,2026-06-01,20 ม.ค. 2026,SCB Financial Markets คาดกรอบเงินบาทวันนี้ 30.80–31.10 บ. ...,https://today.line.me/th/v3/article/7NqpOOZ,กลุ่มงานตลาดการเงิน ธนาคารไทยพาณิชย์ หรือ SCB Financial Markets ประเมินค่าเงินบาทในวันนี้มีแนวโน้มเคลื่อนไหวในกรอบ 30.80–31.10 บาทต่อดอลล...,today.line.me
Organic Search Result,2026-06-01,Unknown,อ่านสรุปทุกความเคลื่อนไหวของธนาคารไทยพาณิชย์ และบริษัทใน ...,https://www.instagram.com/p/DTST85WDidP/,"1 likes, 0 comments - wearescb on January 9, 2026: ""SCB Newsletter Vol.136 : อ่านสรุปทุกความเคลื่อนไหวของธนาคารไทยพาณิชย์ และบริษัทในกลุ่มเอสซีบี เอกซ์ ในรอบ 2 ...",www.instagram.com
Organic Search Result,2026-06-01,12 ม.ค. 2026,SCB FIRST - Special Reward Points,https://www.scb.co.th/th/scbfirst/first-privileges/special-reward-point-and-mileade-plus,Special Reward Points เพิ่มรางวัลและเพิ่มค่าให้กับทุกยอดการใช้จ่ายเมื่อใช้จ่ายผ่านบัตรเครดิต SCB FIRST.,www.scb.co.th
Organic Search Result,2026-06-01,Unknown,Tracing SCB's Profits: Investment Income +370 ...,https://www.youtube.com/watch?v=yH1uzR9JSnU,ลงทุนไทม์ ได้เวลาลงทุน วันนี้ชวนทุกคนมาอัปเดตหุ้น SCB ที่ประกาศงบปี 68 กำไร +8% ท่ามกลางดอกเบี้ยนโยบายที่ลดลงต่อเนื่อง แสดงว่า SCB สามารถทำรายได้ด้านอื่นที่ไม่ใช่ดอกเบี้ยได้อย่างดีเยี่ยม ...,www.youtube.com
Organic Search Result,2026-06-01,Unknown,ขณะนี้บริการ SCB EASY App ทำรายการได้ปกติค่ะ หากท่าน ...,https://x.com/scb_thailand/status/2015264880543359321,SCB Thailand (@scb_thailand). 305 views. ขณะนี้บริการ SCB EASY App ทำรายการได้ปกติค่ะ หากท่านเข้าใช้งาน หรือโอนเงิน ผ่าน SCB EASY App ไม่ได้ ขอแนะนำวิธีแก้ไขเบื้องต้นดังนี้ค่ะ 1.,x.com
Organic Search Result,2026-06-01,Unknown,เปิดตัว SCB PLANET VISA Limited Edition หน้าบัตรใหม่ลาย FIFA ...,https://www.youtube.com/shorts/qEH1XbhU3TI,สายบอลตัวจริง ต้องมี! เปิดตัว SCB PLANET VISA Limited Edition หน้าบัตรใหม่ลาย FIFA World Cup(TM) Official Trophy จำนวนจำกัด สมัครได้แล้ว ตั้งแต่ 1 ธันวาคม 2568 – 31 มกราคม ...,www.youtube.com
Organic Search Result,2026-06-01,28 ม.ค. 2026,SCB FIRST Lounge,https://www.scb.co.th/th/scbfirst/first-privileges/banking-services/scb-first-lounge,สถานที่ให้บริการ SCB FIRST Lounge. อโศก; ชิดลม; สมุทรสาคร; สภากาชาดไทย; ซอยอารีสัมพันธ์; เซ็นทรัล ลาดพร้าว; ถนนรามคำแหง (สัมมากร); ซี.พี. ทาวเวอร์ ...,www.scb.co.th
Organic Search Result,2026-06-01,14 ม.ค. 2026,SCB ค่าเงินบาทประจำวันที่ 14 มกราคม 2569,https://www.mitihoon.com/2026/01/14/607224/,Tiktok : www.tiktok.com/@mitihoon. แท็ก; MAI · mitihoon · MitihoonNews · scb · SCBFM · SET · การลงทุน · การเงิน · ข่าว · ข่าว ...,www.mitihoon.com
Organic Search Result,2026-06-01,9 ม.ค. 2026,SCB เตรียมเปลี่ยนผ่านผู้นำ หลัง “กฤษณ์ จันทโนทก” ครบวาระ 31 ...,https://today.line.me/th/v3/article/nXP76PD,บริษัท เอสซีบี เอกซ์ จำกัด (มหาชน) หรือ SCB แจ้งการเปลี่ยนแปลงระดับผู้บริหารสูงสุดของธนาคารไทยพาณิชย์ บริษัทภายใต้กลุ่มเอสซีบีเอกซ์ เพื่อเตรียมความพร้...,today.line.me
Organic Search Result,2026-06-01,Unknown,"""SCB"" จัดทัพลุยธนาคารไร้สาขา ดึง AI ช่วย | TNN ชั่วโมงทำเงิน | 23 ...",https://www.youtube.com/watch?v=JdEtSarRZjg,"""SCB"" จัดทัพลุยธนาคารไร้สาขา ดึง AI ช่วย | TNN ชั่วโมงทำเงิน | 23-01-69 . หลังจากได้ใบอนุญาตธนาคารไร้สาขา (Virtual Bank) กลุ่ม ""เอสซีบี เอกซ์"" ก็เดินหน้าพัฒนาความร่วมมือกับพันธมิตร ...",www.youtube.com
Organic Search Result,2026-06-01,Unknown,ขณะนี้บริการ SCB EASY App ทำรายการได้ปกติค่ะ หากท่าน ...,https://x.com/scb_thailand/status/2012357987189588169,1.ปิดการใช้งาน SCB EASY App แล้วทดลองเข้าใช้งานใหม่อีกครั้ง 2.หากเปิดสัญญาณ WiFi อยู่ แนะนำให้ปิดและเชื่อมต่อโดยสัญญาณอินเทอร์เน็ต ทั้งนี้หากท่านยังไม่สามารถเข้าใช้งานได้ เพื่อให้เจ้าหน้าที่แนะนำขั้น ...,x.com
Organic Search Result,2026-06-01,28 ม.ค. 2026,SCB FIRST Lounge,https://www.scb.co.th/th/scbfirst/first-privileges/banking-services/scb-first-lounge,สถานที่ให้บริการ SCB FIRST Lounge. อโศก; ชิดลม; สมุทรสาคร; สภากาชาดไทย; ซอยอารีสัมพันธ์; เซ็นทรัล ลาดพร้าว; ถนนรามคำแหง (สัมมากร); ซี.พี. ทาวเวอร์ ...,www.scb.co.th
Organic Search Result,2026-06-01,Unknown,"""กฤษณ์"" บรรลุพันธกิจตามยุทธ์ศาสตร์ SCB",https://www.youtube.com/watch?v=iYm3l25hwUA,"""กฤษณ์"" บรรลุพันธกิจตามยุทธ์ศาสตร์ SCB ติดตาม Kaohoon TV Online ได้ที่ Youtube : https://www.youtube.com/@KaohoonTVOnline Facebook ...",www.youtube.com
Organic Search Result,2026-06-01,21 ม.ค. 2026,เอสซีบีเอกซ์ ประกาศผลกำไรสุทธิประจำปี 2568 จำนวน ...,https://www.scbx.com/th/news/scbx-reports-2025-net-profit/,ธุรกิจธนาคารพาณิชย์ SCB 10X ธุรกิจร่วมลงทุนและร่วมสร้างธุรกิจสตาร์ทอัพและเทคโนโลยีทางการเงิน Abacus Digital ธุรกิจวิเคราะห์ข้อมูล โดยใช้กระบวนการวิเคราะห์ข้อมูลขั้นสูง (Advanced Data ...,www.scbx.com
Organic Search Result,2026-06-01,27 ม.ค. 2026,SCB Financial Markets มองกรอบบาทวันนี้ 31.10–31.35 บ./ ...,https://www.kaohoon.com/news/809292,SCB Financial Markets มองค่าเงินบาทวันนี้แกว่งในกรอบ 31.10–31.35 บาทต่อดอลลาร์ หลังเงินบาทอ่อนค่า ท่ามกลางความเสี่ยงปัจจัยการเมือง.,www.kaohoon.com
Organic Search Result,2026-06-01,Unknown,SCB - ของขวัญแห่งการเริ่มต้น แทนความห่วงใยตลอดไป กับบัญชี ...,https://www.facebook.com/scb.thailand/photos/%E0%B8%82%E0%B8%AD%E0%B8%87%E0%B8%82%E0%B8%A7%E0%B8%B1%E0%B8%8D%E0%B9%81%E0%B8%AB%E0%B9%88%E0%B8%87%E0%B8%81%E0%B8%B2%E0%B8%A3%E0%B9%80%E0%B8%A3%E0%B8%B4%E0%B9%88%E0%B8%A1%E0%B8%95%E0%B9%89%E0%B8%99-%E0%B9%81%E0%B8%97%E0%B8%99%E0%B8%84%E0%B8%A7%E0%B8%B2%E0%B8%A1%E0%B8%AB%E0%B9%88%E0%B8%A7%E0%B8%87%E0%B9%83%E0%B8%A2%E0%B8%95%E0%B8%A5%E0%B8%AD%E0%B8%94%E0%B9%84%E0%B8%9B-%E0%B8%81%E0%B8%B1%E0%B8%9A%E0%B8%9A%E0%B8%B1%E0%B8%8D%E0%B8%8A%E0%B8%B5%E0%B9%80%E0%B8%87%E0%B8%B4%E0%B8%99%E0%B8%9D%E0%B8%B2%E0%B8%81%E0%B8%88%E0%B8%B2%E0%B8%81%E0%B9%83%E0%B8%88-%E0%B9%81%E0%B8%9A%E0%B8%9A-e-passbook-%E0%B8%97/1356468833185566/,󱢏. ธนาคารขออภัยในความไม่สะดวกที่ได้รับนะ คะ สำหรับการแจ้งเตือนผ่านบริการ SCB EASY App นั้น จะมี ...,www.facebook.com
Organic Search Result,2026-06-01,21 ม.ค. 2026,การแก้ไขมูลค่าทรัพย์สินสุทธิและมูลค่าหน่วยลงทุนของกองทุน ...,https://www.scbam.com/th/announce/announce-21012026-2,SCB Easy. กองทุนส่วนบุคคล. เกี่ยวกับกองทุนส่วนบุคคล. กองทุนส่วนบุคคล โดย บลจ. ไทยพาณิชย์. ข่าวสารและกิจกรรม. สาระน่ารู้ กองทุนส่วนบุคคล. SCBAM Private Fund Online.,www.scbam.com
Organic Search Result,2026-06-01,27 ม.ค. 2026,SCB ค่าเงินบาทประจำวันที่ 27 มกราคม 2569,https://www.mitihoon.com/2026/01/27/612298/,SCB ค่าเงินบาทประจำวันที่ 27 มกราคม 2569 · กลุ่มงานตลาดการเงิน ธนาคารไทยพาณิชย์ ประเมินค่าเงินบาทวันนี้เคลื่อนไหวในกรอบ 31.10-31.35 บาท/ดอลลาร์ · เงินบาทกลับมาอ่อนค่าแม้ดัชนีเงินดอลลาร์สหรัฐ ...,www.mitihoon.com
Organic Search Result,2026-06-01,Unknown,บัตรใกล้หมดอายุแล้วหรือยัง ❓ต่อบัตรเดบิต SCB LET'S ใหม่ ง่าย ...,https://x.com/scb_thailand/status/2012725397847441645,SCB Thailand (@scb_thailand). บัตรใกล้หมดอายุแล้วหรือยัง ❓ต่อบัตรเดบิต SCB LET'S ใหม่ ง่ายทุกช่องทาง‼️ ไม่มีค่าธรรมเนียมออกบัตร 100 บาท* รีบไปต่อเลยตอนนี้ ✓ ตู้ ATM ธนาคารไทยพาณิชย์ ...,x.com
Organic Search Result,2026-06-01,26 ม.ค. 2026,แจ้งยกเว้นค่าธรรมเนียมการขายหน่วยลงทุน (Front-end Fee) และ ...,https://www.scbam.com/th/announce/announce-26012026-1,SCB Easy. กองทุนส่วนบุคคล. เกี่ยวกับกองทุนส่วนบุคคล · กองทุนส่วนบุคคล โดย บลจ. ไทยพาณิชย์ · ข่าวสารและกิจกรรม · สาระน่ารู้ กองทุนส่วนบุคคล · SCBAM Private Fund Online.,www.scbam.com
Organic Search Result,2026-06-01,2 ม.ค. 2026,โม โม พาราไดซ์,https://www.cardx.co.th/credit-card/promotion/mo-mo-paradise-mar26-usc07,"บัตรเครดิต SCB PRIVATE BANKING / SCB FIRST / SCB PRIME : เมื่อมียอดใช้จ่ายตั้งแต่ 2,000 บาทขึ้นไป/เซลล์สลิป รับเครดิตเงินคืน 200 บาท*. บัตรเครดิต CardX ทุก ...",www.cardx.co.th
Organic Search Result,2026-06-01,4 ม.ค. 2026,SCB PRIVATE BANKING - Priority Pass Card,https://www.scb.co.th/th/privatebanking/private-privileges/travel-experiences/priority-pass-card,เงื่อนไข: ธนาคารขอสงวนสิทธิ์ในการมอบสิทธิประโยชน์นี้ให้แก่ผู้ถือบัตรเครดิต SCB PRIVATE BANKING บัตรหลักที่เปิดใช้งานบัตรแล้ว ...,www.scb.co.th
Organic Search Result,2026-06-01,Unknown,"เจาะลึกหุ้น SCB X: ปันผลสูง 8% หรือจะเป็น ""ธนบัตรราคาถูก""",https://www.youtube.com/watch?v=cRUUHDs1di0,คลิปนี้จะพาทุกคนไปวิเคราะห์หุ้น SCB X แบบเจาะลึกผ่านเลนส์ของปรมาจารย์การลงทุนระดับโลกอย่าง Warren Buffett และ Peter Lynch เราจะมาหาคำตอบกันว่าทำไม SCB X ถึงถูกมองว่าเป็นหุ้น ...,www.youtube.com
Organic Search Result,2026-06-01,Unknown,SCB - ไทยพาณิชย์ ออกมาตรการช่วยเหลือลูกค้าผู้ประสบอุทกภัย ...,https://www.facebook.com/scb.thailand/photos/%E0%B9%84%E0%B8%97%E0%B8%A2%E0%B8%9E%E0%B8%B2%E0%B8%93%E0%B8%B4%E0%B8%8A%E0%B8%A2%E0%B9%8C-%E0%B8%AD%E0%B8%AD%E0%B8%81%E0%B8%A1%E0%B8%B2%E0%B8%95%E0%B8%A3%E0%B8%81%E0%B8%B2%E0%B8%A3%E0%B8%8A%E0%B9%88%E0%B8%A7%E0%B8%A2%E0%B9%80%E0%B8%AB%E0%B8%A5%E0%B8%B7%E0%B8%AD%E0%B8%A5%E0%B8%B9%E0%B8%81%E0%B8%84%E0%B9%89%E0%B8%B2%E0%B8%9C%E0%B8%B9%E0%B9%89%E0%B8%9B%E0%B8%A3%E0%B8%B0%E0%B8%AA%E0%B8%9A%E0%B8%AD%E0%B8%B8%E0%B8%97%E0%B8%81%E0%B8%A0%E0%B8%B1%E0%B8%A2%E0%B9%83%E0%B8%99%E0%B8%88%E0%B8%B1%E0%B8%87%E0%B8%AB%E0%B8%A7%E0%B8%B1%E0%B8%94%E0%B8%AA%E0%B8%87%E0%B8%82%E0%B8%A5%E0%B8%B2%E0%B8%98%E0%B8%99%E0%B8%B2%E0%B8%84%E0%B8%B2%E0%B8%A3%E0%B9%84%E0%B8%97%E0%B8%A2%E0%B8%9E%E0%B8%B2%E0%B8%93%E0%B8%B4%E0%B8%8A%E0%B8%A2/1362463469252769/,... SCB Customer Center โทร 02-777-7777 กด 99 ลูกค้าผู้ประกอบการ SME สามารถติดต่อขอเข้าร่วมโครงการได้ทางเจ้าหน้าที่ธุรกิจสัมพันธ์ที่ดูแลท่าน หรือ SCB Business ...,www.facebook.com
Organic Search Result,2026-06-01,28 ม.ค. 2026,SCB ค่าเงินบาทวันนี้ 30.80-31.05 บาท/ดอลลาร์,https://www.hoonvision.com/investment/scb-%E0%B8%84%E0%B9%88%E0%B8%B2%E0%B9%80%E0%B8%87%E0%B8%B4%E0%B8%99%E0%B8%9A%E0%B8%B2%E0%B8%97%E0%B8%A7%E0%B8%B1%E0%B8%99%E0%B8%99%E0%B8%B5%E0%B9%89-30-80-31-05-%E0%B8%9A%E0%B8%B2%E0%B8%97-%E0%B8%94/,SCB ค่าเงินบาทวันนี้ 30.80-31.05 บาท/ดอลลาร์. แชร์: Facebook twitter line link คัดลอกลิงค์. เผยแพร่วันที่ 28 มกราคม 2569. หุ้นวิชั่น –กลุ่มงานตลาดการเงิน ...,www.hoonvision.com
