Platform;URL;Author;Heading;Views;Engagement;Likes;Comments;Retweets_Shares;Reactions;Createtime
Twitter;https://x.com/BrightMinho/status/1888936275518099766;;;24;22983;983;12000;10000;;
Facebook;https://www.facebook.com/ZZTOfficial/videos/1406658977891529/;;;11000;;;;;;
TikTok;https://www.tiktok.com/@iam.kkwon/video/7629975134736157959;iam.kkwon;ใครใช้ Samsung มาร่วมแคมเปญนี้เร็ว เงินหมื่นรอคุณอยู่นะครับ!! #GalaxyTiktokStar #GalaxyS26Ultra ;3839;237;223;1;13;;
TikTok;https://www.tiktok.com/@guzappam/video/7629962212219587847;guzappam;อยากให้สังเกตุว่าถ้าไม่มีคนแล้วกันสั่นจะแย่ลงครับ อันนี้แอดต่อยอดจากโพสก่อนครับ ทดสอบกันสั่นงบหมื่นก;26000;785;735;11;39;;
TikTok;https://www.tiktok.com/@zzt_zixzester/video/7630004052855737620;zzt_zixzester;Galaxy A57 - มือถือในงบ 15,000 บาท ตัวไหนคุ้มสุด!! ข้อดี? ข้อเสีย? รุ่นนี้เหมาะกับใคร!!! #zzt;9333;341;328;3;10;;
TikTok;https://www.tiktok.com/@stepgeektv/video/7629513046213397768;stepgeektv;รีวิว SAMSUNG Galaxy A37 : งบเบาๆ เน้นปลอดภัย กล้องสวย ใช้งานชิลๆ #StepGeek #ไอทีรอบรู้ #เรื่องคอมรอ;23200;715;685;16;14;;
TikTok;https://www.tiktok.com/@droidsans/video/7630069108247203092;droidsans;น่าใช้ยังไงบ้าง Samsung Galaxy A57 5G รุ่นล่าสุดตระกูล A ซัมซุง ราคา 16,999 บาท #samsung #galaxya57 ;142500;5936;5444;119;373;;
TikTok;https://www.tiktok.com/@droidsans/video/7630446076486618388;droidsans;ราคาน่ารัก Samsung Galaxy A37 5G 13,999 บาท ให้อะไรมาบ้าง? #samsung #galaxya37 #มือถือใหม่;84500;4223;3977;48;198;;
