Date_Extracted,Published_Date,Heading,URL,Body_Snippet,Source_Site
2026-05-14,20 เม.ย. 2026,TRAIN FOR HYROX WITH JETTS,https://www.jetts.co.th/train-for-hyrox-with-jetts/,การแข่งขัน HYROX กำลังจะกลับมาในปี 2026 เตรียมตัวให้พร้อมตั้งแต่วันนี้ และให้ Jetts Fitness เป็นพาร์ทเนอร์สู่ความสำเร็จของคุณ ... Jetts Fitness Flagship HYROX Training Clubs.,www.jetts.co.th
2026-05-14,22 เม.ย. 2026,BMI-EN - Jetts Thailand - Jetts 24 Hours Fitness,https://www.jetts.co.th/bmi-en/,... Jetts Fitness (Thailand) รวมถึงวัตถุประสงค์ในการวิเคราะห์ลูกค้า ในกรอบระยะเวลาตามนโยบายบริษัทฯ ทั้งนี้เราอาจนำเสนอข้อมูลเกี่ยวกับผลิตภัณฑ์และบริการอื่นๆให้ ...,www.jetts.co.th
2026-05-14,3 เม.ย. 2026,Flagship HYROX - Jetts Thailand - Jetts 24 Hours Fitness,https://www.jetts.co.th/flagship-hyrox/,การแข่งขัน HYROX กำลังจะกลับมาในปี 2026 เตรียมตัวให้พร้อมตั้งแต่วันนี้ และให้ Jetts Fitness เป็นพาร์ทเนอร์สู่ความสำเร็จของคุณ. เริ่มเทรนนิ่งกับเรา. เกี่ยวกับเรา. ค้นหาคลับ · ทำไมต้องเลือกเรา ...,www.jetts.co.th
2026-05-14,Unknown,Milestones and Future of Jetts Fitness,https://www.tiktok.com/@jettsfitness_careers/video/7627090390063140117,"127 ถูกใจ,วิดีโอ TikTok จาก JettsJob (@jettsfitness_careers): ""Discover insights from Jetts Fitness leadership on their milestones and future plans.",www.tiktok.com
2026-05-14,26 ม.ค. 2026,สมาชิกใหม่ พร้อมมั้ย? พบกับ Jetts Fitness 10 Weeks New ...,https://www.jetts.co.th/jetts-fitness-10-weeks-new-member-journey/,ทำภารกิจครบ รับเลย! ☂️ ร่มคอลเลคชันพิเศษจาก Jetts Fitness หรือ ⭐ Jetts Reward Point 400 คะแนน. สมัครสมาชิกแล้ว อย่าลืมมาร่วมทำภารกิจไปด้วย ...,www.jetts.co.th
2026-05-14,Unknown,Your new 24-hour obsession. Jetts Fitness at Robinson ...,https://www.instagram.com/reel/DVYo1vNiQ8h/,"kewalinsxwan on March 2, 2026: ""Your new 24-hour obsession. ✨ Jetts Fitness at Robinson Chalong is officially open! @jettsfitnessthailand #jettsfitness ...",www.instagram.com
2026-05-14,22 มี.ค. 2026,Milli Move Like a Heavyweight 2026,https://www.jetts.co.th/milli-move-like-a-heavyweight-2026/,5. การเปลี่ยนแปลงที่อยู่จัดส่ง หากต้องการเปลี่ยนแปลงที่อยู่จัดส่ง กรุณาแจ้งความประสงค์ผ่านทาง Facebook Fanpage: Jetts Fitness Thailand 6. ขอสงวนสิทธิ์ในการ ...,www.jetts.co.th
2026-05-14,1 มี.ค. 2026,Jetts Fitness 24hrs. Now open in “Robinson Lifestyle Chalong” ...,https://www.instagram.com/p/DVXb-WyAR-8/,ที่ Jetts Fitness 24hrs @ Robinson Lifestyle Chalong ฟิตเนสเปิด 24 ชม. จะเช้า สาย บ่าย ดึก ก็แวะมาได้หมด อุปกรณ์ครบ บรรยากาศดี เล่นเพลิน มือใหม่ก็ไม่เขิน ใครกำลังหาแรงบันดาลใจในการ ...,www.instagram.com
2026-05-14,20 ม.ค. 2026,Yoga Mats & Shirts Campaign,https://www.jetts.co.th/yoga-mats-shirts-campaign/,JETTS YOGA MAT; ผืนละ 990 บาท. เสื่อโยคะ Jetts Fitness. คอลเลคชันสุดพิเศษ Jetts x LES MILLS YOGA.,www.jetts.co.th
2026-05-14,Unknown,มาจริงไม่จกตา! Jetts Fitness ปักหมุดความฟิตแห่งใหม่ที่ Central ...,https://www.facebook.com/KhonKaenLetsGo/posts/%E0%B8%A1%E0%B8%B2%E0%B8%88%E0%B8%A3%E0%B8%B4%E0%B8%87%E0%B9%84%E0%B8%A1%E0%B9%88%E0%B8%88%E0%B8%81%E0%B8%95%E0%B8%B2-jetts-fitness-%E0%B8%9B%E0%B8%B1%E0%B8%81%E0%B8%AB%E0%B8%A1%E0%B8%B8%E0%B8%94%E0%B8%84%E0%B8%A7%E0%B8%B2%E0%B8%A1%E0%B8%9F%E0%B8%B4%E0%B8%95%E0%B9%81%E0%B8%AB%E0%B9%88%E0%B8%87%E0%B9%83%E0%B8%AB%E0%B8%A1%E0%B9%88%E0%B8%97%E0%B8%B5%E0%B9%88-central-khon-kaen-campus-%E0%B8%AA/1526603019090536/,สายออกกำลังกายเตรียมตัวให้พร้อม เพราะขอนแก่นกำลังจะมี Jetts Fitness ฟิตเนสเปิด 24 ชั่วโมง แห่งแรกของจังหวัด เปิดให้ฟิตได้ทุกเวลา ไม่ว่าจะเช้า สาย เย็น หรือดึกก็แวะมาเบิร์นกันได้แบบไม่มีข้อจำกัด .,www.facebook.com
2026-05-14,Unknown,"it's about your time, your way. That ...",https://www.instagram.com/p/DWdVcF7le3z/,"At Jetts, fitness isn't about following someone else's schedule or doing things a certain way - it's about your time, your way. That could be a peaceful solo ...",www.instagram.com
2026-05-14,Unknown,"Feels like home, that's what matters to us! A place where ...",https://www.instagram.com/p/DXGURi1ldrd/,. more. 6 days ago. OCR. MI E M MEMBER BER FEEDBACK Jetts Fitness Freedom Jetts Fitness is easily 5-star gym and hands down one of the most ...,www.instagram.com
2026-05-14,Unknown,🌸 Spring into Fitness at Jetts - FREE Membership until May ...,https://www.instagram.com/p/DWWB0DDAt2T/,SAVE SAVEUP UP tO $160 Jetts Fitness FitnessFreedom Freedom *T&Csapply apply T&Csa ... Jetts Fitness FitnessFreedom Freedom Jetts Yokine refurb is amazing ...,www.instagram.com
2026-05-14,Unknown,"28 Days in the month, 20+ visits in the books",https://www.instagram.com/p/DVcjw6wEs8F/,MOST ACTIVE MEMBERS 1 - Shane B 45 Visits Jetts Fitness Freedom ... April 20+ Visit Club Well Done to all of the Legends who made this list! more. 4 days ago.,www.instagram.com
2026-05-14,Unknown,"Jetts Fitness India on Instagram: ""A strong start in India. Jetts ...",https://www.instagram.com/reel/DUU9Yksj-Lp/,"jettsfitnessindia on February 3, 2026: ""A strong start in India. Jetts Fitness officially marked its India debut with a pre-opening buzz event for Delhi's ...",www.instagram.com
2026-05-14,Unknown,"2026 is about freedom, flexibility & feeling strong",https://www.instagram.com/p/DTwTfQhEwra/,"Photo by Jetts Fitness Freedom on January 20, 2026. May be an image of.",www.instagram.com
2026-05-14,Unknown,"Jetts Blends Fitness and Pop Culture, Fusing Music ...",https://www.facebook.com/TheNationThailand/posts/jetts-blends-fitness-and-pop-culture-fusing-music-and-movement-at-jetts-x-milli-/1366112078875456/,"Jetts Fitness, a leading 24-hour fitness brand, elevated the workout experience into a high-energy lifestyle event with “JETTS x MILLI: Move Like a HEAVYWEIGHT” ...",www.facebook.com
2026-05-14,Unknown,That's why our slogan is Fitness Freedom. Train where it ...,https://www.facebook.com/jetts.kenmore/videos/thats-why-our-slogan-is-fitness-freedom-train-where-it-suits-you-when-it-suits-y/1958517064782570/,"That's why our slogan is Fitness Freedom. Train where it suits you, when it suits you. No strings attached.",www.facebook.com
2026-05-14,Unknown,ชาวอุดรพร้อมที่จะฟิตกับ Jetts หรือยัง 🔥 พบกันที่ Jetts Fitness ...,https://www.facebook.com/JettsThailand/posts/%E0%B8%8A%E0%B8%B2%E0%B8%A7%E0%B8%AD%E0%B8%B8%E0%B8%94%E0%B8%A3%E0%B8%9E%E0%B8%A3%E0%B9%89%E0%B8%AD%E0%B8%A1%E0%B8%97%E0%B8%B5%E0%B9%88%E0%B8%88%E0%B8%B0%E0%B8%9F%E0%B8%B4%E0%B8%95%E0%B8%81%E0%B8%B1%E0%B8%9A-jetts-%E0%B8%AB%E0%B8%A3%E0%B8%B7%E0%B8%AD%E0%B8%A2%E0%B8%B1%E0%B8%87-%E0%B8%9E%E0%B8%9A%E0%B8%81%E0%B8%B1%E0%B8%99%E0%B8%97%E0%B8%B5%E0%B9%88-jetts-fitness-plus-udon-%E0%B8%9E%E0%B8%A3%E0%B9%89%E0%B8%AD%E0%B8%A1%E0%B9%82%E0%B8%9B%E0%B8%A3%E0%B9%82/1465072978402110/,"เข้าได้ทุกสาขาทั่วไทย เปิดตลอด 24 ชั่วโมง เข้าได้ทุกคลาส ออกกำลังกายได้ทุกโซน ฟรีค่าแรกเข้า และค่าบัตรสมาชิก (มูลค่า 3,000 บาท) ฟิตได้ในแบบของคุณ ที่ Jetts Fitness 24 ชั่วโมง ** ...",www.facebook.com
2026-05-14,Unknown,Rise with the year and begin anew at Jetts Fitness. It is time ...,https://www.instagram.com/jetts_fitness/p/DUHxiDhj5kS/?hl=am-et,"Rise with the year and begin anew at Jetts Fitness. It is time to turn your resolutions into reality with our ""New Year New Gains"" mission.",www.instagram.com
2026-05-14,Unknown,JETTS FITNESS CELEBRATES 60 CLUBS! 🎉✨ ร่วมฉลองก้าว ...,https://www.facebook.com/JettsThailand/videos/jetts-fitness-celebrates-60-clubs-%E0%B8%A3%E0%B9%88%E0%B8%A7%E0%B8%A1%E0%B8%89%E0%B8%A5%E0%B8%AD%E0%B8%87%E0%B8%81%E0%B9%89%E0%B8%B2%E0%B8%A7%E0%B8%AA%E0%B8%B3%E0%B8%84%E0%B8%B1%E0%B8%8D%E0%B8%81%E0%B8%B1%E0%B8%9A%E0%B9%80%E0%B8%88%E0%B9%87%E0%B8%97%E0%B8%AA%E0%B9%8C-%E0%B8%9F%E0%B8%B4%E0%B8%95%E0%B9%80%E0%B8%99%E0%B8%AA-%E0%B9%83%E0%B8%99%E0%B9%82%E0%B8%AD%E0%B8%81%E0%B8%B2%E0%B8%AA%E0%B9%80%E0%B8%9B%E0%B8%B4%E0%B8%94%E0%B8%84/1526971375696881/,Jetts Fitness Hatyai Village ขอมอบของขวัญสุดพิเศษให้สายฟิตได้มาฉลองด้วยกัน สมัครสมาชิกวันนี้ รับสิทธิ์เล่นฟิตเนสฟรี 60 วัน!* ความฟิตระดับโลก พร้อมให้บริการคุณมากกว่าเดิม ครอบคลุมกว่าเดิม และ ...,www.facebook.com
2026-05-14,Unknown,"สนใจ+หาโปร Jetts Fitness สาขา เวสวิล , park silom แนะนำ ...",https://www.facebook.com/groups/460157301442247/posts/2124829071641720/,"สนใจ+หาโปร Jetts Fitness สาขา เวสวิล , park silom แนะนำหน่อยค่า.",www.facebook.com
2026-05-14,28 ก.พ. 2026,️ indexbangyai@jetts.co.th สแกน QR Code เพื่อทำความรู้จักสาขา ...,https://www.facebook.com/JettsThailand/posts/%E0%B9%81%E0%B8%99%E0%B8%B0%E0%B8%99%E0%B8%B3-highlighted-club-%E0%B8%88%E0%B8%B2%E0%B8%81-jetts-fitness-jetts-fitness-index-living-mall-bangyai/1434829594759782/,สแกน QR Code เพื่อซื้อเสื้อผ่านเว็บไซต์ Jetts Fitness หรือคลิกลิงก์ได้เลย https://tinyurl.com/JxMTshirt ใครยังไม่มีบัตร ตอนนี้ยังสามารถซื้อบัตรได้อยู่น้า ซื้อได้ผ่านเว็บไซต์ หรือรับ ราคา ...,www.facebook.com
2026-05-14,Unknown,ฉลองเปิดสาขาใหม่! 📍 Jetts Fitness The Walk Kaset-nawamin ...,https://www.facebook.com/JettsThailand/posts/-%E0%B8%89%E0%B8%A5%E0%B8%AD%E0%B8%87%E0%B9%80%E0%B8%9B%E0%B8%B4%E0%B8%94%E0%B8%AA%E0%B8%B2%E0%B8%82%E0%B8%B2%E0%B9%83%E0%B8%AB%E0%B8%A1%E0%B9%88-jetts-fitness-the-walk-kaset-nawamin-%E0%B8%AA%E0%B8%A1%E0%B8%B1%E0%B8%84%E0%B8%A3%E0%B8%AA%E0%B8%A1%E0%B8%B2%E0%B8%8A%E0%B8%B4%E0%B8%81%E0%B9%83%E0%B8%AB%E0%B8%A1%E0%B9%88-%E0%B8%A3%E0%B8%B0%E0%B8%AB%E0%B8%A7%E0%B9%88%E0%B8%B2%E0%B8%87%E0%B8%A7%E0%B8%B1/1411579467084795/,Jetts Fitness สาขา PLUS UDON เปิดรับสมัคร GX Freelance Instructors มาร่วมเป็นส่วนหนึ่งของทีม No.1 Gym ในประเทศไทย! เรารับสมัครครูผู้สอนในหลากหลายโปรแกรม: ✓ LES MILLS ( ...,www.facebook.com
2026-05-14,Unknown,คลับใหม่ ที่ไหนดี? 🤔🔥 Jetts Fitness บุกกรุงเทพอีกครั้ง! 💥🏋️‍ ...,https://www.facebook.com/JettsThailand/posts/%E0%B8%84%E0%B8%A5%E0%B8%B1%E0%B8%9A%E0%B9%83%E0%B8%AB%E0%B8%A1%E0%B9%88-%E0%B8%97%E0%B8%B5%E0%B9%88%E0%B9%84%E0%B8%AB%E0%B8%99%E0%B8%94%E0%B8%B5-jetts-fitness-%E0%B8%9A%E0%B8%B8%E0%B8%81%E0%B8%81%E0%B8%A3%E0%B8%B8%E0%B8%87%E0%B9%80%E0%B8%97%E0%B8%9E%E0%B8%AD%E0%B8%B5%E0%B8%81%E0%B8%84%E0%B8%A3%E0%B8%B1%E0%B9%89%E0%B8%87-%EF%B8%8F%EF%B8%8F%E0%B8%84%E0%B8%A5%E0%B8%B1%E0%B8%9A%E0%B9%83%E0%B8%AB%E0%B8%A1%E0%B9%88%E0%B8%84%E0%B8%A3%E0%B8%B1%E0%B9%89%E0%B8%87%E0%B8%99%E0%B8%B5%E0%B9%89-%E0%B8%A5%E0%B8%AD%E0%B8%87%E0%B8%84%E0%B8%AD%E0%B8%A1%E0%B9%80%E0%B8%A1%E0%B8%99%E0%B8%95/1470849364491138/,"Jetts Fitness ชวนชาวฉลองมาแดนซ์ให้สุดพลัง กับ Aerobic Fever 3 วันเต็มของความสนุก ทั้ง Zumba, Variety Dance และ BODYCOMBAT ✨ ลานแมวน้ำ ชั้น 1 ...",www.facebook.com
2026-05-14,Unknown,Jetts Fitness Thailand ร่วมเป็นส่วนหนึ่งของกระแสฟิตระดับโลก ...,https://www.facebook.com/JettsThailand/posts/jetts-fitness-thailand-%E0%B8%A3%E0%B9%88%E0%B8%A7%E0%B8%A1%E0%B9%80%E0%B8%9B%E0%B9%87%E0%B8%99%E0%B8%AA%E0%B9%88%E0%B8%A7%E0%B8%99%E0%B8%AB%E0%B8%99%E0%B8%B6%E0%B9%88%E0%B8%87%E0%B8%82%E0%B8%AD%E0%B8%87%E0%B8%81%E0%B8%A3%E0%B8%B0%E0%B9%81%E0%B8%AA%E0%B8%9F%E0%B8%B4%E0%B8%95%E0%B8%A3%E0%B8%B0%E0%B8%94%E0%B8%B1%E0%B8%9A%E0%B9%82%E0%B8%A5%E0%B8%81%E0%B8%81%E0%B8%B1%E0%B8%9A%E0%B8%81%E0%B8%B2%E0%B8%A3%E0%B9%80%E0%B8%9B%E0%B8%B4%E0%B8%94%E0%B8%95%E0%B8%B1%E0%B8%A7%E0%B8%AD%E0%B8%B5%E0%B9%80%E0%B8%A7%E0%B8%99%E0%B8%95%E0%B9%8C%E0%B8%AA/1476678737241534/,Jetts Fitness ร่วมกับ Gateway at Bangsue ชวนทุกคนมาขยับร่างกายให้สุด จัดเต็มสองคลาส ✨เริ่มด้วยแดนซ์ให้สะบัดใน Aerobic แล้วจบกับความบู๊ใน BODYCOMBAT ลานหน้าศูนย์การค้า Gateway at ...,www.facebook.com
2026-05-14,Unknown,🚀 สมาชิกใหม่ พร้อมมั้ย? พบกับ Jetts Fitness 10 Weeks New ...,https://www.facebook.com/JettsThailand/posts/-%E0%B8%AA%E0%B8%A1%E0%B8%B2%E0%B8%8A%E0%B8%B4%E0%B8%81%E0%B9%83%E0%B8%AB%E0%B8%A1%E0%B9%88-%E0%B8%9E%E0%B8%A3%E0%B9%89%E0%B8%AD%E0%B8%A1%E0%B8%A1%E0%B8%B1%E0%B9%89%E0%B8%A2%E0%B8%9E%E0%B8%9A%E0%B8%81%E0%B8%B1%E0%B8%9A-jetts-fitness-10-weeks-new-member-journey-10-%E0%B8%AA%E0%B8%B1%E0%B8%9B%E0%B8%94%E0%B8%B2%E0%B8%AB%E0%B9%8C-/1398276905081718/,พบกับ Jetts Fitness 10 Weeks New Member Journey ⏱ 10 สัปดาห์ | 10 ภารกิจ ทำสำเร็จ รับรางวัลไปได้เลย!* กติกาง่าย ๆ ดาวน์โหลดแอป ลงทะเบียน ทำภารกิจ รับรางวัล ...,www.facebook.com
2026-05-14,Unknown,จะเจนไหนก็เทรนได้ที่ Jetts Fitness ตลอด 24 ชั่วโมง ส่วนแอดขอ ...,https://www.facebook.com/JettsThailand/posts/%E0%B8%88%E0%B8%B0%E0%B9%80%E0%B8%88%E0%B8%99%E0%B9%84%E0%B8%AB%E0%B8%99%E0%B8%81%E0%B9%87%E0%B9%80%E0%B8%97%E0%B8%A3%E0%B8%99%E0%B9%84%E0%B8%94%E0%B9%89%E0%B8%97%E0%B8%B5%E0%B9%88-jetts-fitness-%E0%B8%95%E0%B8%A5%E0%B8%AD%E0%B8%94-24-%E0%B8%8A%E0%B8%B1%E0%B9%88%E0%B8%A7%E0%B9%82%E0%B8%A1%E0%B8%87%E0%B8%AA%E0%B9%88%E0%B8%A7%E0%B8%99%E0%B9%81%E0%B8%AD%E0%B8%94%E0%B8%82%E0%B8%AD%E0%B8%95%E0%B8%B1%E0%B8%A7%E0%B9%84%E0%B8%9B%E0%B9%80%E0%B8%82%E0%B9%89%E0%B8%B2%E0%B8%84%E0%B8%A5%E0%B8%B2%E0%B8%AA%E0%B8%81%E0%B9%88%E0%B8%AD%E0%B8%99%E0%B8%99%E0%B9%89%E0%B8%B2%E0%B8%AB/1494795665429841/,เตรียมพบกับความมันส์แบบจัดเต็มใน Grand Opening Jetts Fitness Central Khon Kaen Campus วันพุธที่ 20 พฤษภาคมนี้! พบกับตารางคลาสสุดเดือดตั้งแต่วันยันค่ำ ...,www.facebook.com
2026-05-14,Unknown,JettsThailand,https://www.facebook.com/JettsThailand/posts/%E0%B9%81%E0%B8%99%E0%B8%B0%E0%B8%99%E0%B8%B3-highlighted-club-%E0%B8%88%E0%B8%B2%E0%B8%81-jetts-fitness-jetts-fitness-central-surat-thanithe-fi/1432340425008699/,แนะนำ Highlighted Club จาก Jetts Fitness ✨ Jetts Fitness Central Surat Thani The Fitness Hub of Surat Thani ศูนย์กลางความฟิตของชาวสุราษฎร์ธานี ครบ จบในที่เดียว 🏋️‍♂️✨ ...,www.facebook.com
2026-05-14,Unknown,🦖 เฉลย! คลับใหม่บุกแดนไดโนเสาร์ ขยายความฟิตสู่ภาคอีสาน 🔥 ...,https://www.facebook.com/JettsThailand/posts/-%E0%B9%80%E0%B8%89%E0%B8%A5%E0%B8%A2-%E0%B8%84%E0%B8%A5%E0%B8%B1%E0%B8%9A%E0%B9%83%E0%B8%AB%E0%B8%A1%E0%B9%88%E0%B8%9A%E0%B8%B8%E0%B8%81%E0%B9%81%E0%B8%94%E0%B8%99%E0%B9%84%E0%B8%94%E0%B9%82%E0%B8%99%E0%B9%80%E0%B8%AA%E0%B8%B2%E0%B8%A3%E0%B9%8C%E0%B8%82%E0%B8%A2%E0%B8%B2%E0%B8%A2%E0%B8%84%E0%B8%A7%E0%B8%B2%E0%B8%A1%E0%B8%9F%E0%B8%B4%E0%B8%95%E0%B8%AA%E0%B8%B9%E0%B9%88%E0%B8%A0%E0%B8%B2%E0%B8%84%E0%B8%AD%E0%B8%B5%E0%B8%AA%E0%B8%B2%E0%B8%99-%EF%B8%8F-jetts-fitness-central-khon/1442259234016818/,Jetts Fitness สาขา PLUS UDON เปิดรับสมัคร GX Freelance Instructors มาร่วมเป็นส่วนหนึ่งของทีม No.1 Gym ในประเทศไทย! เรารับสมัครครูผู้สอนในหลากหลายโปรแกรม: ✓ LES MILLS ( ...,www.facebook.com
2026-05-14,Unknown,💪🔥 Jetts Fitness เตรียมขยายความฟิตสาขาใหม่ปี 2026 🚚 เจ็ทส์ ...,https://www.facebook.com/JettsThailand/posts/-jetts-fitness-%E0%B9%80%E0%B8%95%E0%B8%A3%E0%B8%B5%E0%B8%A2%E0%B8%A1%E0%B8%82%E0%B8%A2%E0%B8%B2%E0%B8%A2%E0%B8%84%E0%B8%A7%E0%B8%B2%E0%B8%A1%E0%B8%9F%E0%B8%B4%E0%B8%95%E0%B8%AA%E0%B8%B2%E0%B8%82%E0%B8%B2%E0%B9%83%E0%B8%AB%E0%B8%A1%E0%B9%88%E0%B8%9B%E0%B8%B5-2026-%E0%B9%80%E0%B8%88%E0%B9%87%E0%B8%97%E0%B8%AA%E0%B9%8C%E0%B8%88%E0%B8%B0%E0%B9%84%E0%B8%9B%E0%B8%9A%E0%B8%B8%E0%B8%81%E0%B8%97%E0%B8%B5%E0%B9%88%E0%B9%84%E0%B8%AB%E0%B8%99-%E0%B8%A5%E0%B8%AD%E0%B8%87%E0%B8%97%E0%B8%B2%E0%B8%A2%E0%B8%81%E0%B8%B1%E0%B8%99%E0%B8%94%E0%B8%B9-/1391657862410289/,Jetts Fitness สาขา PLUS UDON เปิดรับสมัคร GX Freelance Instructors มาร่วมเป็นส่วนหนึ่งของทีม No.1 Gym ในประเทศไทย! เรารับสมัครครูผู้สอนในหลากหลายโปรแกรม: ✓ LES MILLS ( ...,www.facebook.com
2026-05-14,Unknown,มาแล้ว! 🔥 บัตร Early Bird กิจกรรม JETTS x MILLI: Move Like a ...,https://www.facebook.com/JettsThailand/posts/%E0%B8%A1%E0%B8%B2%E0%B9%81%E0%B8%A5%E0%B9%89%E0%B8%A7-%E0%B8%9A%E0%B8%B1%E0%B8%95%E0%B8%A3-early-bird-%E0%B8%81%E0%B8%B4%E0%B8%88%E0%B8%81%E0%B8%A3%E0%B8%A3%E0%B8%A1-jetts-x-milli-move-like-a-heavyweight%E0%B8%A3%E0%B8%B2%E0%B8%84%E0%B8%B2%E0%B9%80%E0%B8%9E%E0%B8%B5%E0%B8%A2%E0%B8%87-99/1430086815234060/,Jetts Fitness สาขา PLUS UDON เปิดรับสมัคร GX Freelance Instructors มาร่วมเป็นส่วนหนึ่งของทีม No.1 Gym ในประเทศไทย! เรารับสมัครครูผู้สอนในหลากหลายโปรแกรม: ✓ LES MILLS ( ...,www.facebook.com
2026-05-14,Unknown,ออกกำลังกายเสร็จ ไม่ต้องวิ่งหาร้าน 💥 แค่เดินไปหา ตู้เต่าบิน ที่ ...,https://www.facebook.com/JettsThailand/posts/%E0%B8%AD%E0%B8%AD%E0%B8%81%E0%B8%81%E0%B8%B3%E0%B8%A5%E0%B8%B1%E0%B8%87%E0%B8%81%E0%B8%B2%E0%B8%A2%E0%B9%80%E0%B8%AA%E0%B8%A3%E0%B9%87%E0%B8%88-%E0%B9%84%E0%B8%A1%E0%B9%88%E0%B8%95%E0%B9%89%E0%B8%AD%E0%B8%87%E0%B8%A7%E0%B8%B4%E0%B9%88%E0%B8%87%E0%B8%AB%E0%B8%B2%E0%B8%A3%E0%B9%89%E0%B8%B2%E0%B8%99-%E0%B9%81%E0%B8%84%E0%B9%88%E0%B9%80%E0%B8%94%E0%B8%B4%E0%B8%99%E0%B9%84%E0%B8%9B%E0%B8%AB%E0%B8%B2-%E0%B8%95%E0%B8%B9%E0%B9%89%E0%B9%80%E0%B8%95%E0%B9%88%E0%B8%B2%E0%B8%9A%E0%B8%B4%E0%B8%99-%E0%B8%97%E0%B8%B5%E0%B9%88-jetts-fitness%E0%B8%A2%E0%B8%81%E0%B8%A3%E0%B8%B0%E0%B8%94/1396785478564194/,ออกกำลังกายเสร็จ ไม่ต้องวิ่งหาร้าน แค่เดินไปหา ตู้เต่าบิน ที่ Jetts Fitness ยกระดับประสบการณ์ฟิตเนส ด้วยเครื่องดื่มโปรตีนพร้อมดื่มจากเต่าบิน ครบ จบ ฟิต ในที่เดียว เหงื่อออก กดเต่า พร้อมลุยต่อ ...,www.facebook.com
2026-05-14,Unknown,ภาพบรรยากาศจากงาน Bikini Run Chanthaburi 2026 Jetts ...,https://www.facebook.com/JettsThailand/posts/%E0%B8%A0%E0%B8%B2%E0%B8%9E%E0%B8%9A%E0%B8%A3%E0%B8%A3%E0%B8%A2%E0%B8%B2%E0%B8%81%E0%B8%B2%E0%B8%A8%E0%B8%88%E0%B8%B2%E0%B8%81%E0%B8%87%E0%B8%B2%E0%B8%99-bikini-run-chanthaburi-2026jetts-fitness-%E0%B9%84%E0%B8%94%E0%B9%89%E0%B8%A3%E0%B9%88%E0%B8%A7%E0%B8%A1%E0%B9%80%E0%B8%9B%E0%B9%87%E0%B8%99%E0%B8%AA%E0%B9%88%E0%B8%A7%E0%B8%99%E0%B8%AB%E0%B8%99%E0%B8%B6%E0%B9%88%E0%B8%87%E0%B9%83/1469682131274528/,งานนี้สถานทูตออสเตรเลียประจำประเทศไทย และ Jetts Fitness ร่วมกันเปลี่ยนบรรยากาศยามเช้าของสวนป่าเบญจกิติ ให้เต็มไปด้วยความฟิตจากคลาสออกกำลังกายระดับโลกอย่า ง BODYCOMBAT และ ...,www.facebook.com
2026-05-14,Unknown,ชาวหาดใหญ่ เตรียมปลุกพลังความฟิต 24 ชั่วโมง ⏳🔥 ...,https://www.facebook.com/JettsThailand/posts/%E0%B8%8A%E0%B8%B2%E0%B8%A7%E0%B8%AB%E0%B8%B2%E0%B8%94%E0%B9%83%E0%B8%AB%E0%B8%8D%E0%B9%88-%E0%B9%80%E0%B8%95%E0%B8%A3%E0%B8%B5%E0%B8%A2%E0%B8%A1%E0%B8%9B%E0%B8%A5%E0%B8%B8%E0%B8%81%E0%B8%9E%E0%B8%A5%E0%B8%B1%E0%B8%87%E0%B8%84%E0%B8%A7%E0%B8%B2%E0%B8%A1%E0%B8%9F%E0%B8%B4%E0%B8%95-24-%E0%B8%8A%E0%B8%B1%E0%B9%88%E0%B8%A7%E0%B9%82%E0%B8%A1%E0%B8%87-%E0%B9%80%E0%B8%95%E0%B8%A3%E0%B8%B5%E0%B8%A2%E0%B8%A1%E0%B8%9E%E0%B8%9A%E0%B8%81%E0%B8%B1%E0%B8%9A-jetts-fitness-hatyai-vil/1394588495450559/,ชาวหาดใหญ่ เตรียมปลุกพลังความฟิต 24 ชั่วโมง ⏳ เตรียมพบกับ Jetts Fitness Hatyai Village สาขาแรกของหาดใหญ่ ราคาพิเศษสุดคุ้ม ความฟิตแบบ 24 ชั่วโมง เริ่มต้นเพียง 999 บาท/เดือน — ...,www.facebook.com
2026-05-14,Unknown,28 กุมภาพันธ์ 69 📍 สมัครได้ที่ Jetts ทุกสาขาทั่วไทย *สำหรับการ ...,https://www.facebook.com/JettsThailand/posts/your-stronger-self-starts-here-%E0%B9%80%E0%B8%94%E0%B8%B7%E0%B8%AD%E0%B8%99%E0%B9%81%E0%B8%AB%E0%B9%88%E0%B8%87%E0%B8%84%E0%B8%A7%E0%B8%B2%E0%B8%A1%E0%B8%A3%E0%B8%B1%E0%B8%81-%E0%B8%A1%E0%B8%B2%E0%B9%80%E0%B8%A3%E0%B8%B4%E0%B9%88%E0%B8%A1%E0%B8%95%E0%B9%89%E0%B8%99%E0%B8%A3%E0%B8%B1%E0%B8%81%E0%B8%95%E0%B8%B1%E0%B8%A7%E0%B9%80%E0%B8%AD%E0%B8%87%E0%B9%84%E0%B8%94%E0%B9%89%E0%B8%97%E0%B8%B8%E0%B8%81%E0%B8%A7%E0%B8%B1%E0%B8%99-%EF%B8%8F%E0%B9%80%E0%B8%9B/1412497810326294/,เตรียมพบกับความมันส์แบบจัดเต็มใน Grand Opening Jetts Fitness Central Khon Kaen Campus วันพุธที่ 20 พฤษภาคมนี้! พบกับตารางคลาสสุดเดือดตั้งแต่วันยันค่ำ ...,www.facebook.com
