Date_Extracted,Published_Date,Heading,URL,Body_Snippet,Source_Site
2026-05-14,Unknown,Jetts Fitness เตรียมบุกคลับใหม่ทั่วไทย 🔥🇹🇭 🤔 คราวนี้จะเป็น ...,https://www.facebook.com/JettsThailand/posts/jetts-fitness-%E0%B9%80%E0%B8%95%E0%B8%A3%E0%B8%B5%E0%B8%A2%E0%B8%A1%E0%B8%9A%E0%B8%B8%E0%B8%81%E0%B8%84%E0%B8%A5%E0%B8%B1%E0%B8%9A%E0%B9%83%E0%B8%AB%E0%B8%A1%E0%B9%88%E0%B8%97%E0%B8%B1%E0%B9%88%E0%B8%A7%E0%B9%84%E0%B8%97%E0%B8%A2-%E0%B8%84%E0%B8%A3%E0%B8%B2%E0%B8%A7%E0%B8%99%E0%B8%B5%E0%B9%89%E0%B8%88%E0%B8%B0%E0%B9%80%E0%B8%9B%E0%B9%87%E0%B8%99%E0%B8%88%E0%B8%B1%E0%B8%87%E0%B8%AB%E0%B8%A7%E0%B8%B1%E0%B8%94%E0%B9%84%E0%B8%AB%E0%B8%99-%E0%B8%A5%E0%B8%AD%E0%B8%87%E0%B8%97%E0%B8%B2%E0%B8%A2%E0%B8%81%E0%B8%B1%E0%B8%99%E0%B9%80%E0%B8%82%E0%B9%89%E0%B8%B2%E0%B8%A1%E0%B8%B2%E0%B9%84%E0%B8%94/1438507051058703/,Jetts Fitness เตรียมบุกคลับใหม่ทั่วไทย คราวนี้จะเป็นจังหวัดไหน ลองทายกันเข้ามาได้เลย #jettsfitness #jettsthailand #no1gyminthailand.,www.facebook.com
2026-05-14,Unknown,เต้นให้สะบัด เบิร์นให้สุดพลัง🔥 ใน ZUMBA Special Class 🎉 📅 ...,https://www.instagram.com/p/DUpuy9oDUTW/,"Follow. Photo by Jetts Fitness Thailand on February 12, 2026. May be an ...",www.instagram.com
2026-05-14,Unknown,🎉 ฉลองเปิดสาขาใหม่! 📍 Jetts Fitness Index Living Mall ...,https://www.facebook.com/JettsThailand/posts/-%E0%B8%89%E0%B8%A5%E0%B8%AD%E0%B8%87%E0%B9%80%E0%B8%9B%E0%B8%B4%E0%B8%94%E0%B8%AA%E0%B8%B2%E0%B8%82%E0%B8%B2%E0%B9%83%E0%B8%AB%E0%B8%A1%E0%B9%88-jetts-fitness-index-living-mall-chonburi-%E0%B8%AA%E0%B8%A1%E0%B8%B1%E0%B8%84%E0%B8%A3%E0%B8%AA%E0%B8%A1%E0%B8%B2%E0%B8%8A%E0%B8%B4%E0%B8%81%E0%B9%83%E0%B8%AB%E0%B8%A1%E0%B9%88-%E0%B8%A3%E0%B8%B0%E0%B8%AB%E0%B8%A7%E0%B9%88/1397939998448742/,ฉลองเปิดสาขาใหม่! Jetts Fitness Index Living Mall Chonburi สมัครสมาชิกใหม่ ระหว่างวันที่ 15 – 19 มกราคม 2569 รับทันที! ✨ Gift Set จาก Chabaa...,www.facebook.com
2026-05-14,Unknown,สุขสันต์วันสงกรานต์จาก Jetts Fitness สงกรานต์ปีนี้ Jetts Fitness ขอ ...,https://www.facebook.com/JettsThailand/videos/%E0%B8%AA%E0%B8%B8%E0%B8%82%E0%B8%AA%E0%B8%B1%E0%B8%99%E0%B8%95%E0%B9%8C%E0%B8%A7%E0%B8%B1%E0%B8%99%E0%B8%AA%E0%B8%87%E0%B8%81%E0%B8%A3%E0%B8%B2%E0%B8%99%E0%B8%95%E0%B9%8C%E0%B8%88%E0%B8%B2%E0%B8%81-jetts-fitness-%E0%B8%AA%E0%B8%87%E0%B8%81%E0%B8%A3%E0%B8%B2%E0%B8%99%E0%B8%95%E0%B9%8C%E0%B8%9B%E0%B8%B5%E0%B8%99%E0%B8%B5%E0%B9%89-jetts-fitness-%E0%B8%82%E0%B8%AD%E0%B9%80%E0%B8%9B%E0%B9%87%E0%B8%99%E0%B8%AA%E0%B9%88%E0%B8%A7%E0%B8%99%E0%B8%AB%E0%B8%99%E0%B8%B6%E0%B9%88%E0%B8%87/1267179881632283/,สุขสันต์วันสงกรานต์จาก Jetts Fitness สงกรานต์ปีนี้ Jetts Fitness ขอเป็นส่วนหนึ่งในการส่งต่อความสุข ความสนุก และสุขภาพที่ดีให้กับชาวเจ็ทส์ทุกคน!...,www.facebook.com
2026-05-14,Unknown,Happy Songkran Days at Jetts Fitness HQ.,https://www.instagram.com/p/DW8MjnTF2En/,"4 likes, 0 comments - b_panida on April 9, 2026: ""Happy Songkran Days at Jetts Fitness HQ."".",www.instagram.com
2026-05-14,22 มี.ค. 2026,Milli Move Like a Heavyweight 2026,https://www.jetts.co.th/milli-move-like-a-heavyweight-2026/,5. การเปลี่ยนแปลงที่อยู่จัดส่ง หากต้องการเปลี่ยนแปลงที่อยู่จัดส่ง กรุณาแจ้งความประสงค์ผ่านทาง Facebook Fanpage: Jetts Fitness Thailand 6. ขอสงวนสิทธิ์ในการ ...,www.jetts.co.th
2026-05-14,Unknown,ฟิตรับเช้าวันเสาร์กับ Jetts Fitness x สถานทูตออสเตรเลีย! 🇦🇺💪 ...,https://www.facebook.com/JettsThailand/posts/%E0%B8%9F%E0%B8%B4%E0%B8%95%E0%B8%A3%E0%B8%B1%E0%B8%9A%E0%B9%80%E0%B8%8A%E0%B9%89%E0%B8%B2%E0%B8%A7%E0%B8%B1%E0%B8%99%E0%B9%80%E0%B8%AA%E0%B8%B2%E0%B8%A3%E0%B9%8C%E0%B8%81%E0%B8%B1%E0%B8%9A-jetts-fitness-x-%E0%B8%AA%E0%B8%96%E0%B8%B2%E0%B8%99%E0%B8%97%E0%B8%B9%E0%B8%95%E0%B8%AD%E0%B8%AD%E0%B8%AA%E0%B9%80%E0%B8%95%E0%B8%A3%E0%B9%80%E0%B8%A5%E0%B8%B5%E0%B8%A2-%E0%B9%80%E0%B8%95%E0%B8%A3%E0%B8%B5%E0%B8%A2%E0%B8%A1%E0%B8%8A%E0%B8%B8%E0%B8%94%E0%B8%AD%E0%B8%AD%E0%B8%81%E0%B8%81%E0%B8%B3%E0%B8%A5%E0%B8%B1%E0%B8%87%E0%B8%81%E0%B8%B2%E0%B8%A2%E0%B9%83%E0%B8%AB%E0%B9%89%E0%B8%9E/1488990572677017/,ฟิตรับเช้าวันเสาร์กับ Jetts Fitness x สถานทูตออสเตรเลีย! เตรียมชุดออกกำลังกายให้พร้อม แล้วมาเจอกันที่ สวนป่าเบญจกิติ กับงาน Fit 'n Fun Morning...,www.facebook.com
2026-05-14,Unknown,ร่วมส่งเสียงเชียร์ และกำลังใจให้ MILLI 🎤🔥 ในรอบไฟนอลรายการ ...,https://www.facebook.com/JettsThailand/posts/%E0%B8%A3%E0%B9%88%E0%B8%A7%E0%B8%A1%E0%B8%AA%E0%B9%88%E0%B8%87%E0%B9%80%E0%B8%AA%E0%B8%B5%E0%B8%A2%E0%B8%87%E0%B9%80%E0%B8%8A%E0%B8%B5%E0%B8%A2%E0%B8%A3%E0%B9%8C-%E0%B9%81%E0%B8%A5%E0%B8%B0%E0%B8%81%E0%B8%B3%E0%B8%A5%E0%B8%B1%E0%B8%87%E0%B9%83%E0%B8%88%E0%B9%83%E0%B8%AB%E0%B9%89-milli-%E0%B9%83%E0%B8%99%E0%B8%A3%E0%B8%AD%E0%B8%9A%E0%B9%84%E0%B8%9F%E0%B8%99%E0%B8%AD%E0%B8%A5%E0%B8%A3%E0%B8%B2%E0%B8%A2%E0%B8%81%E0%B8%B2%E0%B8%A3-show-me-the-money-12-%E0%B8%A7%E0%B8%B1%E0%B8%99/1460900758819332/,... Jetts Fitness ชวนชาวเจ็ทส์มารวมพลัง #เชียร์นวยสุดใจคนไทยไม่ทิ้งกัน ไปด้วยกัน! ✨ รายการ Show Me The Money 12 ดูสดพร้อมกัน ทุกวันพฤหัสบดี เวลา ...,www.facebook.com
2026-05-14,Unknown,No motivation? Show up anyway. No time? Make time ...,https://www.instagram.com/reel/DWyjZVNgSUk/,jettsfitnessthailand. ชาวภูเก็ต พร้อมฟิตแบบไม่ต้องพัก! 🏝️ กับ Jetts Fitness Robinson Lifestyle Chalong จัดเต็มความฟิต 24 ชั่วโมง จะสายไหนก็เอาอยู่:,www.instagram.com
2026-05-14,14 ก.พ. 2026,Jetts Lucky Truck Corporate,https://www.jetts.co.th/jetts-lucky-truck-corporate/,"Jetts 24 Hour Fitness Jetts Fitness. Freedom; พิเศษเดือนแรก 999 บาท; เดือนถัดไป 1,550 บาท/ต่อเดือน; เข้าใช้คลับและคลาสได้ไม่จำกัด; เป็นสมาชิกขั้นต่ำ 3 เดือน",www.jetts.co.th
2026-05-14,Unknown,เสริมความแข็งแกร่งที่ Jetts Fitness เตรียมร่างกายให้พร้อมสำหรับ ...,https://www.facebook.com/truebangkokunited/posts/%E0%B9%80%E0%B8%AA%E0%B8%A3%E0%B8%B4%E0%B8%A1%E0%B8%84%E0%B8%A7%E0%B8%B2%E0%B8%A1%E0%B9%81%E0%B8%82%E0%B9%87%E0%B8%87%E0%B9%81%E0%B8%81%E0%B8%A3%E0%B9%88%E0%B8%87%E0%B8%97%E0%B8%B5%E0%B9%88-jetts-fitness-%E0%B9%80%E0%B8%95%E0%B8%A3%E0%B8%B5%E0%B8%A2%E0%B8%A1%E0%B8%A3%E0%B9%88%E0%B8%B2%E0%B8%87%E0%B8%81%E0%B8%B2%E0%B8%A2%E0%B9%83%E0%B8%AB%E0%B9%89%E0%B8%9E%E0%B8%A3%E0%B9%89%E0%B8%AD%E0%B8%A1%E0%B8%AA%E0%B8%B3%E0%B8%AB%E0%B8%A3%E0%B8%B1%E0%B8%9A%E0%B8%97%E0%B8%B8%E0%B8%81%E0%B8%84%E0%B8%A7%E0%B8%B2%E0%B8%A1%E0%B8%97%E0%B9%89%E0%B8%B2%E0%B8%97%E0%B8%B2%E0%B8%A2-bui/1469326217895941/,"เสริมความแข็งแกร่งที่ Jetts Fitness เตรียมร่างกายให้พร้อมสำหรับทุกความท้าทาย Building strength at Jetts Fitness, preparing the body for every...",www.facebook.com
2026-05-14,26 มี.ค. 2026,Jetts ผสานฟิตเนสและป๊อปคัลเจอร์ รวมพลังดนตรีและการออกกำลัง ...,https://www.jetts.co.th/jetts-%E0%B8%9C%E0%B8%AA%E0%B8%B2%E0%B8%99%E0%B8%9F%E0%B8%B4%E0%B8%95%E0%B9%80%E0%B8%99%E0%B8%AA%E0%B9%81%E0%B8%A5%E0%B8%B0%E0%B8%9B%E0%B9%8A%E0%B8%AD%E0%B8%9B%E0%B8%84%E0%B8%B1%E0%B8%A5%E0%B9%80/,กรุงเทพฯ – Jetts Fitness แบรนด์ฟิตเนส 24 ชั่วโมงชั้นนำ ยกระดับประสบการณ์การออกกำลังกายให้กลายเป็นไลฟ์สไตล์อีเวนต์สุดเอเนอร์จี้ในงาน “JETTS x MILLI: Move Like a HEAVYWEIGHT” ...,www.jetts.co.th
2026-05-14,Unknown,MILLI X JETTS FITNESS พาเบิร์นให้ยับระดับ HEAVYWEIGHT กับ ...,https://www.instagram.com/reel/DVs4IZYkRqN/,"fabmagazineth on March 10, 2026: ""MILLI X JETTS FITNESS พาเบิร์นให้ยับระดับ HEAVYWEIGHT กับงาน MOVE LIKE A HEAVYWEIGHT 2026 วอร์มร่างกายให้เตรียมพร้อมรับแรงกระแทก!",www.instagram.com
2026-05-14,Unknown,อยากฟิตแบบสนุก ๆ ต้องไม่พลาด 💃 Jetts Fitness ชวนมาเต้น ...,https://www.facebook.com/JettsThailand/posts/%E0%B8%AD%E0%B8%A2%E0%B8%B2%E0%B8%81%E0%B8%9F%E0%B8%B4%E0%B8%95%E0%B9%81%E0%B8%9A%E0%B8%9A%E0%B8%AA%E0%B8%99%E0%B8%B8%E0%B8%81-%E0%B9%86-%E0%B8%95%E0%B9%89%E0%B8%AD%E0%B8%87%E0%B9%84%E0%B8%A1%E0%B9%88%E0%B8%9E%E0%B8%A5%E0%B8%B2%E0%B8%94-jetts-fitness-%E0%B8%8A%E0%B8%A7%E0%B8%99%E0%B8%A1%E0%B8%B2%E0%B9%80%E0%B8%95%E0%B9%89%E0%B8%99%E0%B9%81%E0%B8%AD%E0%B9%82%E0%B8%A3%E0%B8%9A%E0%B8%B4%E0%B8%84%E0%B8%94%E0%B9%89%E0%B8%A7%E0%B8%A2%E0%B8%81%E0%B8%B1%E0%B8%99-3-%E0%B8%9E%E0%B8%84-%E0%B8%99%E0%B8%B5%E0%B9%89-1830/1483270763248998/,อยากฟิตแบบสนุก ๆ ต้องไม่พลาด Jetts Fitness ชวนมาเต้นแอโรบิคด้วยกัน 3 พ.ค. นี้ 18.30 – 19.30 น. Sky Run ชั้น 3 | Central Westville มาเต้น มาฟิต...,www.facebook.com
2026-05-14,Unknown,จุดเช็กอินความฟิตใหม่ของชลบุรี 📍 Jetts Fitness Index Living Mall ...,https://www.facebook.com/JettsThailand/videos/%E0%B8%88%E0%B8%B8%E0%B8%94%E0%B9%80%E0%B8%8A%E0%B9%87%E0%B8%81%E0%B8%AD%E0%B8%B4%E0%B8%99%E0%B8%84%E0%B8%A7%E0%B8%B2%E0%B8%A1%E0%B8%9F%E0%B8%B4%E0%B8%95%E0%B9%83%E0%B8%AB%E0%B8%A1%E0%B9%88%E0%B8%82%E0%B8%AD%E0%B8%87%E0%B8%8A%E0%B8%A5%E0%B8%9A%E0%B8%B8%E0%B8%A3%E0%B8%B5-jetts-fitness-index-living-mall-chonburi-%EF%B8%8F%EF%B8%8F%E0%B9%84%E0%B8%A1%E0%B9%88%E0%B8%A7%E0%B9%88%E0%B8%B2/878688724774734/,จุดเช็กอินความฟิตใหม่ของชลบุรี Jetts Fitness Index Living Mall Chonburi 🏋️‍♂️✨ ไม่ว่าจะไลฟ์สไตล์แบบไหน จะออกกำลังกายเช้า กลางวัน ☀️ กลางคืน หรืออยู่ยาวๆ ยันดึก ก็มาสุขภาพดีที่ ...,www.facebook.com
2026-05-14,Unknown,Hoy Toca Fiesta Zumba en Jetts Fitness,https://www.tiktok.com/@coachbbeww/video/7630883270208539925,"1237 ถูกใจ,วิดีโอ TikTok จาก ซุมบ้าฟิตเนสกะบีบิว (@coachbbeww): ""¡Únete a la fiesta Zumba en Jetts Fitness! Movimiento, diversión y energía garantizada.",www.tiktok.com
2026-05-14,Unknown,โค้งสุดท้ายของความฟิต! กับโปรสุดฟินจาก Jetts Fitness x Major ...,https://www.instagram.com/reel/DWK4dFXlP0a/,โค้งสุดท้าย สำหรับความฟิตสุดปัง กับคอหนัง ใครมาดูหนังที่ Major Cineplex แล้วยังไม่ได้ใช้ส่วนลดกับทาง Jetts Fitness อย่าลืมมาแลกกันนะครับ ถึงวันที่ 31 มีนาคมนี้เท่านั้น ไม่ว่าจะเป็นตั๋วกระดาษ ...,www.instagram.com
2026-05-14,Unknown,NOLÁ จัดเต็มที่ Jetts Fitness! 🌱💪,https://www.tiktok.com/@nola_superfoods/video/7604792020363758866,"วิดีโอ TikTok จาก NOLA Superfoods (@nola_superfoods): ""NOLÁ พร้อมเสิร์ฟโปรตีนพืชผ่าน Kiosk ที่ Jetts Fitness ทั่วกรุงเทพฯ ซื้อได้ง่าย ไม่ต้องเป็นสมาชิก! #NOLAxJetts #โปรตีนพืช""",www.tiktok.com
2026-05-14,Unknown,Body pump เกือบบบจะวูบ🫀🦾@NOLA Superfoods @Jetts ...,https://www.tiktok.com/@itsbbabymaple/video/7616991247374224661,"35 ถูกใจ,วิดีโอ TikTok จาก itsbbabymaple (@itsbbabymaple): ""Body pump เกือบบบจะวูบ @NOLA Superfoods @Jetts Fitness Thailand""Gemini - So Lis.",www.tiktok.com
2026-05-14,Unknown,New Friend from China Joins Zumba Class at Jetts Fitness,https://www.tiktok.com/@coachbbeww/video/7624826327354363156,"445 ถูกใจ,วิดีโอ TikTok จาก ซุมบ้าฟิตเนสกะบีบิว (@coachbbeww): ""Meet a new friend from China who joined a Zumba class at Jetts Fitness. Watch the fun and energetic ...",www.tiktok.com
2026-05-14,21 ก.พ. 2026,กติกาการเข้าร่วมทดสอบความฟิต test your limit - hyrox pft,https://www.jetts.co.th/hyrox-pft/,ที่ Jetts Fitness Central Westville. วันที่ 21 กุมภาพันธ์ พ.ศ. 2569. ซื้อตั๋วที่นี่. กติกาการเข้าร่วมทดสอบความฟิต TEST YOUR LIMIT - HYROX PFT. ขอสงวนสิทธิ์ในการ ...,www.jetts.co.th
2026-05-14,Unknown,สุดปัง! รวมโมเมนต์สุดจึ้งจากงาน JETTS x MILLI: Move Like a ...,https://www.instagram.com/reel/DWoNbxrj__X/,Jetts Fitness Workout Party! English Transcript. Jetts Fitness Workout Party! OCR. MOVE LIKE A HEAVYWEIGHT EVENT Jetts 24 hour fitness MILLI 22 MARCH 2026 ...,www.instagram.com
2026-05-14,Unknown,The stage is ON! กับ HEAVYWEIGHT Special Class 🔥 นำทีม ...,https://www.tiktok.com/@jettsthailand/video/7620004966706580757,"วิดีโอ TikTok จาก Jetts Fitness Thailand (@jettsthailand): ""The stage is ON! กับ HEAVYWEIGHT Special Class นำทีมโดย MILLI กับคลาสพิเศษเฉพาะงานนี้เท่านั้น!",www.tiktok.com
2026-05-14,Unknown,4 Exercises to Get Perfect 11-Line Abs - Jetts Fitness Thailand,https://www.tiktok.com/@jettsthailand/video/7631991559906397447,TikTok video from Jetts Fitness Thailand (@jettsthailand): “Discover 4 effective exercises to help you achieve flat and toned abs with clear 11 lines.,www.tiktok.com
2026-05-14,Unknown,That's why our slogan is Fitness Freedom. Train where it ...,https://www.instagram.com/p/DYB0iWVjPxV/,"Oh shit. OCR. Did you know... If you combine no lock-in contracts with no hidden fees, you'll get Jetts Fitness ...",www.instagram.com
2026-05-14,Unknown,New Friend from China Joins Zumba Class at Jetts Fitness,https://www.tiktok.com/@coachbbeww/video/7624826327354363156,"445 ถูกใจ,วิดีโอ TikTok จาก ซุมบ้าฟิตเนสกะบีบิว (@coachbbeww): ""Meet a new friend from China who joined a Zumba class at Jetts Fitness. Watch the fun and energetic ...",www.tiktok.com
2026-05-14,Unknown,"Winter is coming, but your progress doesn't have to stop. ...",https://www.instagram.com/reel/DXzuptBpPsw/,Bulking season is coming $6 PER WEEK FOR 6 WEEKS* Jetts Fitness Freedom *T&Cs apply. Available at participating clubs only. jettspakenham's profile picture ...,www.instagram.com
2026-05-14,Unknown,Make the Move to Jetts If you're ready to take your training ...,https://www.instagram.com/p/DXWd2ZZj3iS/,But at Jetts Fitness St Leonards we're granting you club membership for ... Photo by Jetts Fitness Freedom in Jetts Forest Lakes. May be an image of ...,www.instagram.com
2026-05-14,Unknown,That's why our slogan is Fitness Freedom. Train where it ...,https://www.instagram.com/reel/DYB0ihLDSyz/,"Oh shit. OCR. Did you know... If you combine no lock-in contracts with no hidden fees, you'll get Jetts Fitness. Jetts SYNERGY RESILIENT. inmotus.app's ...",www.instagram.com
2026-05-14,Unknown,"Jetts Nowra on Instagram: ""Meet the Team! Club Manager ...",https://www.instagram.com/reel/DW3QtA5gBgL/,Come on! OCR. Jetts Fitness Freedom $6 PER WEEK FOR 6 WEEKS* *T&Cs apply. $0 JOINING FEE. SAVE UP TO $160. YOU DEFINE ...,www.instagram.com
2026-05-14,1 มี.ค. 2026,Jetts Fitness 24hrs. Now open in “Robinson Lifestyle Chalong” ...,https://www.instagram.com/p/DVXb-WyAR-8/,"266 likes, 19 comments - new_jittramas on March 1, 2026: ""sweat now,shine later ✨ —————— Jetts Fitness 24hrs. Now open in “Robinson Lifestyle Chalong” ...",www.instagram.com
2026-05-14,Unknown,Jetts Australia,https://www.facebook.com/JettsFitness/videos/6-per-week-for-6-weeks/2534006900335608/,More videos you may like. 00: ...,www.facebook.com
2026-05-14,Unknown,Happy Mother's Day to all the special women in our lives🌸 ...,https://www.instagram.com/p/DYIka1QEtdZ/,"Photo by Jetts Fitness Freedom on May 09, 2026. May be an image of. 8 likes. jetts_northam. Happy Mother's Day to all the special women in our lives ...",www.instagram.com
2026-05-14,Unknown,Experience Real Fitness Freedom with Jetts #gym ...,https://www.instagram.com/reel/DXdAu1XAkmp/,But at Jetts Fitness St Leonards we're granting you club membership for a $1 a day for your first 28 days..but only for new joiners in April. And we've $0 ...,www.instagram.com
