Date_Extracted,Published_Date,Heading,URL,Body_Snippet,Source_Site
2026-05-14,Unknown,🔥 Jetts Fitness กำลังมาเปิดสาขาใหม่ ที่ Central Khonkaen ...,https://www.facebook.com/JettsThailand/posts/-jetts-fitness-%E0%B8%81%E0%B8%B3%E0%B8%A5%E0%B8%B1%E0%B8%87%E0%B8%A1%E0%B8%B2%E0%B9%80%E0%B8%9B%E0%B8%B4%E0%B8%94%E0%B8%AA%E0%B8%B2%E0%B8%82%E0%B8%B2%E0%B9%83%E0%B8%AB%E0%B8%A1%E0%B9%88-%E0%B8%97%E0%B8%B5%E0%B9%88-central-khonkaen-campus%E0%B8%88%E0%B8%B1%E0%B8%87%E0%B8%AB%E0%B8%A7%E0%B8%B1%E0%B8%94%E0%B8%97%E0%B8%B5%E0%B9%88-2-%E0%B8%82%E0%B8%AD%E0%B8%87%E0%B8%A0%E0%B8%B2/1443156283927113/,Jetts Fitness กำลังมาเปิดสาขาใหม่ ที่ Central Khonkaen Campus! จังหวัดที่ 2 ของภาคอีสาน พร้อมเปิดรับสมัคร Personal Trainer จำนวนมาก มาร่วมเป็นส่วนหนึ่ง ...,www.facebook.com
2026-05-14,4 มี.ค. 2026,Jetts Fitness เตรียมบุกคลับใหม่ทั่วไทย 🔥🇹🇭 🤔 คราวนี้จะเป็นจังหวัด ...,https://www.instagram.com/p/DVe_-FqArhF/,Jetts Fitness เตรียมบุกคลับใหม่ทั่วไทย คราวนี้จะเป็นจังหวัดไหน ลองทายกันเข้ามาได้เลย #jettsfitness #jettsthailand #no1gyminthailand. more.,www.instagram.com
2026-05-14,Unknown,สุขสันต์วันสงกรานต์จาก Jetts Fitness สงกรานต์ปีนี้ Jetts Fitness ขอ ...,https://www.facebook.com/JettsThailand/videos/%E0%B8%AA%E0%B8%B8%E0%B8%82%E0%B8%AA%E0%B8%B1%E0%B8%99%E0%B8%95%E0%B9%8C%E0%B8%A7%E0%B8%B1%E0%B8%99%E0%B8%AA%E0%B8%87%E0%B8%81%E0%B8%A3%E0%B8%B2%E0%B8%99%E0%B8%95%E0%B9%8C%E0%B8%88%E0%B8%B2%E0%B8%81-jetts-fitness-%E0%B8%AA%E0%B8%87%E0%B8%81%E0%B8%A3%E0%B8%B2%E0%B8%99%E0%B8%95%E0%B9%8C%E0%B8%9B%E0%B8%B5%E0%B8%99%E0%B8%B5%E0%B9%89-jetts-fitness-%E0%B8%82%E0%B8%AD%E0%B9%80%E0%B8%9B%E0%B9%87%E0%B8%99%E0%B8%AA%E0%B9%88%E0%B8%A7%E0%B8%99%E0%B8%AB%E0%B8%99%E0%B8%B6%E0%B9%88%E0%B8%87/1267179881632283/,สุขสันต์วันสงกรานต์จาก Jetts Fitness สงกรานต์ปีนี้ Jetts Fitness ขอเป็นส่วนหนึ่งในการส่งต่อความสุข ความสนุก และสุขภาพที่ดีให้กับชาวเจ็ทส์ทุกคน!...,www.facebook.com
2026-05-14,16 ม.ค. 2026,Jetts 24 Hour Fitness ลงนามบันทึกข้อตกลงความร่วมมือทาง ...,https://www.jetts.co.th/jetts-24-hour-fitness-%E0%B8%A5%E0%B8%87%E0%B8%99%E0%B8%B2%E0%B8%A1%E0%B8%9A%E0%B8%B1%E0%B8%99%E0%B8%97%E0%B8%B6%E0%B8%81%E0%B8%82%E0%B9%89%E0%B8%AD%E0%B8%95%E0%B8%81%E0%B8%A5%E0%B8%87%E0%B8%84/,พบกับ Jetts Fitness 10 Weeks New Member Journey. 2026-01-20. Jetts 24 Hour Fitness ลงนามบันทึกข้อตกลงความร่วมมือทางวิชาการ (MOU) ร่วมกับคณะวิทยาศาสตร์ ...,www.jetts.co.th
2026-05-14,Unknown,ชาวอุดรธานีเตรียมตัว! Jetts Fitness บุกถึงที่แล้วกับสาขา ...,https://www.facebook.com/JettsThailand/posts/-%E0%B8%8A%E0%B8%B2%E0%B8%A7%E0%B8%AD%E0%B8%B8%E0%B8%94%E0%B8%A3%E0%B8%98%E0%B8%B2%E0%B8%99%E0%B8%B5%E0%B9%80%E0%B8%95%E0%B8%A3%E0%B8%B5%E0%B8%A2%E0%B8%A1%E0%B8%95%E0%B8%B1%E0%B8%A7-jetts-fitness-%E0%B8%9A%E0%B8%B8%E0%B8%81%E0%B8%96%E0%B8%B6%E0%B8%87%E0%B8%97%E0%B8%B5%E0%B9%88%E0%B9%81%E0%B8%A5%E0%B9%89%E0%B8%A7%E0%B8%81%E0%B8%B1%E0%B8%9A%E0%B8%AA%E0%B8%B2%E0%B8%82%E0%B8%B2%E0%B9%83%E0%B8%AB%E0%B8%A1%E0%B9%88-plus-udon-%E0%B8%AA%E0%B8%B4%E0%B9%89%E0%B8%99%E0%B8%AA%E0%B8%B8%E0%B8%94%E0%B8%81%E0%B8%B2/1464088108500597/,ชาวอุดรธานีเตรียมตัว! Jetts Fitness บุกถึงที่แล้วกับสาขาใหม่ PLUS UDON สิ้นสุดการรอคอย! เตรียมพบกับความฟิตตลอด 24 ชั่วโมงที่ Jetts Fitness Plus Udon...,www.facebook.com
2026-05-14,Unknown,สงกรานต์นี้ไม่ต้องเปียกอย่างเดียว มาฟิตให้สุดไปเลย 💦🔥 ...,https://www.facebook.com/JettsThailand/posts/%E0%B8%AA%E0%B8%87%E0%B8%81%E0%B8%A3%E0%B8%B2%E0%B8%99%E0%B8%95%E0%B9%8C%E0%B8%99%E0%B8%B5%E0%B9%89%E0%B9%84%E0%B8%A1%E0%B9%88%E0%B8%95%E0%B9%89%E0%B8%AD%E0%B8%87%E0%B9%80%E0%B8%9B%E0%B8%B5%E0%B8%A2%E0%B8%81%E0%B8%AD%E0%B8%A2%E0%B9%88%E0%B8%B2%E0%B8%87%E0%B9%80%E0%B8%94%E0%B8%B5%E0%B8%A2%E0%B8%A7-%E0%B8%A1%E0%B8%B2%E0%B8%9F%E0%B8%B4%E0%B8%95%E0%B9%83%E0%B8%AB%E0%B9%89%E0%B8%AA%E0%B8%B8%E0%B8%94%E0%B9%84%E0%B8%9B%E0%B9%80%E0%B8%A5%E0%B8%A2-%E0%B8%AA%E0%B8%87%E0%B8%81%E0%B8%A3%E0%B8%B2%E0%B8%99%E0%B8%95%E0%B9%8C%E0%B8%99%E0%B8%B5%E0%B9%89%E0%B9%84%E0%B8%A1%E0%B9%88%E0%B8%A1%E0%B8%B5%E0%B9%81%E0%B8%9E%E0%B8%A5%E0%B8%99%E0%B9%84%E0%B8%9B%E0%B9%84%E0%B8%AB%E0%B8%99%E0%B8%A1%E0%B8%B2%E0%B8%AB%E0%B8%A5/1466578531584888/,สงกรานต์นี้ไม่ต้องเปียกอย่างเดียว มาฟิตให้สุดไปเลย สงกรานต์นี้ไม่มีแพลนไปไหนมาหลบร้อนเติมความฟิตได้ที่ Jetts Fitness เปิดบ้านชวนเพื่อนมาออกกำลังกาย...,www.facebook.com
2026-05-14,Unknown,ชาวหาดใหญ่ เตรียมปลุกพลังความฟิต 24 ชั่วโมง ⏳🔥 Jetts ...,https://www.facebook.com/JettsThailand/posts/%E0%B8%8A%E0%B8%B2%E0%B8%A7%E0%B8%AB%E0%B8%B2%E0%B8%94%E0%B9%83%E0%B8%AB%E0%B8%8D%E0%B9%88-%E0%B9%80%E0%B8%95%E0%B8%A3%E0%B8%B5%E0%B8%A2%E0%B8%A1%E0%B8%9B%E0%B8%A5%E0%B8%B8%E0%B8%81%E0%B8%9E%E0%B8%A5%E0%B8%B1%E0%B8%87%E0%B8%84%E0%B8%A7%E0%B8%B2%E0%B8%A1%E0%B8%9F%E0%B8%B4%E0%B8%95-24-%E0%B8%8A%E0%B8%B1%E0%B9%88%E0%B8%A7%E0%B9%82%E0%B8%A1%E0%B8%87-jetts-fitness-hatyai-village-%E0%B9%80%E0%B8%95%E0%B8%A3%E0%B8%B5%E0%B8%A2%E0%B8%A1%E0%B8%9E/1393977888844953/,ชาวหาดใหญ่ เตรียมปลุกพลังความฟิต 24 ชั่วโมง ⏳ Jetts Fitness Hatyai Village เตรียมพบ สาขาแรกของหาดใหญ่ เตรียมพบ ราคาพิเศษสุดคุ้ม เตรียมพบ...,www.facebook.com
2026-05-14,Unknown,พร้อมตอบทุกเหตุผลของความแข็งแรง 💪✨ ไม่ว่าจะเริ่มตอนไหน เจ็ ...,https://www.facebook.com/JettsThailand/posts/%E0%B8%9E%E0%B8%A3%E0%B9%89%E0%B8%AD%E0%B8%A1%E0%B8%95%E0%B8%AD%E0%B8%9A%E0%B8%97%E0%B8%B8%E0%B8%81%E0%B9%80%E0%B8%AB%E0%B8%95%E0%B8%B8%E0%B8%9C%E0%B8%A5%E0%B8%82%E0%B8%AD%E0%B8%87%E0%B8%84%E0%B8%A7%E0%B8%B2%E0%B8%A1%E0%B9%81%E0%B8%82%E0%B9%87%E0%B8%87%E0%B9%81%E0%B8%A3%E0%B8%87-%E0%B9%84%E0%B8%A1%E0%B9%88%E0%B8%A7%E0%B9%88%E0%B8%B2%E0%B8%88%E0%B8%B0%E0%B9%80%E0%B8%A3%E0%B8%B4%E0%B9%88%E0%B8%A1%E0%B8%95%E0%B8%AD%E0%B8%99%E0%B9%84%E0%B8%AB%E0%B8%99-%E0%B9%80%E0%B8%88%E0%B9%87%E0%B8%97%E0%B8%AA%E0%B9%8C%E0%B8%9E%E0%B8%A3%E0%B9%89%E0%B8%AD%E0%B8%A1%E0%B9%80%E0%B8%AA%E0%B8%A1%E0%B8%AD-%E0%B8%95%E0%B8%A5%E0%B8%AD%E0%B8%94-24-%E0%B8%8A%E0%B8%B1%E0%B9%88%E0%B8%A7/1415085786734163/,พร้อมตอบทุกเหตุผลของความแข็งแรง ✨ ไม่ว่าจะเริ่มตอนไหน เจ็ทส์พร้อมเสมอ ตลอด 24 ชั่วโมง ⏰ พบกับ Jetts Fitness คลับใหม่ได้ที่ Jetts Fitness The Walk...,www.facebook.com
2026-05-14,Unknown,สุขสันต์วันสงกรานต์จาก Jetts Fitness สงกรานต์ปีนี้ Jetts Fitness ขอ ...,https://www.facebook.com/JettsThailand/videos/%E0%B8%AA%E0%B8%B8%E0%B8%82%E0%B8%AA%E0%B8%B1%E0%B8%99%E0%B8%95%E0%B9%8C%E0%B8%A7%E0%B8%B1%E0%B8%99%E0%B8%AA%E0%B8%87%E0%B8%81%E0%B8%A3%E0%B8%B2%E0%B8%99%E0%B8%95%E0%B9%8C%E0%B8%88%E0%B8%B2%E0%B8%81-jetts-fitness-%E0%B8%AA%E0%B8%87%E0%B8%81%E0%B8%A3%E0%B8%B2%E0%B8%99%E0%B8%95%E0%B9%8C%E0%B8%9B%E0%B8%B5%E0%B8%99%E0%B8%B5%E0%B9%89-jetts-fitness-%E0%B8%82%E0%B8%AD%E0%B9%80%E0%B8%9B%E0%B9%87%E0%B8%99%E0%B8%AA%E0%B9%88%E0%B8%A7%E0%B8%99%E0%B8%AB%E0%B8%99%E0%B8%B6%E0%B9%88%E0%B8%87/1267179881632283/,สุขสันต์วันสงกรานต์จาก Jetts Fitness สงกรานต์ปีนี้ Jetts Fitness ขอเป็นส่วนหนึ่งในการส่งต่อความสุข ความสนุก และสุขภาพที่ดีให้กับชาวเจ็ทส์ทุกคน!...,www.facebook.com
2026-05-14,Unknown,จุดเช็กอินความฟิตใหม่ของชลบุรี 📍 Jetts Fitness Index Living ...,https://www.facebook.com/JettsThailand/posts/%E0%B8%88%E0%B8%B8%E0%B8%94%E0%B9%80%E0%B8%8A%E0%B9%87%E0%B8%81%E0%B8%AD%E0%B8%B4%E0%B8%99%E0%B8%84%E0%B8%A7%E0%B8%B2%E0%B8%A1%E0%B8%9F%E0%B8%B4%E0%B8%95%E0%B9%83%E0%B8%AB%E0%B8%A1%E0%B9%88%E0%B8%82%E0%B8%AD%E0%B8%87%E0%B8%8A%E0%B8%A5%E0%B8%9A%E0%B8%B8%E0%B8%A3%E0%B8%B5-jetts-fitness-index-living-mall-chonburi-%EF%B8%8F%EF%B8%8F%E0%B9%84%E0%B8%A1%E0%B9%88%E0%B8%A7%E0%B9%88%E0%B8%B2/1401131454796263/,... Jetts Fitness ได้ตลอด 24 ชั่วโมง ⏰ ครบทุกโซนออกกำลังกายและคาร์ดิโอ ‍♀️ ‍♂️ รวมถึงคลาสออกกำลังกายลิขสิทธิ์ระดับโลก ‍♂️ และโซนฝึกซ้อม HYROX ...,www.facebook.com
2026-05-14,Unknown,31 มีนาคม 2569 📍 สมัครได้ที่ Jetts ทุกสาขาทั่วไทย *สำหรับการ ...,https://www.facebook.com/JettsThailand/posts/%E0%B9%80%E0%B8%A3%E0%B8%B4%E0%B9%88%E0%B8%A1-summer-%E0%B8%99%E0%B8%B5%E0%B9%89-%EF%B8%8F-%E0%B8%94%E0%B9%89%E0%B8%A7%E0%B8%A2%E0%B8%AA%E0%B8%B8%E0%B8%82%E0%B8%A0%E0%B8%B2%E0%B8%9E%E0%B8%94%E0%B8%B5%E0%B9%81%E0%B8%9A%E0%B8%9A-no-limit%E0%B9%80%E0%B8%9E%E0%B8%B4%E0%B9%88%E0%B8%A1%E0%B8%84%E0%B8%A7%E0%B8%B2%E0%B8%A1%E0%B9%81%E0%B8%82%E0%B9%87%E0%B8%87%E0%B9%81%E0%B8%A3%E0%B8%87%E0%B9%83%E0%B8%AB%E0%B9%89%E0%B8%95%E0%B8%B1%E0%B8%A7%E0%B9%80%E0%B8%AD%E0%B8%87%E0%B9%84%E0%B8%94%E0%B9%89%E0%B8%97%E0%B8%B8%E0%B8%81%E0%B8%A7%E0%B8%B1%E0%B8%99-%E0%B9%84%E0%B8%A1/1437224781186930/,เริ่ม Summer นี้ ☀️ ด้วยสุขภาพดีแบบ No Limit เพิ่มความแข็งแรงให้ตัวเองได้ทุกวัน ไม่มีวันหยุด ฟิตได้ตลอด 24 ชั่วโมง ⏰ ที่ Jetts Fitness ทุกสาขา ...,www.facebook.com
2026-05-14,Unknown,ขอนแก่น…ถึงเวลายกระดับความฟิตแล้ว! 🔥 Jetts Fitness Central ...,https://www.facebook.com/JettsThailand/posts/%E0%B8%82%E0%B8%AD%E0%B8%99%E0%B9%81%E0%B8%81%E0%B9%88%E0%B8%99%E0%B8%96%E0%B8%B6%E0%B8%87%E0%B9%80%E0%B8%A7%E0%B8%A5%E0%B8%B2%E0%B8%A2%E0%B8%81%E0%B8%A3%E0%B8%B0%E0%B8%94%E0%B8%B1%E0%B8%9A%E0%B8%84%E0%B8%A7%E0%B8%B2%E0%B8%A1%E0%B8%9F%E0%B8%B4%E0%B8%95%E0%B9%81%E0%B8%A5%E0%B9%89%E0%B8%A7-jetts-fitness-central-khonkaen-campus%E0%B8%AA%E0%B8%B2%E0%B8%82%E0%B8%B2%E0%B9%81%E0%B8%A3%E0%B8%81%E0%B9%83%E0%B8%99%E0%B8%82/1480222370220504/,ขอนแก่น…ถึงเวลายกระดับความฟิตแล้ว! Jetts Fitness Central Khonkaen Campus สาขาแรกในขอนแก่น พร้อมเปิดประสบการณ์ฟิตเนส 24 ชั่วโมงเต็มรูปแบบ ✨...,www.facebook.com
2026-05-14,Unknown,title 📣 ชาวอุดรธานีเตรียมตัว! Jetts Fitness บุกถึงที่แล้วกับสาขา ...,https://www.instagram.com/p/DWxc1m9j0wJ/,"79 likes, 2 comments - jettsfitnessthailand on April 5, 2026: "" ชาวอุดรธานีเตรียมตัว! Jetts Fitness บุกถึงที่แล้วกับสาขาใหม่ PLUS UDON สิ้นสุดการรอคอย!",www.instagram.com
2026-05-14,Unknown,💪🏻 Jetts Fitness 24 Hours 💪🏻 ❗️❗️พิเศษ 888 สำหรับสมัคร ...,https://www.facebook.com/groups/864528398176914/posts/1543119233651157/,Jetts Fitness 24 Hours ❗️❗️พิเศษ 888 สำหรับสมัครสมาชิกออนไลน์ ❗️❗️ ฉลองตรุษจีน เพียงเลือกสาขา นวมินทร์ซิตี้ อเวนิว เปิด 24 ชั่วโมง...,www.facebook.com
2026-05-14,Unknown,ชาวหาดใหญ่ เตรียมปลุกพลังความฟิต 24 ชั่วโมง ⏳🔥 Jetts ...,https://www.facebook.com/JettsThailand/posts/%E0%B8%8A%E0%B8%B2%E0%B8%A7%E0%B8%AB%E0%B8%B2%E0%B8%94%E0%B9%83%E0%B8%AB%E0%B8%8D%E0%B9%88-%E0%B9%80%E0%B8%95%E0%B8%A3%E0%B8%B5%E0%B8%A2%E0%B8%A1%E0%B8%9B%E0%B8%A5%E0%B8%B8%E0%B8%81%E0%B8%9E%E0%B8%A5%E0%B8%B1%E0%B8%87%E0%B8%84%E0%B8%A7%E0%B8%B2%E0%B8%A1%E0%B8%9F%E0%B8%B4%E0%B8%95-24-%E0%B8%8A%E0%B8%B1%E0%B9%88%E0%B8%A7%E0%B9%82%E0%B8%A1%E0%B8%87-jetts-fitness-hatyai-village-%E0%B9%80%E0%B8%95%E0%B8%A3%E0%B8%B5%E0%B8%A2%E0%B8%A1%E0%B8%9E/1393977888844953/,ชาวหาดใหญ่ เตรียมปลุกพลังความฟิต 24 ชั่วโมง ⏳ Jetts Fitness Hatyai Village เตรียมพบ สาขาแรกของหาดใหญ่ เตรียมพบ ราคาพิเศษสุดคุ้ม เตรียมพบ...,www.facebook.com
2026-05-14,Unknown,จุดเช็กอินความฟิตใหม่ของชลบุรี 📍 Jetts Fitness Index Living ...,https://www.facebook.com/JettsThailand/posts/%E0%B8%88%E0%B8%B8%E0%B8%94%E0%B9%80%E0%B8%8A%E0%B9%87%E0%B8%81%E0%B8%AD%E0%B8%B4%E0%B8%99%E0%B8%84%E0%B8%A7%E0%B8%B2%E0%B8%A1%E0%B8%9F%E0%B8%B4%E0%B8%95%E0%B9%83%E0%B8%AB%E0%B8%A1%E0%B9%88%E0%B8%82%E0%B8%AD%E0%B8%87%E0%B8%8A%E0%B8%A5%E0%B8%9A%E0%B8%B8%E0%B8%A3%E0%B8%B5-jetts-fitness-index-living-mall-chonburi-%EF%B8%8F%EF%B8%8F%E0%B9%84%E0%B8%A1%E0%B9%88%E0%B8%A7%E0%B9%88%E0%B8%B2/1401131454796263/,... Jetts Fitness ได้ตลอด 24 ชั่วโมง ⏰ ครบทุกโซนออกกำลังกายและคาร์ดิโอ ‍♀️ ‍♂️ รวมถึงคลาสออกกำลังกายลิขสิทธิ์ระดับโลก ‍♂️ และโซนฝึกซ้อม HYROX ...,www.facebook.com
2026-05-14,Unknown,ชาวอุดรธานีเตรียมตัว! Jetts Fitness บุกถึงที่แล้วกับสาขา ...,https://www.facebook.com/JettsThailand/posts/-%E0%B8%8A%E0%B8%B2%E0%B8%A7%E0%B8%AD%E0%B8%B8%E0%B8%94%E0%B8%A3%E0%B8%98%E0%B8%B2%E0%B8%99%E0%B8%B5%E0%B9%80%E0%B8%95%E0%B8%A3%E0%B8%B5%E0%B8%A2%E0%B8%A1%E0%B8%95%E0%B8%B1%E0%B8%A7-jetts-fitness-%E0%B8%9A%E0%B8%B8%E0%B8%81%E0%B8%96%E0%B8%B6%E0%B8%87%E0%B8%97%E0%B8%B5%E0%B9%88%E0%B9%81%E0%B8%A5%E0%B9%89%E0%B8%A7%E0%B8%81%E0%B8%B1%E0%B8%9A%E0%B8%AA%E0%B8%B2%E0%B8%82%E0%B8%B2%E0%B9%83%E0%B8%AB%E0%B8%A1%E0%B9%88-plus-udon-%E0%B8%AA%E0%B8%B4%E0%B9%89%E0%B8%99%E0%B8%AA%E0%B8%B8%E0%B8%94%E0%B8%81%E0%B8%B2/1464088108500597/,ชาวอุดรธานีเตรียมตัว! Jetts Fitness บุกถึงที่แล้วกับสาขาใหม่ PLUS UDON สิ้นสุดการรอคอย! เตรียมพบกับความฟิตตลอด 24 ชั่วโมงที่ Jetts Fitness Plus Udon...,www.facebook.com
2026-05-14,Unknown,Khon - มาจริงไม่จกตา! Jetts Fitness ปักหมุดความฟิต ...,https://www.facebook.com/photo.php?fbid=1526602995757205&set=a.263583125392538&id=100052225584213,มาจริงไม่จกตา! Jetts Fitness ปักหมุดความฟิตแห่งใหม่ที่ Central Khon Kaen Campus ✨ . สายออกกำลังกายเตรียมตัวให้พร้อม เพราะขอนแก่นกำลังจะมี Jetts Fitness...,www.facebook.com
2026-05-14,Unknown,แลนด์มาร์คใหม่ของคนรักสุขภาพ! ✈️ พบกับ Jetts Fitness @ Rest ...,https://www.facebook.com/JettsThailand/videos/%E0%B9%82%E0%B8%9B%E0%B8%A3%E0%B9%82%E0%B8%A1%E0%B8%8A%E0%B8%B1%E0%B8%99%E0%B8%95%E0%B9%89%E0%B8%AD%E0%B8%99%E0%B8%A3%E0%B8%B1%E0%B8%9A%E0%B8%AA%E0%B8%B2%E0%B8%82%E0%B8%B2%E0%B9%83%E0%B8%AB%E0%B8%A1%E0%B9%88/1312983224264302/,ลงทะเบียนความสนใจที่ https://tinyurl. com/RestParkPS restparksuvarnabhumi@jetts.co.th 083-689-9696 สมาชิก Jetts Fitness สมัครครั้งเดียวสิทธิประโยชน์เพียบ!,www.facebook.com
2026-05-14,Unknown,ขอนแก่น…ถึงเวลายกระดับความฟิตแล้ว! 🔥 Jetts Fitness Central ...,https://www.facebook.com/JettsThailand/posts/%E0%B8%82%E0%B8%AD%E0%B8%99%E0%B9%81%E0%B8%81%E0%B9%88%E0%B8%99%E0%B8%96%E0%B8%B6%E0%B8%87%E0%B9%80%E0%B8%A7%E0%B8%A5%E0%B8%B2%E0%B8%A2%E0%B8%81%E0%B8%A3%E0%B8%B0%E0%B8%94%E0%B8%B1%E0%B8%9A%E0%B8%84%E0%B8%A7%E0%B8%B2%E0%B8%A1%E0%B8%9F%E0%B8%B4%E0%B8%95%E0%B9%81%E0%B8%A5%E0%B9%89%E0%B8%A7-jetts-fitness-central-khonkaen-campus%E0%B8%AA%E0%B8%B2%E0%B8%82%E0%B8%B2%E0%B9%81%E0%B8%A3%E0%B8%81%E0%B9%83%E0%B8%99%E0%B8%82/1438140504428691/,ขอนแก่น…ถึงเวลายกระดับความฟิตแล้ว! Jetts Fitness Central Khonkaen Campus สาขาแรกในขอนแก่น พร้อมเปิดประสบการณ์ฟิตเนส 24 ชั่วโมงเต็มรูปแบบ ✨...,www.facebook.com
2026-05-14,13 ก.พ. 2026,SPECIAL CLASS จาก Jetts Fitness #ประมวลภาพกิจกรรม เสริมพลัง ...,https://www.facebook.com/Centralkrabi/posts/-special-class-%E0%B8%88%E0%B8%B2%E0%B8%81-jetts-fitness-%E0%B8%9B%E0%B8%A3%E0%B8%B0%E0%B8%A1%E0%B8%A7%E0%B8%A5%E0%B8%A0%E0%B8%B2%E0%B8%9E%E0%B8%81%E0%B8%B4%E0%B8%88%E0%B8%81%E0%B8%A3%E0%B8%A3%E0%B8%A1-%E0%B9%80%E0%B8%AA%E0%B8%A3%E0%B8%B4%E0%B8%A1%E0%B8%9E%E0%B8%A5%E0%B8%B1%E0%B8%87-%E0%B9%80%E0%B8%AA%E0%B8%A3%E0%B8%B4%E0%B8%A1%E0%B8%84%E0%B8%A7%E0%B8%B2%E0%B8%A1%E0%B9%80%E0%B8%AE%E0%B8%87-%E0%B8%95%E0%B9%89%E0%B8%AD%E0%B8%99%E0%B8%A3%E0%B8%B1%E0%B8%9A/859455333716457/,SPECIAL CLASS จาก Jetts Fitness #ประมวลภาพกิจกรรม เสริมพลัง เสริมความเฮง ต้อนรับปีม้าแบบแข็งแรงทั้งกายใจ 13 ก.พ. 2569 เวลา 17.00 - 19.00 น....,www.facebook.com
2026-05-14,Unknown,"Jetts Fitness is coming soon !! at Lotus""s Plus UDON. ชาว ...",https://www.facebook.com/insideudon/photos/jetts-fitness-is-coming-soon-at-lotuss-plus-udon-%E0%B8%8A%E0%B8%B2%E0%B8%A7%E0%B8%AD%E0%B8%B8%E0%B8%94%E0%B8%A3%E0%B9%81%E0%B8%A5%E0%B8%B0%E0%B9%83%E0%B8%81%E0%B8%A5%E0%B9%89%E0%B9%80%E0%B8%84%E0%B8%B5%E0%B8%A2%E0%B8%87-%E0%B9%80%E0%B8%95%E0%B8%A3%E0%B8%B5%E0%B8%A2%E0%B8%A1%E0%B8%9E%E0%B8%9A%E0%B8%81%E0%B8%B1%E0%B8%9A/1238949921786084/,"Jetts Fitness is coming soon !! at Lotus""s Plus UDON. ชาวอุดรและใกล้เคียง เตรียมพบกับ เจ็ทส์ ฟิตเนส ณ โลตัส พลัส อุดร เร็วๆ นี้ #insideudon...",www.facebook.com
2026-05-14,Unknown,มาจริงไม่จกตา! Jetts Fitness ปักหมุดความฟิตแห่งใหม่ที่ Central ...,https://www.instagram.com/p/DVgNNJ2DExV/,สายออกกำลังกายเตรียมตัวให้พร้อม เพราะขอนแก่นกำลังจะมี Jetts Fitness ฟิตเนสเปิด 24 ชั่วโมง แห่งแรกของจังหวัด เปิดให้ฟิตได้ทุกเวลา ไม่ว่าจะเช้า สาย เย็น หรือดึกก็แวะมาเบิร์นกันได้แบบไม่มีข้อจำกัด .,www.instagram.com
2026-05-14,Unknown,Central Suratthani,https://www.facebook.com/CentralSuratThani/posts/%E0%B9%81%E0%B8%99%E0%B8%B0%E0%B8%99%E0%B8%B3-highlighted-club-%E0%B8%88%E0%B8%B2%E0%B8%81-jetts-fitness-jetts-fitness-central-surat-thanithe-fi/1540940358077179/,แนะนำ Highlighted Club จาก Jetts Fitness ✨ Jetts Fitness Central Surat Thani The Fitness Hub of Surat Thani ศูนย์กลางความฟิตของชาวสุราษฎร์ธานี ครบ...,www.facebook.com
2026-05-14,16 ม.ค. 2026,Jetts 24 Hour Fitness ลงนามบันทึกข้อตกลงความร่วมมือทาง ...,https://www.jetts.co.th/jetts-24-hour-fitness-%E0%B8%A5%E0%B8%87%E0%B8%99%E0%B8%B2%E0%B8%A1%E0%B8%9A%E0%B8%B1%E0%B8%99%E0%B8%97%E0%B8%B6%E0%B8%81%E0%B8%82%E0%B9%89%E0%B8%AD%E0%B8%95%E0%B8%81%E0%B8%A5%E0%B8%87%E0%B8%84/,Popular Tags. Central Nakhon Sawan Corporate Social Responsibility CSR Gym at Nakhon Sawan Jetts Fitness X Garfield การ์ตูน Garfield ท่าออกกำลังกาย ท่าออกกำลังกายลดพุง ...,www.jetts.co.th
2026-05-14,Unknown,SUMMER SALE ที่ @jettsfitnessthailand จัดหนักต้อนรับหน้าร้อน ...,https://www.instagram.com/reel/DXgTZitDxb4/,... Jetts Fitness! ✨ ใครไปออกกำลังกายที่ Jetts 24 Hour Fitness ช่วงนี้ แล้วเจอความสดใสของคุณแพทริเซียแวะมาบอกกันบ้างนะ! ตอนนี้ NOLÁ บุกไปดูแลสุขภาพทุกคนถึง ...,www.instagram.com
2026-05-14,Unknown,ช่วยเลือกทีค่ะระหว่าง Jetts Fitness กับ Real Gym อันไหนบิว ...,https://www.facebook.com/bewberryz/posts/%E0%B8%8A%E0%B9%88%E0%B8%A7%E0%B8%A2%E0%B9%80%E0%B8%A5%E0%B8%B7%E0%B8%AD%E0%B8%81%E0%B8%97%E0%B8%B5%E0%B8%84%E0%B9%88%E0%B8%B0%E0%B8%A3%E0%B8%B0%E0%B8%AB%E0%B8%A7%E0%B9%88%E0%B8%B2%E0%B8%87-jetts-fitness-%E0%B8%81%E0%B8%B1%E0%B8%9A-real-gym-%E0%B8%AD%E0%B8%B1%E0%B8%99%E0%B9%84%E0%B8%AB%E0%B8%99%E0%B8%9A%E0%B8%B4%E0%B8%A7%E0%B8%96%E0%B8%B6%E0%B8%87%E0%B8%88%E0%B8%B0%E0%B9%84%E0%B8%9B%E0%B9%83%E0%B8%8A%E0%B9%89%E0%B8%9A%E0%B8%A3%E0%B8%B4%E0%B8%81%E0%B8%B2%E0%B8%A3%E0%B9%80%E0%B8%81%E0%B8%B4%E0%B8%992%E0%B8%A7/10241457518879739/,ช่วยเลือกทีค่ะระหว่าง Jetts Fitness กับ Real Gym อันไหนบิวถึงจะไปใช้บริการเกิน2วัน.,www.facebook.com
2026-05-14,Unknown,มาจริงไม่จกตา! Jetts Fitness ปักหมุดความฟิตแห่งใหม่ที่ Central ...,https://www.facebook.com/KhonKaenLetsGo/posts/%E0%B8%A1%E0%B8%B2%E0%B8%88%E0%B8%A3%E0%B8%B4%E0%B8%87%E0%B9%84%E0%B8%A1%E0%B9%88%E0%B8%88%E0%B8%81%E0%B8%95%E0%B8%B2-jetts-fitness-%E0%B8%9B%E0%B8%B1%E0%B8%81%E0%B8%AB%E0%B8%A1%E0%B8%B8%E0%B8%94%E0%B8%84%E0%B8%A7%E0%B8%B2%E0%B8%A1%E0%B8%9F%E0%B8%B4%E0%B8%95%E0%B9%81%E0%B8%AB%E0%B9%88%E0%B8%87%E0%B9%83%E0%B8%AB%E0%B8%A1%E0%B9%88%E0%B8%97%E0%B8%B5%E0%B9%88-central-khon-kaen-campus-%E0%B8%AA/1526603019090536/,มาจริงไม่จกตา! Jetts Fitness ปักหมุดความฟิตแห่งใหม่ที่ Central Khon Kaen Campus ✨ . สายออกกำลังกายเตรียมตัวให้พร้อม เพราะขอนแก่นกำลังจะมี Jetts Fitness...,www.facebook.com
2026-05-14,Unknown,Songkran Special Class. Splash the Fit ที่ Jetts Fitness ☀️ ...,https://www.instagram.com/p/DW01HtXjJrA/,... Jetts Fitness แค่นี้ก็รับไปเลย ซองกันน้ำคอลเลกชันพิเศษจาก Jetts Fitness ✨ มาเข้าคลาส ฟิตพร้อมเปียกกันเยอะ ๆ น้า! 🏋️‍♂️ #jettsfitness #jettsthailand ...,www.instagram.com
2026-05-14,Unknown,”โค้ชกิ๊ฟ & กัปตันหน่อง“ นำทีมน้องๆ โลมาสีชมพูเข้าสวัสดีปีใหม่ @ ...,https://www.instagram.com/p/DUAn3rwj3Qc/,99 likes. jettsfitnessthailand. เฉลยแล้ว! Jetts Fitness คลับใหม่ 🏋️‍♂️ เตรียมบุกโครงการใหม่ Rest Park Suvarnabhumi ...,www.instagram.com
