Topic_Type,Date_Extracted,Published_Date,Heading,URL,Body_Snippet,Source_Site
Organic Search Result,2026-06-01,27 เม.ย. 2026,TTBเข้มคุณภาพสินเชื่อ เชื่อ'กนง.'ไม่ลดดอกเบี้ย,https://thunhoon.com/ttb28042569,#TTB #ทันหุ้น – TTB ยังโค้งเป้าสินเชื่อปีนี้ทรงตัวหรือบวก 2% แม้ไตรมาสแรกจะหดตัว ยึดหลักการเน้นคุณภาพสินเชื่อเป็นอันดับแรก รักษา NIM ที่3.02% เพิ่มการสร้างกำไรด้วยการมุ่งกลุ่มลูกค้าผลตอบแทนสูง ...,thunhoon.com
Organic Search Result,2026-06-01,7 เม.ย. 2026,สงกรานต์นี้ ชวนเที่ยว “พิพิธภัณฑ์ครุฑ” ร่วมสรงน้ำพระ สักการะองค์ ...,https://www.brandbuffet.in.th/2026/04/ttb-garuda-museum/,ttbทีเอ็มบีธนชาตพิพิธภัณฑ์ครุฑเทศกาลสงกรานต์. previous post. ASMT ผนึก จิตวิทยา จุฬาฯ ยกระดับ HRD ไทย ผสาน จิตวิทยา-เทคโนโลยี สู่แพลตฟอร์ม SCREENEO. next post ...,www.brandbuffet.in.th
Organic Search Result,2026-06-01,Unknown,ภารกิจออกล่าความอร่อย จากบัตรเครดิต ttb ลงทะเบียนรับสิทธิ์ และ ...,https://www.tiktok.com/@ttbbankofficial/video/7634378302001630465,"วิดีโอ TikTok จาก ttb bank (@ttbbankofficial): ""ภารกิจออกล่าความอร่อย จากบัตรเครดิต ttb ลงทะเบียนรับสิทธิ์ และอ่านรายละเอียดเพิ่มเติมได้ที่เว็บไซต์ธนาคาร หรือ แอป ttb touch ...",www.tiktok.com
Organic Search Result,2026-06-01,Unknown,โบนัสออกแล้ว ชาว ttb จะเอาไปทำอะไรกันบ้างนะ,https://www.youtube.com/shorts/AzZ_G-eRUbA,โบนัสออกแล้ว ชาว ttb จะเอาไปทำอะไรกันบ้างนะ #โบนัสประจำปี #พนักงานธนาคาร #สวัสดิการบริษัท #ttb #MakeREALChange.,www.youtube.com
Organic Search Result,2026-06-01,26 เม.ย. 2026,Head of PMO - ttb bank,https://bebee.com/th/jobs/head-of-pmo-ttb-bank-chatu-chak-bangkok-city--theirstack-670285582,"ประเทศไทย · งาน · ผู้จัดการโครงการ; Head of PMO. กลับ. Head of PMO. Operations. ttb bank. Chatu Chak, ประเทศไทย 1 months ago Until 24/6/2569. เต็มเวลา ที่สำนักงาน. บันทึก",bebee.com
Organic Search Result,2026-06-01,20 เม.ย. 2026,TTB โชว์กำไร 5.17 พันล้าน NIM ทรง 3.02% ฝ่าดอกเบี้ยขาลง- ...,https://www.thansettakij.com/finance/stockmarket/657029,TTB โชว์กำไรไตรมาส 1/69 ที่ 5170 ล้านบาท โต 1.4% จากปีก่อน แม้รายได้ดอกเบี้ยถูกกดจากดอกเบี้ยขาลงและสินเชื่อชะลอ ได้แรงหนุนจากรายได้ค่าธรรมเนียม-คุมต้นทุน-ลดค่าใช้จ่ายดอกเบี้ย ช่วยพยุง NIM ...,www.thansettakij.com
Organic Search Result,2026-06-01,29 เม.ย. 2026,การชำระเงิน,https://www.jqcomputer.com/payment,"UOB. 0.64%/เดือน. 3 เดือน4 เดือน6 เดือน10 เดือน. ขั้นต่ำ ฿1,000/เดือน. TTB.",www.jqcomputer.com
Organic Search Result,2026-06-01,10 เม.ย. 2026,📢 มาค่ะ !! ครั้งแรกที่ บัตรเครดิต ttb จัดโปรฯ ร่วมกับ ฮะจิบัง ราเมน ...,https://www.instagram.com/p/DW8tzSBmSl7/,TTB ออกโปรถูกใจสายราเมน ทานอาหารที่ร้าน Hachiban Ramen ครบ 500 บาท/ใบเสร็จ รับเครดิตเงินคืนไปเลย 88 บาท เพียงแค่ลงทะเบียนผ่านแอป ttb touch 1 เม.ย. - 30 ...,www.instagram.com
Organic Search Result,2026-06-01,Unknown,สนุกครบ จบที่บัตรเครดิต ttb พร้อมรับเครดิตเงินคืนสูงสุด 150 บาท ...,https://www.facebook.com/ttbbankofficial/posts/%E0%B8%AA%E0%B8%99%E0%B8%B8%E0%B8%81%E0%B8%84%E0%B8%A3%E0%B8%9A-%E0%B8%88%E0%B8%9A%E0%B8%97%E0%B8%B5%E0%B9%88%E0%B8%9A%E0%B8%B1%E0%B8%95%E0%B8%A3%E0%B9%80%E0%B8%84%E0%B8%A3%E0%B8%94%E0%B8%B4%E0%B8%95-ttb%E0%B8%9E%E0%B8%A3%E0%B9%89%E0%B8%AD%E0%B8%A1%E0%B8%A3%E0%B8%B1%E0%B8%9A%E0%B9%80%E0%B8%84%E0%B8%A3%E0%B8%94%E0%B8%B4%E0%B8%95%E0%B9%80%E0%B8%87%E0%B8%B4%E0%B8%99%E0%B8%84%E0%B8%B7%E0%B8%99%E0%B8%AA%E0%B8%B9%E0%B8%87%E0%B8%AA%E0%B8%B8%E0%B8%94-150-%E0%B8%9A%E0%B8%B2%E0%B8%97%E0%B9%80%E0%B8%9E%E0%B8%B5%E0%B8%A2%E0%B8%87%E0%B8%9C%E0%B8%B9%E0%B8%81%E0%B8%9A%E0%B8%B1%E0%B8%95%E0%B8%A3%E0%B9%80%E0%B8%84%E0%B8%A3%E0%B8%94%E0%B8%B4%E0%B8%95/1029452256085222/,WWW.TTBBANK.COM. ttb bank. Financial service. LEARN MORE.,www.facebook.com
Organic Search Result,2026-06-01,22 เม.ย. 2026,บริษัทหลักทรัพย์ ทีทีบี เวลธ์ จำกัด (มหาชน),https://www.ttbwealth.co.th/Content/ttb_wealth/216/th,"ttb wealth securities public company limited. ชื่อย่อของบริษัท, TNS, ttb wealth. โลโก้ของบริษัท, wel-tns_logo, wel-ttbwealth_logo. เว็บไซต์, www.thanachartsec.com ...",www.ttbwealth.co.th
Organic Search Result,2026-06-01,23 เม.ย. 2026,ttb wealth | Global Trade Code | บทวิเคราะห์ประจำวันที่ 23 ...,https://www.settrade.com/th/research/analyst-research/dr/111126-ttb-wealth-global-trade-code,ttb wealth | Global Trade Code | บทวิเคราะห์ประจำวันที่ 23 เมษายน 2569. 23 เม.ย. 2569 09:00. 47 views. ttb wealth · Facebook · Line · X. Highlights.,www.settrade.com
Organic Search Result,2026-06-01,29 เม.ย. 2026,บัตรเครดิต ttb เปิดเกมก่อนใคร จับมือฮะจิบัง ราเมน ออก ...,https://www.prachachat.net/public-relations/news-1999440,บัตรเครดิต ttb เปิดเกมก่อนใคร จับมือฮะจิบัง ราเมน ออกโปรแรง ครั้งแรกในไทย กินครบ 500 บาท รับเครดิตเงินคืน 88 บาท.,www.prachachat.net
Organic Search Result,2026-06-01,1 เม.ย. 2026,โปรโมชั่น บัตรเครดิต TTB,https://www.indexlivingmall.com/blog/post/bank-partner-installment-ttb,"รายละเอียดโปรโมชัน : ช้อปคุ้มสินค้าบ้านกับบัตร ttb ที่ www.indexlivingmall.com (การชำระเงินผ่านช่องทาง e-wallet ไม่เข้าร่วมรายการ). ชำระเต็มจำนวน : รับเครดิตเงินคืนสูงสุด 12,000 บาท ...",www.indexlivingmall.com
Organic Search Result,2026-06-01,7 เม.ย. 2026,ท่อเชง 53 TTB 🚀 สอบถามได้คับ,https://www.tiktok.com/@ttb.racing.shop.3/photo/7625949662746332424,"630 Likes, TikTok video from TTB Racing Shop (@ttb.racing.shop.3): “ท่อเชง 53 TTB สอบถามได้คับ #แคมซิ่งTTB #อู่บังท๊อป_สจเทศบาล ...",www.tiktok.com
Organic Search Result,2026-06-01,Unknown,"""TTB"" กำไรสุทธิ 5170 ล้าน ตั้งสำรองเพิ่ม | TNN ชั่วโมงทำเงิน | 21 ...",https://www.youtube.com/shorts/EfkPQQmRZ2g,"""TTB"" กำไรสุทธิ 5170 ล้าน ตั้งสำรองเพิ่ม | TNN ชั่วโมงทำเงิน | 21-04-69 . ธนาคารทหารไทยธนชาต รายงานผลประกอบการไตรมาส 1 มีกำไรสุทธิ 5170 ล้านบาท ...",www.youtube.com
Organic Search Result,2026-06-01,Unknown,จัดการร้านครบวงจร รู้ต้นทุนชัดขึ้น ขยายโอกาสเติบโต และโตต่อด้วยAI ...,https://www.tiktok.com/@ttbbankofficial/video/7629293904994536724,ค่าธรรมเนียมทุกธุรกรรม เมื่อใช้บัญชี ttbรับเงินผ่าน Wongnai POS มีโอกาสรับวงเงินพร้อมใช้ตามรายได้ พร้อมสิทธิพิเศษจากพาร์ทเนอร์ เห็นกำไรขาดทุน ควบคุมรายจ่ายแม่นยำ ลดรั่วไหล ด้วยโปรแกรมบัญชี ...,www.tiktok.com
Organic Search Result,2026-06-01,2 พ.ค. 2026,ทีทีบี เปิดตัวโซลูชันโอนเงินหยวน “เต็มจำนวน” ตอบโจทย์คู่ค้า ...,https://marketeeronline.co/archives/454318,#ทำธุรกรรมต่างประเทศกับทีทีบีครบจบในที่เดียว #ttbโอนเงินหยวนไวไม่ต้องเผื่อยอด #ให้ชีวิตการเงินดีทั้งวันนี้และอนาคต #เปลี่ยนเพื่อให้ชีวิตคุณดีขึ้น ...,marketeeronline.co
Organic Search Result,2026-06-01,1 พ.ค. 2026,TTB เร่งซื้อหุ้นคืน เพิ่มวงเงินแตะ 3.5 หมื่นล.,https://www.hoonvision.com/hoonset/ttb-%E0%B9%80%E0%B8%A3%E0%B9%88%E0%B8%87%E0%B8%8B%E0%B8%B7%E0%B9%89%E0%B8%AD%E0%B8%AB%E0%B8%B8%E0%B9%89%E0%B8%99%E0%B8%84%E0%B8%B7%E0%B8%99-%E0%B9%80%E0%B8%9E%E0%B8%B4%E0%B9%88%E0%B8%A1%E0%B8%A7/,หุ้นวิชั่น – นายปิติ ตัณฑเกษม ประธานเจ้าหน้าที่บริหารธนาคารทหารไทยธนชาต จำกัด (มหาชน) หรือ TTB เปิดเผยถึงโครงการซื้อหุ้นคืนว่า สำหรับโครงการซื้อหุ้นคืนของทีทีบี ...,www.hoonvision.com
Organic Search Result,2026-06-01,20 เม.ย. 2026,TTB รายได้ค่าฟีเพิ่ม-ตั้งสำรองลด ดันกำไร Q1 แตะ 5.17 พันล้านบาท,https://today.line.me/th/v3/article/7NJz9LQ,ธนาคารทหารไทยธนชาต จำกัด (มหาชน) หรือ TTB รายงานผลการดำเนินงานไตรมาส 1/2569 สิ้นสุดวันที่ 31 มีนาคม 2569 มีกำไรสุทธิ ดังนี้ สำหรับ TTB รา...,today.line.me
Organic Search Result,2026-06-01,10 เม.ย. 2026,TTB เคียงข้างลูกค้าและพนักงาน ฝ่าวิกฤตค่าครองชีพ–น้ำมันแพง ...,https://www.mitihoon.com/2026/04/10/633041/,การเดินทาง: เดินทางในกรุงเทพฯ ด้วยรถไฟฟ้าสายสีน้ำเงิน สีม่วง สีเหลือง สีชมพู และสีแดง แตะชำระด้วย EMV Contactless ผ่านบัตรเครดิต ttb รับเครดิตเงินคืน 50% ส่วนลูกค้าที่เดินทางกลับภูมิลำเนา หรือ ...,www.mitihoon.com
Organic Search Result,2026-06-01,1 พ.ค. 2026,เดินทางครึ่งราคา ด้วยบัตรเดบิต ttb all free ที่ รถไฟฟ้าสายสีน้ำเงิน ...,https://www.ttbbank.com/th/promotion/debit-card/auto/ttb-debit-mrt-may26,เดินทางครึ่งราคา ด้วยบัตรเดบิต ttb all free. รับเงินคืนเข้าบัญชีเงินฝาก 50% เมื่อแตะจ่าย EMV Contactless ตั้งแต่ 17 บาทขึ้นไป / เซลล์สลิป ที่รถไฟฟ้าสายสีน้ำเงิน สี ...,www.ttbbank.com
Organic Search Result,2026-06-01,19 เม.ย. 2026,DECOS ชั้นคว่ำจาน 3 ชั้น ขนาด 69x33.5x9 ซม. รุ่น TTB-449 ...,https://www.dohome.co.th/product/decos-3-tier-dish-drying-rack-size-69x33-5x9-cm-model-ttb-449-navy-10252215,DECOS ชั้นคว่ำจาน 3 ชั้น ขนาด 69x33.5x9 ซม. รุ่น TTB-449 สีน้ำเงิน. 10252215. ฿259.00/ชิ้น. icon-minus icon-add. icon-basket เพิ่มลงรถเข็น. ฟรีค่าส่ง. บริการจัดส่ง. พร้อมจัดส่ง.,www.dohome.co.th
Organic Search Result,2026-06-01,22 เม.ย. 2026,บัตรเครดิต ttb จับมือ Visa ปล่อยแคมเปญ FIFA World Cup 2026 ...,https://www.longtunman.com/67917,บัตรเครดิต ttb จับมือ Visa ปล่อยแคมเปญ FIFA World Cup 2026™ รูด ลุ้น รถ ชวนลูกค้าใช้จ่ายผ่านบัตรลุ้นรถ และรางวัลรวมมูลค่ากว่า 2 ล้านบาท. 22 เม.ย. 2026. ทีทีบี สร้างสีสันใหม่ให้การใช้จ่ายในช่วง ...,www.longtunman.com
Organic Search Result,2026-06-01,16 เม.ย. 2026,ยื่นสินเชื่อ ธนาคาร TTB ช้ามาก พนักงานที่มารับเรื่อง ก็ติดต่อยากมาก,https://pantip.com/topic/44055261,ธนาคารทหารไทยธนชาต TMB Touch ธนาคารทหารไทย สินเชื่อรถยนต์. เนื่องจากยื่นสินเชื่อรถแลกเงินเพื่อ รวมหนี้ของ TTB ไปตั้งแต่เมื่อวันที่ 2/4/2026โดยมีเจ้าหน้าที่มารับเอกสาร,pantip.com
Organic Search Result,2026-06-01,Unknown,"""TTB"" กำไรสุทธิ 5,170 ล้าน ตั้งสำรองเพิ่ม | TNN ชั่วโมงทำเงิน | 21 ...",https://www.tiktok.com/@tnnwealth/video/7631043761480469778,"288 ถูกใจ,วิดีโอ TikTok จาก TNN Wealth (@tnnwealth): """"TTB"" กำไรสุทธิ 5170 ล้าน ตั้งสำรองเพิ่ม | TNN ชั่วโมงทำเงิน | 21-04-69 .",www.tiktok.com
Organic Search Result,2026-06-01,29 เม.ย. 2026,ธนาคารทหารไทยธนชาต (TTB) ราคา-สเปค-โปรโมชั่นล่าสุด,https://www.checkraka.com/personalloan/TTB/,สินเชื่อบ้านรีไฟแนนซ์ดอกเบี้ยต่อปีไม่เกิน 1.900 - 5.825%. เพิ่มเพื่อเปรียบเทียบ. สินเชื่อรถแลกเงิน ttb DRIVE. ธนาคารทหารไทย ...,www.checkraka.com
Organic Search Result,2026-06-01,30 เม.ย. 2026,"ttb DRIVE x Motor Show 2026 ช่วยผ่อนรถ EV สูงสุด 5,000.-",https://www.grandprix.co.th/ttb-drive-x-motor-show-2026/,ออกรถยนต์ไฟฟ้า ttb DRIVE ช่วยผ่อน สูงสุด 5000 บาท*เพียงสมัครสินเชื่อรถยนต์ใหม่ ทีทีบีไดรฟ์ พร้อมเปิดบัญชี ทีทีบี ออลล์ฟรี และสมัครเข้าใช้งาน.,www.grandprix.co.th
Organic Search Result,2026-06-01,Unknown,💦🌸 สวัสดีปีใหม่ไทย 2569 🌸💦 ทีทีบี ขอส่งความสุขในเทศกาล ...,https://x.com/ttbbankofficial/status/2043479276964761673,ttb bank (@ttbbankofficial). 6 likes. สวัสดีปีใหม่ไทย 2569 ทีทีบี ขอส่งความสุขในเทศกาลสงกรานต์ ขอให้ทุกการเดินทางเป็นไปอย่างราบรื่น ...,x.com
Organic Search Result,2026-06-01,2 พ.ค. 2026,ทีทีบี เปิดตัวโซลูชันโอนเงินหยวน “เต็มจำนวน” ตอบโจทย์คู่ค้า ...,https://marketeeronline.co/archives/454318,#ทำธุรกรรมต่างประเทศกับทีทีบีครบจบในที่เดียว #ttbโอนเงินหยวนไวไม่ต้องเผื่อยอด #ให้ชีวิตการเงินดีทั้งวันนี้และอนาคต #เปลี่ยนเพื่อให้ชีวิตคุณดีขึ้น ...,marketeeronline.co
Organic Search Result,2026-06-01,Unknown,"TTB ชัด! ""ลดทุน"" ตัดหุ้นซื้อคืนทิ้ง.! ดิวิเดนด์ยีลด์ 6-7%",https://www.youtube.com/watch?v=kmZbCDMw434,"TTB ชัด! ""ลดทุน"" ตัดหุ้นซื้อคืนทิ้ง.! ดิวิเดนด์ยีลด์ 6-7% ติดตาม Kaohoon TV Online ได้ที่ Youtube : https://www.youtube.com/@KaohoonTVOnline Facebook ...",www.youtube.com
Organic Search Result,2026-06-01,22 เม.ย. 2026,บัตรเครดิต ttb จับมือ Visa ปล่อยแคมเปญ FIFA World Cup 2026 ...,https://www.longtunman.com/67917,บัตรเครดิต ttb จับมือ Visa ปล่อยแคมเปญ FIFA World Cup 2026™ รูด ลุ้น รถ ชวนลูกค้าใช้จ่ายผ่านบัตรลุ้นรถ และรางวัลรวมมูลค่ากว่า 2 ล้านบาท. 22 เม.ย. 2026. ทีทีบี สร้างสีสันใหม่ให้การใช้จ่ายในช่วง ...,www.longtunman.com
Organic Search Result,2026-06-01,Unknown,เล่นน้ำให้สนุก เดินทางปลอดภัยนะคะ 💙🧡 เงื่อนไขเป็นไปตามที่ธนาคาร ...,https://www.tiktok.com/@ttbbankofficial/video/7627055205351263489,"68 ถูกใจ,วิดีโอ TikTok จาก ttb bank (@ttbbankofficial): ""เล่นน้ำให้สนุก เดินทางปลอดภัยนะคะ เงื่อนไขเป็นไปตามที่ธนาคารกำหนด #สงกรานต์2569 #ttballfree #ttb ...",www.tiktok.com
Organic Search Result,2026-06-01,1 เม.ย. 2026,บัตรเครดิต ttb กิน-ช้อป สุดคุ้ม ที่ Megabangna | ทีเอ็มบีธนชาต ( ...,https://www.ttbbank.com/th/promotion/credit-card/dining/shopping-megabangna-apr26,"เมื่อมียอดใช้จ่ายตั้งแต่ 1,000 บาทขึ้นไป / เซลล์สลิป ทำรายการด้วยตนเองผ่านแอป ttb touch ก่อนวันสรุปยอดบัญชี. เงื่อนไขการทำรายการ 0% นาน 3 เดือน กับบริการ ttb so goood.",www.ttbbank.com
Organic Search Result,2026-06-01,Unknown,สนุกครบ จบที่บัตรเครดิต ttb พร้อมรับเครดิตเงินคืนสูงสุด 150 บาท ...,https://www.facebook.com/ttbbankofficial/posts/%E0%B8%AA%E0%B8%99%E0%B8%B8%E0%B8%81%E0%B8%84%E0%B8%A3%E0%B8%9A-%E0%B8%88%E0%B8%9A%E0%B8%97%E0%B8%B5%E0%B9%88%E0%B8%9A%E0%B8%B1%E0%B8%95%E0%B8%A3%E0%B9%80%E0%B8%84%E0%B8%A3%E0%B8%94%E0%B8%B4%E0%B8%95-ttb%E0%B8%9E%E0%B8%A3%E0%B9%89%E0%B8%AD%E0%B8%A1%E0%B8%A3%E0%B8%B1%E0%B8%9A%E0%B9%80%E0%B8%84%E0%B8%A3%E0%B8%94%E0%B8%B4%E0%B8%95%E0%B9%80%E0%B8%87%E0%B8%B4%E0%B8%99%E0%B8%84%E0%B8%B7%E0%B8%99%E0%B8%AA%E0%B8%B9%E0%B8%87%E0%B8%AA%E0%B8%B8%E0%B8%94-150-%E0%B8%9A%E0%B8%B2%E0%B8%97%E0%B9%80%E0%B8%9E%E0%B8%B5%E0%B8%A2%E0%B8%87%E0%B8%9C%E0%B8%B9%E0%B8%81%E0%B8%9A%E0%B8%B1%E0%B8%95%E0%B8%A3%E0%B9%80%E0%B8%84%E0%B8%A3%E0%B8%94%E0%B8%B4%E0%B8%95/1029452256085222/,WWW.TTBBANK.COM. ttb bank. Financial service. LEARN MORE.,www.facebook.com
Organic Search Result,2026-06-01,27 เม.ย. 2026,ttb wealth | Global Trade Code | บทวิเคราะห์ประจำวันที่ 27 ...,https://www.settrade.com/th/research/analyst-research/dr/111415-ttb-wealth-global-trade-code,ttb wealth | Global Trade Code | บทวิเคราะห์ประจำวันที่ 27 เมษายน 2569. 27 เม.ย. 2569 09:18. 36 views. ttb wealth · Facebook · Line · X. Highlights.,www.settrade.com
Organic Search Result,2026-06-01,2 เม.ย. 2026,ttb ในวันที่ธนาคารเป็นมากกว่าธนาคาร แต่คือการสร้าง Ecosystem ที่ ...,https://futuretrend.co/futuretrends-awards-2026-ttb/,ttb คว้ารางวัล The Most Innovative ในงาน Future Trends Awards 2026 จากโปรเจกต์ Personalized Car Ecosystem นวัตกรรมที่พลิกโฉมประสบการณ์การเป็นเจ้าของรถยนต์ของคนไทยอย่าง ...,futuretrend.co
Organic Search Result,2026-06-01,Unknown,ภารกิจออกล่าความอร่อย จากบัตรเครดิต ttb,https://www.youtube.com/shorts/orlcOcS8wl0,ภารกิจออกล่าความอร่อย จากบัตรเครดิต ttb กิน 1200 บาท รับเครดิตเงินคืน 100 บาท พิเศษ กินครบ 5 ร้าน ไม่ซ้ำ รับเครดิตเงินคืนเพิ่มอีก 300 บาท กับร้านอาหารชั้นนำมากกว่า 40 ร้าน ทั่วประเทศ ...,www.youtube.com
Organic Search Result,2026-06-01,Unknown,โบนัสออกแล้ว ชาว ttb จะเอาไปทำอะไรกันบ้างนะ💙🧡 #โบนัสประจำปี ...,https://www.tiktok.com/@ttbbankofficial/video/7626614130111221010,"52 ถูกใจ,วิดีโอ TikTok จาก ttb bank (@ttbbankofficial): ""โบนัสออกแล้ว ชาว ttb จะเอาไปทำอะไรกันบ้างนะ #โบนัสประจำปี #พนักงานธนาคาร #สวัสดิการบริษัท #ttb ...",www.tiktok.com
Organic Search Result,2026-06-01,2 เม.ย. 2026,ttb เผยคนไทยระวังใช้เงินขึ้น แต่รูดปรื๊ดไม่แผ่วโต 15% กระจุกกลุ่ม ...,https://www.workpointtoday.com/ttb-credit-card-797586-2,แม้ว่าเศรษฐกิจไทยยังไม่ได้ฟื้นตัวเต็มที่ แต่หนึ่งในพฤติกรรมที่ยังเติบโตต่อเนื่องคือ 'การใช้จ่ายผ่านบัตรเครดิต' ข้อมูลของ ธนาคารทหารไทยธนชาต (ttb) เปิดเผยยอดใช้จ่ายผ่านบัตรเครดิตยังคงเติบโตในปี ...,www.workpointtoday.com
