Topic_Type,Date_Extracted,Published_Date,Heading,URL,Body_Snippet,Source_Site
Organic Search Result,2026-06-01,1 พ.ค. 2026,Head of Wealth Customer Relationship Manager (Phuket),https://bebee.com/th/jobs/head-of-wealth-customer-relationship-manager-phuket-tmbthanachart-bank-or-ttb-phuket--theirstack-674342870,"... Manager (Phuket). Finance. TMBThanachart Bank or ttb / ทีเอ็มบีธนชาต หรือ ทีทีบี. Phuket, ประเทศไทย 3 weeks ago Until 30/6/2569. เต็มเวลา ที่สำนักงาน. บันทึก. Apply now.",bebee.com
Organic Search Result,2026-06-01,27 เม.ย. 2026,TTBเข้มคุณภาพสินเชื่อ เชื่อ'กนง.'ไม่ลดดอกเบี้ย,https://thunhoon.com/ttb28042569,#TTB #ทันหุ้น – TTB ยังโค้งเป้าสินเชื่อปีนี้ทรงตัวหรือบวก 2% แม้ไตรมาสแรกจะหดตัว ยึดหลักการเน้นคุณภาพสินเชื่อเป็นอันดับแรก รักษา NIM ที่3.02% เพิ่มการสร้างกำไรด้วยการมุ่งกลุ่มลูกค้าผลตอบแทนสูง ...,thunhoon.com
Organic Search Result,2026-06-01,17 เม.ย. 2026,ttb เปิดเผยว่า ค่าเงินบาทเช้านี้เปิดตลาด 32.04 บาท/ดอลลาร์ ...,https://www.mitihoon.com/2026/04/17/633600/,ttb เปิดเผยว่า ค่าเงินบาทเช้านี้เปิดตลาด 32.04 บาท/ดอลลาร์สหรัฐ ใกล้เคียงกับราคาปิดตลาดเมื่อวานที่ระดับ 32.03 บาท/ดอลลาร์สหรัฐ. 17 เมษายน 2026 / เวลา 08:51 น ...,www.mitihoon.com
Organic Search Result,2026-06-01,18 เม.ย. 2026,"จับตา TTB ประกาศงบ Q1/69 โบรกคาดกำไรที่ 5 พันลบ.แนะนำ""ถือ""",https://today.line.me/th/v3/article/YamgzaN,TTB #ทันหุ้น-ธนาคารทหารไทยธนชาต จำกัด (มหาชน)หรือ TTB เตรียมจะประกาศผลดำเนินงานงวดไตรมาส 1/69ในวันที่ 20 เม.ย.นี้ ซึ่งโบรกเกอร์คาดว่าจะ...,today.line.me
Organic Search Result,2026-06-01,Unknown,"TTB ชัด! ""ลดทุน"" ตัดหุ้นซื้อคืน ทิ้ง!",https://www.tiktok.com/@kaohoon/video/7631839684007677201,"912 ถูกใจ,21 ความคิดเห็นวิดีโอ TikTok จาก ข่าวหุ้นธุรกิจ (@kaohoon): ""TTB ประกาศชัด ""ลดทุน"" ด้วยการตัดหุ้นซื้อคืนทิ้ง! เผยดิวิเดนด์ยีลด์ 6-7% น่าสนใจ. #ข่าวหุ้นธุรกิจออนไลน์ #ข่าวธุรกิจ ...",www.tiktok.com
Organic Search Result,2026-06-01,29 เม.ย. 2026,บัตรเครดิต ttb เปิดเกมก่อนใคร จับมือฮะจิบัง ราเมน ออก ...,https://www.prachachat.net/public-relations/news-1999440,บัตรเครดิต ttb เปิดเกมก่อนใคร จับมือฮะจิบัง ราเมน ออกโปรแรง ครั้งแรกในไทย กินครบ 500 บาท รับเครดิตเงินคืน 88 บาท.,www.prachachat.net
Organic Search Result,2026-06-01,30 เม.ย. 2026,บัตรเครดิต ttb จับมือ “ยูนิโคล่” เปิดโปรแรง รับ Cashback รวม ...,https://www.prachachat.net/public-relations/news-1999485,บัตรเครดิต ttb รุกตลาดไลฟ์สไตล์แฟชันให้ลูกค้ามีชีวิตทางการเงินที่ดีขึ้น จับมือแบรนด์ดัง ยูนิโคล่ ประเทศไทย มอบโปรโมชันรับเครดิตเงินคืนรวมสูงสุด 25% ตอกย้ำทิศทางการทำตลาดบัตรเครดิตที่มุ่งสร้างความแตกต่าง ...,www.prachachat.net
Organic Search Result,2026-06-01,Unknown,"TTB ชัด! ""ลดทุน"" ตัดหุ้นซื้อคืน ทิ้ง!",https://www.tiktok.com/@kaohoon/video/7631839684007677201,"912 ถูกใจ,21 ความคิดเห็นวิดีโอ TikTok จาก ข่าวหุ้นธุรกิจ (@kaohoon): ""TTB ประกาศชัด ""ลดทุน"" ด้วยการตัดหุ้นซื้อคืนทิ้ง! เผยดิวิเดนด์ยีลด์ 6-7% น่าสนใจ. #ข่าวหุ้นธุรกิจออนไลน์ #ข่าวธุรกิจ ...",www.tiktok.com
Organic Search Result,2026-06-01,Unknown,Enjoy a fulfilling 4-day trip to Hong Kong with the TTB ...,https://www.youtube.com/shorts/scYRdnb9vS0,เที่ยวฮ่องกง 4 วันแบบคุ้ม ๆ ครบทุกรสชาติ ทริปเดียวมีทั้ง เดินเขา มูเตลู และช้อปปิ้ง แถมยังเพิ่มความคุ้มค่าด้วยสิทธิประโยชน์ในบัตรเครดิต ttb absolute อีกด้วย ส่วนจะคุ้มแค่ไหน และฮ่องกงดีงามยังไง ...,www.youtube.com
Organic Search Result,2026-06-01,28 เม.ย. 2026,TTB ปั้นประกันเชื่อมตลาดสหรัฐ เจาะมนุษย์เงินเดือน คืนเงินต้น 100%,https://www.kaohoon.com/news/828043,TTB เปิดตัวประกันชีวิต “ทีทีบี ยูเอส มัลติ-แอสเซต อินเด็กซ์ พรินซิเพิล โพรเทค 15/5” เจาะกลุ่มมนุษย์เงินเดือน เชื่อมดัชนี Citi QuantCube Multi-Asset พร้อมใช้ AI วิเคราะห์ตลาดสหรัฐ ...,www.kaohoon.com
Organic Search Result,2026-06-01,1 เม.ย. 2026,บัตรเครดิต ttb กิน-ช้อป สุดคุ้ม ที่ Megabangna | ทีเอ็มบีธนชาต ( ...,https://www.ttbbank.com/th/promotion/credit-card/dining/shopping-megabangna-apr26,"เมื่อมียอดใช้จ่ายตั้งแต่ 1,000 บาทขึ้นไป / เซลล์สลิป ทำรายการด้วยตนเองผ่านแอป ttb touch ก่อนวันสรุปยอดบัญชี. เงื่อนไขการทำรายการ 0% นาน 3 เดือน กับบริการ ttb so goood.",www.ttbbank.com
Organic Search Result,2026-06-01,Unknown,💦🌸 สวัสดีปีใหม่ไทย 2569 🌸💦 ทีทีบี ขอส่งความสุขในเทศกาล ...,https://x.com/ttbbankofficial/status/2043479276964761673,ttb bank (@ttbbankofficial). 6 likes. สวัสดีปีใหม่ไทย 2569 ทีทีบี ขอส่งความสุขในเทศกาลสงกรานต์ ขอให้ทุกการเดินทางเป็นไปอย่างราบรื่น ...,x.com
Organic Search Result,2026-06-01,Unknown,ชามซิ่ง TTB กับ แคมซิ่ง TTB และ หลีด ลูก62/0,https://www.tiktok.com/@ttb.racing.shop.3/photo/7629326052191554823,"295 Likes, TikTok video from TTB Racing Shop (@ttb.racing.shop.3): “สำรวจชามซิ่ง TTB และแคมซิ่ง TTB ที่เน้นความเร็ว เพื่อขับขี่สนุก พร้อมสอบถามเพิ่มเติม! #แคมซิ่งttb ...",www.tiktok.com
Organic Search Result,2026-06-01,Unknown,Come Shopping With Us Today! | TTB & More,https://www.tiktok.com/@ressaarenae/video/7627666822329797919,"Thank you."" This promises an exciting haul and a day filled with discovery. #ttb #shopping #fyp. Keywords: shopping trip, go shopping, razor bag, bikini, fun ...",www.tiktok.com
Organic Search Result,2026-06-01,21 เม.ย. 2026,เข้าร่วมโครงการคุณสู้เราช่วย ttb,https://pantip.com/topic/44055660,และอาจมีค่าบริการอื่นๆ ซึ่งจะเป็นไปตามประกาศธนาคาร แนะนำให้ชำระเข้ามาให้ตรงวันที่กำหนด หากไม่สามารถชำระตรงตามกำหนดได้ แนะนำติดต่อสอบถามเพิ่มเติมได้ที่ ttb contact center 1428 ...,pantip.com
Organic Search Result,2026-06-01,Unknown,3 High-Interest TTB Savings Accounts: Which One is Best ...,https://www.youtube.com/watch?v=MngM3FloWco,... ttb touch ขั้นต่ำในการเปิดบัญชี : ไม่มี รายละเอียดเพิ่มเติม คลิก ! https://www.ttbbank.com/th/personal/deposits/savings-account/ttb-me-save - บัญชี ทีทีบี ...,www.youtube.com
Organic Search Result,2026-06-01,28 เม.ย. 2026,TTB ปั้นประกันเชื่อมตลาดสหรัฐ เจาะมนุษย์เงินเดือน คืนเงินต้น 100%,https://www.kaohoon.com/news/828043,TTB เปิดตัวประกันชีวิต “ทีทีบี ยูเอส มัลติ-แอสเซต อินเด็กซ์ พรินซิเพิล โพรเทค 15/5” เจาะกลุ่มมนุษย์เงินเดือน เชื่อมดัชนี Citi QuantCube Multi-Asset พร้อมใช้ AI วิเคราะห์ตลาดสหรัฐ ...,www.kaohoon.com
Organic Search Result,2026-06-01,Unknown,โบนัสออกแล้ว ชาว ttb จะเอาไปทำอะไรกันบ้างนะ💙🧡 #โบนัสประจำปี ...,https://www.tiktok.com/@ttbbankofficial/video/7626614130111221010,"51 ถูกใจ,วิดีโอ TikTok จาก ttb bank (@ttbbankofficial): ""โบนัสออกแล้ว ชาว ttb จะเอาไปทำอะไรกันบ้างนะ #โบนัสประจำปี #พนักงานธนาคาร #สวัสดิการบริษัท #ttb ...",www.tiktok.com
Organic Search Result,2026-06-01,Unknown,✨ เดินทางครึ่งราคา ด้วยบัตรเครดิต ttb รับเครดิตเงินคืน ...,https://x.com/BEM_MRT/status/2039606256491749391,BEM Bangkok Expressway and Metro (@BEM_MRT). ✨ เดินทางครึ่งราคา ด้วยบัตรเครดิต ttb รับเครดิตเงินคืน 50% 🗓️ : 1 เม.ย. 69 – 30 มิ.ย.,x.com
Organic Search Result,2026-06-01,16 เม.ย. 2026,อันนี้ใช่เบอร์ ของ TTB รึป่าว เเล้วถ้าไม่ใช่ ทำไมถึงขึ้นชื่อเเบบนี้,https://pantip.com/topic/44055190,อันนี้ใช่เบอร์ ของ TTB รึป่าว เเล้วถ้าไม่ใช่ ทำไมถึงขึ้นชื่อเเบบนี้. สมาชิกหมายเลข 5220322 16 เมษายน 2569 เวลา 10:38:38 น. กระทู้. comment ตอบกระทู้; delete_forever แจ้งข้อความไม่ ...,pantip.com
Organic Search Result,2026-06-01,Unknown,3 High-Interest TTB Savings Accounts: Which One is Best ...,https://www.youtube.com/watch?v=MngM3FloWco,... ttb touch ขั้นต่ำในการเปิดบัญชี : ไม่มี รายละเอียดเพิ่มเติม คลิก ! https://www.ttbbank.com/th/personal/deposits/savings-account/ttb-me-save - บัญชี ทีทีบี ...,www.youtube.com
Organic Search Result,2026-06-01,26 เม.ย. 2026,Head of PMO - ttb bank,https://bebee.com/th/jobs/head-of-pmo-ttb-bank-chatu-chak-bangkok-city--theirstack-670285582,"ประเทศไทย · งาน · ผู้จัดการโครงการ; Head of PMO. กลับ. Head of PMO. Operations. ttb bank. Chatu Chak, ประเทศไทย 1 months ago Until 24/6/2569. เต็มเวลา ที่สำนักงาน. บันทึก",bebee.com
Organic Search Result,2026-06-01,1 เม.ย. 2026,"บัตรเครดิต ttb ทุกวันพุธ รับส่วนลดสูงสุด 50% ที่ Jian Cha, Souri ...",https://www.ttbbank.com/th/promotion/credit-card/dining/wowwed-apr26,ไม่สามารถรับสิทธิ์โดยการบันทึกภาพหน้าจอมือถือ; กรุณาแจ้งใช้สิทธิ์แก่พนักงานก่อนทำการชำระเงินผ่านบัตรเครดิต ttb เท่านั้น. Wow Wednesday x Potato Corner. ทุกวันพุธ รับ ...,www.ttbbank.com
Organic Search Result,2026-06-01,Unknown,ทีทีบี ขอแจ้งวันเปิด - ปิดทำการของสาขาในช่วงเทศกาลสงกรานต์ ...,https://www.instagram.com/p/DW3kVaCDTVM/,"Photo by ttb bank on April 08, 2026. May be a cartoon of tablet.",www.instagram.com
Organic Search Result,2026-06-01,Unknown,บัตรเครดิต ttb ร่วมกับสิทธิประโยชน์จากรัฐบาล ช่วยลดค่าครองชีพ ...,https://www.facebook.com/ttbbankofficial/posts/%E0%B8%9A%E0%B8%B1%E0%B8%95%E0%B8%A3%E0%B9%80%E0%B8%84%E0%B8%A3%E0%B8%94%E0%B8%B4%E0%B8%95-ttb-%E0%B8%A3%E0%B9%88%E0%B8%A7%E0%B8%A1%E0%B8%81%E0%B8%B1%E0%B8%9A%E0%B8%AA%E0%B8%B4%E0%B8%97%E0%B8%98%E0%B8%B4%E0%B8%9B%E0%B8%A3%E0%B8%B0%E0%B9%82%E0%B8%A2%E0%B8%8A%E0%B8%99%E0%B9%8C%E0%B8%88%E0%B8%B2%E0%B8%81%E0%B8%A3%E0%B8%B1%E0%B8%90%E0%B8%9A%E0%B8%B2%E0%B8%A5-%E0%B8%8A%E0%B9%88%E0%B8%A7%E0%B8%A2%E0%B8%A5%E0%B8%94%E0%B8%84%E0%B9%88%E0%B8%B2%E0%B8%84%E0%B8%A3%E0%B8%AD%E0%B8%87%E0%B8%8A%E0%B8%B5%E0%B8%9E%E0%B8%9C%E0%B9%88%E0%B8%B2%E0%B8%99-5-%E0%B8%8B%E0%B8%B9%E0%B9%80%E0%B8%9B%E0%B8%AD%E0%B8%A3%E0%B9%8C%E0%B8%A1%E0%B8%B2%E0%B9%80%E0%B8%81%E0%B9%87/1045399444490503/,บัตรเครดิต ttb ร่วมกับสิทธิประโยชน์จากรัฐบาล ช่วยลดค่าครองชีพ ผ่าน 5 ซูเปอร์มาเก็ตชั้นนำ ให้คนไทยใช้จ่ายได้คุ้มค่ายิ่งขึ้นในช่วงวิกฤตเศรษฐกิจ คุ้ม 1 :...,www.facebook.com
Organic Search Result,2026-06-01,Unknown,เล่นน้ำให้สนุก เดินทางปลอดภัยนะคะ 💙🧡 เงื่อนไขเป็นไปตามที่ธนาคาร ...,https://www.tiktok.com/@ttbbankofficial/video/7627055205351263489,"68 ถูกใจ,วิดีโอ TikTok จาก ttb bank (@ttbbankofficial): ""เล่นน้ำให้สนุก เดินทางปลอดภัยนะคะ เงื่อนไขเป็นไปตามที่ธนาคารกำหนด #สงกรานต์2569 #ttballfree #ttb ...",www.tiktok.com
Organic Search Result,2026-06-01,Unknown,"TTB shows strong growth, beating expectations!! #TTB ...",https://www.youtube.com/shorts/qDEbAEG43nA,TTB โตแกร่งดีกว่าคาดการณ์!! #TTB #หุ้นTTB #วิเคราะห์หุ้น #งบไตรมาส1ปี69 #หุ้นปันผล #ปันผลสูง #TaxBenefit #TTBTouch #การลงทุน #ธนาคารทหารไทยธนชาต #InsideAIBrief #SETIndex ...,www.youtube.com
Organic Search Result,2026-06-01,Unknown,TTB 2nd Annual Event was one for the books!!!! it was nice ...,https://www.tiktok.com/@olivianoyola88/video/7627962949268688159,"22 Likes, TikTok video from Olivia Noyola (@olivianoyola88): “TTB 2nd Annual Event was one for the books!!!! it was nice meeting so many TT Babes.",www.tiktok.com
Organic Search Result,2026-06-01,30 เม.ย. 2026,บัตรเครดิต ttb จับมือ “ยูนิโคล่” เปิดโปรแรง รับ Cashback รวม ...,https://www.prachachat.net/public-relations/news-1999485,บัตรเครดิต ttb รุกตลาดไลฟ์สไตล์แฟชันให้ลูกค้ามีชีวิตทางการเงินที่ดีขึ้น จับมือแบรนด์ดัง ยูนิโคล่ ประเทศไทย มอบโปรโมชันรับเครดิตเงินคืนรวมสูงสุด 25% ตอกย้ำทิศทางการทำตลาดบัตรเครดิตที่มุ่งสร้างความแตกต่าง ...,www.prachachat.net
Organic Search Result,2026-06-01,2 เม.ย. 2026,TTB คว้ารางวัลสินค้าแห่งปี 69 ส่ง “แคชทูโก” นวัตกรรมสินเชื่อ,https://www.kaohoon.com/pr/823440,TTB ตอกย้ำแนวคิดพัฒนาสินเชื่อบุคคลอย่างเป็นธรรม หลัง “ทีทีบี แคชทูโก” คว้ารางวัลนวัตกรรมชีวิตไลฟ์สไตล์ ปี 2569.,www.kaohoon.com
Organic Search Result,2026-06-01,Unknown,สงกรานต์นี้ อย่าให้ทริปสะดุด! เพราะมิจฉาชีพ เที่ยวอย่างสบายใจ ...,https://x.com/ttbbankofficial/status/2041713016962773109,... . 1441 ทันที #ภัยการเงิน #เตือนภัย #BOT #ทุกเดือนต้องเตือนกัน #รู้ทันกันโกง #ให้ชีวิตการเงินดีทั้งวันนี้และอนาคต #เปลี่ยนเพื่อให้ชีวิตคุณดีขึ้น #ttb #MakeREALChange. ttb bank profile. ttb bank.,x.com
Organic Search Result,2026-06-01,Unknown,Roblox Teen Titans Battlegrounds Last Robin Moment,https://www.tiktok.com/@ttitans2/video/7630215095229877518,462Shares. Transcript. มาทํางานที่ ttb. แล้วชีวิตดี๊ดี. วันนี้ปันปันจะพาไปดูการทํางาน. ที่พนักงานบอกว่าดี. จน ...,www.tiktok.com
Organic Search Result,2026-06-01,Unknown,TTB Q1/69 ป้อมปราการปันผลร่างทองชำแหละกลไกกำไรสวนกระแส ...,https://www.youtube.com/watch?v=_ErQcRlyUh8,คลิกที่นี่เพื่อเลี้ยงกาแฟพวกเรา https://tipme.in.th/insight-ai-brief (ปลอดภัย ไม่ต้องใช้บัตรเครดิตจ้า ❤️) Timestamps เนื้อหาที่น่าสนใจ [00:00] - บทนำ: TTB ป้อมปราการปันผลร่างทอง ...,www.youtube.com
Organic Search Result,2026-06-01,Unknown,บัตรเครดิต ttb ร่วมกับสิทธิประโยชน์จากรัฐบาล ช่วยลดค่าครองชีพ ...,https://www.facebook.com/ttbbankofficial/posts/%E0%B8%9A%E0%B8%B1%E0%B8%95%E0%B8%A3%E0%B9%80%E0%B8%84%E0%B8%A3%E0%B8%94%E0%B8%B4%E0%B8%95-ttb-%E0%B8%A3%E0%B9%88%E0%B8%A7%E0%B8%A1%E0%B8%81%E0%B8%B1%E0%B8%9A%E0%B8%AA%E0%B8%B4%E0%B8%97%E0%B8%98%E0%B8%B4%E0%B8%9B%E0%B8%A3%E0%B8%B0%E0%B9%82%E0%B8%A2%E0%B8%8A%E0%B8%99%E0%B9%8C%E0%B8%88%E0%B8%B2%E0%B8%81%E0%B8%A3%E0%B8%B1%E0%B8%90%E0%B8%9A%E0%B8%B2%E0%B8%A5-%E0%B8%8A%E0%B9%88%E0%B8%A7%E0%B8%A2%E0%B8%A5%E0%B8%94%E0%B8%84%E0%B9%88%E0%B8%B2%E0%B8%84%E0%B8%A3%E0%B8%AD%E0%B8%87%E0%B8%8A%E0%B8%B5%E0%B8%9E%E0%B8%9C%E0%B9%88%E0%B8%B2%E0%B8%99-5-%E0%B8%8B%E0%B8%B9%E0%B9%80%E0%B8%9B%E0%B8%AD%E0%B8%A3%E0%B9%8C%E0%B8%A1%E0%B8%B2%E0%B9%80%E0%B8%81%E0%B9%87/1045399444490503/,บัตรเครดิต ttb ร่วมกับสิทธิประโยชน์จากรัฐบาล ช่วยลดค่าครองชีพ ผ่าน 5 ซูเปอร์มาเก็ตชั้นนำ ให้คนไทยใช้จ่ายได้คุ้มค่ายิ่งขึ้นในช่วงวิกฤตเศรษฐกิจ คุ้ม 1 :...,www.facebook.com
Organic Search Result,2026-06-01,1 พ.ค. 2026,Wealth Customer Relationship Manager (Northeast) ...,https://bebee.com/th/jobs/wealth-customer-relationship-manager-northeast-t00026254-ttb-bank-udon-thani--theirstack-672639039,"Wealth Customer Relationship Manager (Northeast) (T00026254). Legal. ttb bank. Udon Thani, ประเทศไทย 1 months ago Until 28/6/2569. เต็มเวลา ที่สำนักงาน. บันทึก. Apply ...",bebee.com
Organic Search Result,2026-06-01,17 เม.ย. 2026,TTB Taqbaylit Aselmed n Lbibel - แอปพลิเคชันใน ...,https://play.google.com/store/apps/details?id=org.ttb.kabyle&hl=th,TTB Taqbaylit Aselmed n Lbibel · เกี่ยวกับแอปนี้ · ความปลอดภัยของข้อมูล · มีอะไรใหม่ · การสนับสนุนของแอป · เพิ่มเติมจาก THRU the BIBLE with Dr. J. Vernon McGee.,play.google.com
