Topic_Type,Date_Extracted,Published_Date,Heading,URL,Body_Snippet,Source_Site
Organic Search Result,2026-06-01,16 เม.ย. 2026,ยื่นสินเชื่อ ธนาคาร TTB ช้ามาก พนักงานที่มารับเรื่อง ก็ติดต่อยากมาก,https://pantip.com/topic/44055261,เนื่องจากยื่นสินเชื่อรถแลกเงินเพื่อ รวมหนี้ของ TTB ไปตั้งแต่เมื่อวันที่ 2/4/2026โดยมีเจ้าหน้าที่มารับเอกสาร และมีการอนุมัติ เมื่อวันที่ 7/4/2026 แต่วันที่ 16/4/2026 ยังไม่มีรายการโอนเงินเข้าเลย ...,pantip.com
Organic Search Result,2026-06-01,30 เม.ย. 2026,Specialist – Product Analytics and Insights - ttb bank,https://bebee.com/th/jobs/specialist-product-analytics-and-insights-ttb-bank-suan-luang-district-bangkok-city--theirstack-659661234,"กลับ. Specialist – Product Analytics and Insights. Marketing. ttb bank. Suan Luang District, ประเทศไทย 1 months ago Until 8/6/2569. เต็มเวลา ที่สำนักงาน. บันทึก. Apply ...",bebee.com
Organic Search Result,2026-06-01,Unknown,"ภารกิจออกล่าความอร่อย จากบัตรเครดิต ttb กิน 1,200 บาท รับเครดิต ...",https://www.instagram.com/reel/DXwUxNjjcpG/,"English Transcript. This is a mission to hunt for deliciousness with ttb credit card. Eat for 1,200 Baht and get 100 Baht cashback. Boss, we've found ...",www.instagram.com
Organic Search Result,2026-06-01,1 เม.ย. 2026,🍜 ครั้งแรกกับโปรฯ สุดคุ้ม! Hachiban Ramen x ttb credit card แค่ทาน ...,https://x.com/hachibanramenth/status/2039192006933794885,ครั้งแรกกับโปรฯ สุดคุ้ม! Hachiban Ramen x ttb credit card แค่ทานอาหารที่ ฮะจิบัง ราเมน และชำระด้วยบัตรเครดิต ttb เพียง 500.- ขึ้นไปต่อเซลล์สลิป รับเครดิตเงินคืน 88.- ระยะเวลา 1 เม.ย ...,x.com
Organic Search Result,2026-06-01,Unknown,คุ้มเพิ่มได้อีก 🔓 แค่มีบัญชี ttb all free คู่บัตรเดบิต ...,https://www.facebook.com/ttbbankofficial/posts/%E0%B8%84%E0%B8%B8%E0%B9%89%E0%B8%A1%E0%B9%80%E0%B8%9E%E0%B8%B4%E0%B9%88%E0%B8%A1%E0%B9%84%E0%B8%94%E0%B9%89%E0%B8%AD%E0%B8%B5%E0%B8%81-%E0%B9%81%E0%B8%84%E0%B9%88%E0%B8%A1%E0%B8%B5%E0%B8%9A%E0%B8%B1%E0%B8%8D%E0%B8%8A%E0%B8%B5-ttb-all-free-%E0%B8%84%E0%B8%B9%E0%B9%88%E0%B8%9A%E0%B8%B1%E0%B8%95%E0%B8%A3%E0%B9%80%E0%B8%94%E0%B8%9A%E0%B8%B4%E0%B8%95-ttb-all-free-disney-%E0%B8%9F%E0%B8%A3%E0%B8%B5%E0%B8%9B%E0%B8%A3%E0%B8%B0%E0%B8%81/1042734624756985/,WWW.TTBBANK.COM. ttb bank. Financial service. LEARN MORE.,www.facebook.com
Organic Search Result,2026-06-01,21 เม.ย. 2026,ttb wealth | The Technical Story | บทวิเคราะห์ประจำวันที่ 21 ...,https://www.settrade.com/th/research/analyst-research/stock/technic/110872-ttb-wealth-the-technical-story,ttb wealth | The Technical Story | บทวิเคราะห์ประจำวันที่ 21 เมษายน 2569. 21 เม.ย. 2569 08:36. 95 views. ttb wealth · Facebook · Line · X. Highlights.,www.settrade.com
Organic Search Result,2026-06-01,Unknown,ttb fly high 2025 The Power of Your REAL Change ค่ำคืนแห่ง ...,https://www.tiktok.com/@ttbbankofficial/video/7634083880328383761,"81 ถูกใจ,วิดีโอ TikTok จาก ttb bank (@ttbbankofficial): ""ttb fly high 2025 The Power of Your REAL Change ค่ำคืนแห่งการมอบรางวัลให้คนที่กล้าคิด กล้าทำ และสร้างผลลัพธ์จริง ...",www.tiktok.com
Organic Search Result,2026-06-01,21 เม.ย. 2026,TTB (HOLD : Fair Price : Bt 2.20) : กำไรสุทธิใน 1Q26 ทรงตัว,https://www.pi.financial/research/ttb-hold-fair-price-bt-220-%E0%B8%81%E0%B8%B3%E0%B9%84%E0%B8%A3%E0%B8%AA%E0%B8%B8%E0%B8%97%E0%B8%98%E0%B8%B4%E0%B9%83%E0%B8%99-1q26-%E0%B8%97%E0%B8%A3%E0%B8%87%E0%B8%95%E0%B8%B1%E0%B8%A7-yoy--toceb8z,TTB (HOLD : Fair Price : Bt 2.20) : กำไรสุทธิใน 1Q26 ทรงตัว YoY และ QoQ ... Published. a month ago. Share this article: facebook icon twitter icon telegram icon line ...,www.pi.financial
Organic Search Result,2026-06-01,Unknown,"TTB makes it clear! ""Capital reduction,"" canceling buyback ...",https://www.youtube.com/shorts/KIVG1gHRI6I,"TTB ชัด!""ลดทุน""ตัดหุ้นซื้อคืนทิ้ง.! ดิวิเดนด์ยีลด์ 6-7% ติดตาม Kaohoon TV Online ได้ที่ Youtube : https://www.youtube.com/@KaohoonTVOnline Facebook ...",www.youtube.com
Organic Search Result,2026-06-01,19 เม.ย. 2026,EXCEL งบกำไรขาดทุน หุ้น TTB ปี 2569 - AiO,https://aio.panphol.com/stock/TTB/pl_excel/1Q2569,EXCEL งบกำไรขาดทุน หุ้น TTB 1Q2569. งบกำไรขาดทุน (ล้านบาท).,aio.panphol.com
Organic Search Result,2026-06-01,2 พ.ค. 2026,ttb เปิดเกมปี 2569 ชู “Empower Your REAL Change” ปักหมุด ...,https://marketeeronline.co/archives/459306,พร้อมกันนี้ ทีทีบียังให้ความสำคัญกับการสร้างวินัยทางการเงินในระยะยาว โดยสนับสนุนให้ลูกค้าเข้าถึงเครื่องมือวางแผนการเงิน เช่น การตรวจสุขภาพทางการเงินออนไลน์ (ttb financial health check) เพื่อ ...,marketeeronline.co
Organic Search Result,2026-06-01,16 เม.ย. 2026,ธ.ก.ส. ร่วมกับ TTB เปิดโครงการฉลองสงกรานต์ ให้ยืม ...,https://www.antifakenewscenter.com/%E0%B8%81%E0%B8%B2%E0%B8%A3%E0%B9%80%E0%B8%87%E0%B8%B4%E0%B8%99-%E0%B8%AB%E0%B8%B8%E0%B9%89%E0%B8%99/%E0%B8%98-%E0%B8%81-%E0%B8%AA-%E0%B8%A3%E0%B9%88%E0%B8%A7%E0%B8%A1%E0%B8%81%E0%B8%B1%E0%B8%9A-ttb-%E0%B9%80%E0%B8%9B%E0%B8%B4%E0%B8%94%E0%B9%82%E0%B8%84%E0%B8%A3%E0%B8%87%E0%B8%81%E0%B8%B2%E0%B8%A3%E0%B8%89%E0%B8%A5%E0%B8%AD%E0%B8%87%E0%B8%AA%E0%B8%87%E0%B8%81%E0%B8%A3%E0%B8%B2%E0%B8%99%E0%B8%95%E0%B9%8C-%E0%B9%83%E0%B8%AB%E0%B9%89%E0%B8%A2%E0%B8%B7%E0%B8%A1-50000-%E0%B8%9A%E0%B8%B2%E0%B8%97-%E0%B8%99%E0%B8%B2%E0%B8%99-60-%E0%B9%80%E0%B8%94%E0%B8%B7%E0%B8%AD%E0%B8%99/,ศูนย์ต่อต้านข่าวปลอม ตรวจสอบ/ยืนยัน ธ.ก.ส. ร่วมกับ TTB เปิดโครงการฉลองสงกรานต์ ให้ยืม 50000 บาท นาน 60 เดือน --> อ่านรายละเอียดได้ที่นี่.,www.antifakenewscenter.com
Organic Search Result,2026-06-01,Unknown,"ภารกิจออกล่าความอร่อย จากบัตรเครดิต ttb กิน 1,200 บาท รับเครดิต ...",https://www.instagram.com/reel/DXwUxNjjcpG/,"15 likes, 0 comments - ttbbankofficial on April 30, 2026: ""ภารกิจออกล่าความอร่อย จากบัตรเครดิต ttb กิน 1200 บาท รับเครดิตเงินคืน 100 บาท พิเศษ กินครบ 5 ร้าน ไม่ซ้ำ ...",www.instagram.com
Organic Search Result,2026-06-01,28 เม.ย. 2026,มนุษย์เงินเดือน 82% มีเงินไม่พอใช้หลังเกษียณ ttb เปิดตัวประกันสะสม ...,https://thestandard.co/ttb-savings-insurance-retirement/,... วางแผนเกษียณ. วันนี้ (28 เมษายน 2569) กนกวรรณ เพชรพิสิฐโชติ ประธานกลุ่มบริหารผลิตภัณฑ์ ธุรกรรมธนาคาร และความมั่งคั่งทางการเงิน ธนาคารทหารไทยธนชาต จำกัด (มหาชน) หรือ TTB ...,thestandard.co
Organic Search Result,2026-06-01,9 เม.ย. 2026,TTB เสริมสภาพคล่อง SME เปิดตัว“ทีทีบี เอสเอ็มอี สมาร์ท พลัส”,https://www.share2trade.com/news/54443/ttb-%E0%B9%80%E0%B8%AA%E0%B8%A3%E0%B8%B4%E0%B8%A1%E0%B8%AA%E0%B8%A0%E0%B8%B2%E0%B8%9E%E0%B8%84%E0%B8%A5%E0%B9%88%E0%B8%AD%E0%B8%87-sme-%E0%B9%80%E0%B8%9B%E0%B8%B4%E0%B8%94%E0%B8%95%E0%B8%B1%E0%B8%A7-%E0%B8%97%E0%B8%B5%E0%B8%97%E0%B8%B5%E0%B8%9A%E0%B8%B5-%E0%B9%80%E0%B8%AD%E0%B8%AA%E0%B9%80%E0%B8%AD%E0%B9%87%E0%B8%A1%E0%B8%AD%E0%B8%B5-%E0%B8%AA%E0%B8%A1%E0%B8%B2%E0%B8%A3%E0%B9%8C%E0%B8%97-%E0%B8%9E%E0%B8%A5%E0%B8%B1%E0%B8%AA,09 เมษายน 2569 ... TTB.jpg ทีทีบี เดินหน้าหนุน SME ไทย ดันสินเชื่อและโซลูชัน “ทีทีบี เอสเอ็มอี สมาร์ท พลัส” วงเงินสูงถึง 333% ของมูลค่าหลักประกัน ดอกเบี้ยพิเศษ 3.5% ใน 2 ปีแรก เสริมสภาพคล่องธุรกิจ ...,www.share2trade.com
Organic Search Result,2026-06-01,30 เม.ย. 2026,บอร์ด TTB ไฟเขียวตั้ง “รพี สุจริตกุล” นั่งประธานกรรมการ มีผลพรุ่งนี้,https://today.line.me/th/v3/article/eL5zP8G,ผู้สื่อข่าวรายงานว่า วันนี้ (30 เม.ย.69) ธนาคารทหารไทยธนชาต จำกัด (มหาชน) หรือ TTB แจ้งผ่านตลาดหลักทรัพย์แห่งประเทศไทยว่า ที่ประชุมคณะกรรมการ...,today.line.me
Organic Search Result,2026-06-01,20 เม.ย. 2026,TTB อวดกำไร 5169.79 ลบ.เพิ่มสำรองหนี้ 10%จากสิ้นปี คุม ...,https://hoonsmart.com/archives/414272,"HoonSmart.com>>""ทหารไทยธนชาต""(TTB) เปิดผลงานไตรมาส 1/69 เข้าเป้า กำไรสุทธิ 5169.79 ล้านบาท โต 1.4% จากช่วงเดียวกันปีก่อน และลดลง 1.3% จากไตรมาส 4 ที่ผ่านมา ...",hoonsmart.com
Organic Search Result,2026-06-01,20 เม.ย. 2026,TTB กำไร Q1/69 แตะ 5.17 พันลบ.,https://www.mitihoon.com/2026/04/20/634107/,มิติหุ้น - ธนาคารทหารไทยธนชาต จำกัด (มหาชน) หรือ TTB รายงานกำไรสุทธิไตรมาส 1/2569 อยู่ที่ 5170 ล้านบาท ทรงตัวใกล้เคียงไตรมาสก่อนและช่วงเดียวกันปีก่อน.,www.mitihoon.com
Organic Search Result,2026-06-01,20 เม.ย. 2026,TTB ตรึงกำไร Q1/69 เหนือ 5 พันลบ.แม้สินเชื่อหด คุม NPL ...,https://www.ryt9.com/s/iq05/12807501,นายปิติ ตัณฑเกษม ประธานเจ้าหน้าที่บริหาร ธนาคารทหารไทยธนชาต [TTB] เปิดเผยว่า ผลการดำเนินงานในไตรมาส 1/69.,www.ryt9.com
Organic Search Result,2026-06-01,Unknown,"Wealth RM at ttb: Tools, Team, and Client Support",https://www.tiktok.com/@ttbbankofficial/video/7631034349978144021,"75 ถูกใจ,วิดีโอ TikTok จาก ttb bank (@ttbbankofficial): ""Discover how ttb Wealth RM empowers you with tools and teamwork for true client focus.",www.tiktok.com
Organic Search Result,2026-06-01,20 เม.ย. 2026,TTB กำไรไตรมาส 1/69 ที่ 5170 ล้านบาท โต 1.4% หลังเร่งคุม ...,https://www.thairath.co.th/money/investment/stocks/2927684,"ธนาคารทหารไทยธนชาต จำกัด (มหาชน) หรือ TTB รายงานกำไรสุทธิไตรมาส 1/2569 อยู่ที่ 5,170 ล้านบาท เพิ่มขึ้น 1.4% จากช่วงเดียวกันปีก่อน ...",www.thairath.co.th
Organic Search Result,2026-06-01,Unknown,‘TMBThanachart (ttb)’ achieves success at the Future Trends ...,https://www.youtube.com/shorts/RJrjQo7ZZ8c,'TMBThanachart (ttb)' พร้อมรางวัลอันทรงเกียรติ ได้แก่ The Most Impactful รางวัลองค์กรที่เป็นที่สุดด้านการส่งผลกระทบเชิงบวกต่อสังคม . #FutureTrends #FutureTrendsAward2026 ...,www.youtube.com
Organic Search Result,2026-06-01,20 เม.ย. 2026,TTBแจ้งกำไร5.17พันล้าน-รายได้ค่าฟีหนุน-คุมเข้มคุณภาพสินทรัพย์,https://mgronline.com/stockmarket/detail/9690000037098,ธนาคารทหารไทยธนชาต จำกัด (มหาชน) (TTB)รายงานผลการดำเนินงานไตรมาส 1 ปี 2569 ที่ 5170 ล้านบาท เพิ่มขึ้น 73 ล้านบาท หรือคิดเป็น 1.43%เมื่อเทียบกับช่วงเดียวกันของปีก่อน ...,mgronline.com
Organic Search Result,2026-06-01,28 เม.ย. 2026,TTB เร่งซื้อหุ้นคืนอีก 65 ล้านหุ้น ใช้เงิน 144 ลบ. ก่อนปิดโครงการ ...,https://www.kaohoon.com/news/828093,ธนาคารทหารไทยธนชาต จำกัด (มหาชน) หรือ TTB รายงานความคืบหน้าโครงการซื้อหุ้นคืนเพื่อบริหารทางการเงิน ณ วันที่ 28 เมษายน 2569 โดยเป็นการซื้อผ่านตลาดหลักทรัพย์แห่งประเทศไทย ตามมติคณะกรรมการ ...,www.kaohoon.com
Organic Search Result,2026-06-01,30 เม.ย. 2026,Specialist – Product Analytics and Insights - ttb bank,https://bebee.com/th/jobs/specialist-product-analytics-and-insights-ttb-bank-suan-luang-district-bangkok-city--theirstack-659661234,"กลับ. Specialist – Product Analytics and Insights. Marketing. ttb bank. Suan Luang District, ประเทศไทย 1 months ago Until 8/6/2569. เต็มเวลา ที่สำนักงาน. บันทึก. Apply ...",bebee.com
Organic Search Result,2026-06-01,Unknown,✨ เดินทางครึ่งราคา ด้วยบัตรเครดิต ttb รับเครดิตเงินคืน ...,https://x.com/BEM_MRT/status/2039606256491749391,BEM Bangkok Expressway and Metro (@BEM_MRT). ✨ เดินทางครึ่งราคา ด้วยบัตรเครดิต ttb รับเครดิตเงินคืน 50% 🗓️ : 1 เม.ย. 69 – 30 มิ.ย.,x.com
Organic Search Result,2026-06-01,29 เม.ย. 2026,บัตรเครดิต ttb เปิดเกมก่อนใคร จับมือฮะจิบัง ราเมน ออก ...,https://www.prachachat.net/public-relations/news-1999440,บัตรเครดิต ttb เปิดเกมก่อนใคร จับมือฮะจิบัง ราเมน ออกโปรแรง ครั้งแรกในไทย กินครบ 500 บาท รับเครดิตเงินคืน 88 บาท.,www.prachachat.net
Organic Search Result,2026-06-01,Unknown,เตรียมให้ครบ…ก่อนออกไปใช้ชีวิตช่วงสงกรานต์ 💦 เพราะเจ็บมา… ...,https://www.facebook.com/ttbbankofficial/posts/%E0%B9%80%E0%B8%95%E0%B8%A3%E0%B8%B5%E0%B8%A2%E0%B8%A1%E0%B9%83%E0%B8%AB%E0%B9%89%E0%B8%84%E0%B8%A3%E0%B8%9A%E0%B8%81%E0%B9%88%E0%B8%AD%E0%B8%99%E0%B8%AD%E0%B8%AD%E0%B8%81%E0%B9%84%E0%B8%9B%E0%B9%83%E0%B8%8A%E0%B9%89%E0%B8%8A%E0%B8%B5%E0%B8%A7%E0%B8%B4%E0%B8%95%E0%B8%8A%E0%B9%88%E0%B8%A7%E0%B8%87%E0%B8%AA%E0%B8%87%E0%B8%81%E0%B8%A3%E0%B8%B2%E0%B8%99%E0%B8%95%E0%B9%8C-%E0%B9%80%E0%B8%9E%E0%B8%A3%E0%B8%B2%E0%B8%B0%E0%B9%80%E0%B8%88%E0%B9%87%E0%B8%9A%E0%B8%A1%E0%B8%B2%E0%B8%84%E0%B9%88%E0%B8%B2%E0%B8%A3%E0%B8%B1%E0%B8%81%E0%B8%A9%E0%B8%B2%E0%B9%84%E0%B8%A1%E0%B9%88%E0%B9%80%E0%B8%9A%E0%B8%B2%E0%B9%80%E0%B8%A5%E0%B8%A2%E0%B9%80%E0%B8%8A%E0%B9%87%E0%B8%81%E0%B9%84%E0%B8%AD%E0%B9%80%E0%B8%97%E0%B9%87%E0%B8%A1/1034672178896563/,"... ttb all free และคงเงินฝากในบัญชี ttb all free ต่อเนื่องทุกวัน ตั้งแต่ 5,000 บาทขึ้นไป ก็รับฟรี! ประกันอุบัติเหตุ และความคุ้มครองชีวิต จาก บมจ. ธนชาต ...",www.facebook.com
Organic Search Result,2026-06-01,Unknown,3 High-Interest TTB Savings Accounts: Which One is Best ...,https://www.youtube.com/watch?v=MngM3FloWco,... ttb touch ขั้นต่ำในการเปิดบัญชี : ไม่มี รายละเอียดเพิ่มเติม คลิก ! https://www.ttbbank.com/th/personal/deposits/savings-account/ttb-me-save - บัญชี ทีทีบี ...,www.youtube.com
Organic Search Result,2026-06-01,27 เม.ย. 2026,ttb wealth | Global Trade Code | บทวิเคราะห์ประจำวันที่ 27 ...,https://www.settrade.com/th/research/analyst-research/dr/111415-ttb-wealth-global-trade-code,ttb wealth | Global Trade Code | บทวิเคราะห์ประจำวันที่ 27 เมษายน 2569. 27 เม.ย. 2569 09:18. 36 views. ttb wealth · Facebook · Line · X. Highlights.,www.settrade.com
Organic Search Result,2026-06-01,Unknown,🏦 KS: TTB รัดเข็มขัดให้แน่นและการบริหารเงินทุนเชิงรุก 📌 กำไร ...,https://www.instagram.com/p/DXouxWtiPRb/,ามที่เรา 25% ของประมาณการท่าริ ttb BANK QoQ 2569 TTB บยายตัวจากกลยุทธ์ 2069 จากการปรับอัตรา สินเยื่อกู้เพิ่มและ การเติบโตของ non-NII มีแนวโน้ม กลับสู่ระดับ ...,www.instagram.com
Organic Search Result,2026-06-01,1 เม.ย. 2026,โปรโมชั่น บัตรเครดิต TTB,https://www.indexlivingmall.com/blog/post/bank-partner-installment-ttb,"รายละเอียดโปรโมชัน : ช้อปคุ้มสินค้าบ้านกับบัตร ttb ที่ www.indexlivingmall.com (การชำระเงินผ่านช่องทาง e-wallet ไม่เข้าร่วมรายการ). ชำระเต็มจำนวน : รับเครดิตเงินคืนสูงสุด 12,000 บาท ...",www.indexlivingmall.com
Organic Search Result,2026-06-01,Unknown,"TTB ชัด! ""ลดทุน"" ตัดหุ้นซื้อคืน ทิ้ง!",https://www.tiktok.com/@kaohoon/video/7631839684007677201,"912 ถูกใจ,21 ความคิดเห็นวิดีโอ TikTok จาก ข่าวหุ้นธุรกิจ (@kaohoon): ""TTB ประกาศชัด ""ลดทุน"" ด้วยการตัดหุ้นซื้อคืนทิ้ง! เผยดิวิเดนด์ยีลด์ 6-7% น่าสนใจ. #ข่าวหุ้นธุรกิจออนไลน์ #ข่าวธุรกิจ ...",www.tiktok.com
Organic Search Result,2026-06-01,1 เม.ย. 2026,โปรบัตรเครดิต ttb ผ่อน 0% 10 เดือน คืนเงินสุดคุ้ม,https://true.th/truestore/en/bank-promotion/ttb/,"แบ่งชำระอัตราดอกเบี้ย 0% นานสูงสุด 10 เดือน สำหรับบัตรเครดิต ttb สำหรับบัตรกดเงินสด ttb (เฉพาะสินค้าที่ร่วมรายการ). • ยอดแบ่งชำระ / เซลล์สลิป 15,000 - 29,999 บาท รับเครดิตเงินคืน 300 ...",true.th
Organic Search Result,2026-06-01,29 เม.ย. 2026,ttb ชี้ช่องว่างตลาด MAF ดันประกัน “ttb 15/5” โตแรง ยอดขายทะลุ 2 ...,https://www.workpointtoday.com/ttb-799794-2,ทีเอ็มบีธนชาต (ttb) เดินหน้าสร้างมาตรฐานใหม่ของโซลูชันทางการเงิน ด้วยการเปิดตัว “ทีทีบี ยูเอส มัลติ-แอสเซต อินเด็กซ์ พรินซิเพิล โพรเทค 15/5” ...,www.workpointtoday.com
Organic Search Result,2026-06-01,Unknown,ทีทีบี ขอแจ้งวันเปิด - ปิดทำการของสาขาในช่วงเทศกาลสงกรานต์ ...,https://x.com/ttbbankofficial/status/2041335149741392307,ttb bank (@ttbbankofficial). ทีทีบี ขอแจ้งวันเปิด - ปิดทำการของสาขาในช่วงเทศกาลสงกรานต์ 2569 ในวันที่สาขาปิดให้บริการ ลูกค้าสามารถทำธุรกรรมต่าง ๆ ผ่านช่องทางอิเล็กทรอนิกส์ เช่น แอป ...,x.com
Organic Search Result,2026-06-01,10 เม.ย. 2026,TTB ช่วยลูกค้า-พนักงาน ฝ่าวิกฤตน้ำมันแพง จัดโซลูชันรับสงกรานต์,https://www.posttoday.com/business/financial/740797,TTB มอบสิทธิประโยชน์ให้ลูกค้าบุคคลเพื่อลดค่าใช้จ่ายช่วงสงกรานต์ เช่น เครดิตเงินคืนค่าน้ำมันและรถไฟฟ้าสูงสุด 50% และประกันอุบัติเหตุฟรี; สนับสนุนผู้ประกอบการ SME ด้วยโซลูชันทางการเงินเพื่อเสริมสภาพคล่อง ...,www.posttoday.com
Organic Search Result,2026-06-01,1 เม.ย. 2026,ttb Tasty | ทีเอ็มบีธนชาต (ttb),https://www.ttbbank.com/th/promotion/credit-card/dining/ttbtasty-apr26,ttb Tasty. 1 เม.ย. 69 – 30 มิ.ย. 69. รับสิทธิ์ผ่าน ทีทีบี ทัช ...,www.ttbbank.com
Organic Search Result,2026-06-01,Unknown,หวังลงทุนเพื่อกำไร แต่อาจกลายเป็นเหยื่อมิจฉาชีพโดยไม่รู้ตัว ...,https://www.facebook.com/ttbbankofficial/videos/%E0%B8%AB%E0%B8%A7%E0%B8%B1%E0%B8%87%E0%B8%A5%E0%B8%87%E0%B8%97%E0%B8%B8%E0%B8%99%E0%B9%80%E0%B8%9E%E0%B8%B7%E0%B9%88%E0%B8%AD%E0%B8%81%E0%B8%B3%E0%B9%84%E0%B8%A3-%E0%B9%81%E0%B8%95%E0%B9%88%E0%B8%AD%E0%B8%B2%E0%B8%88%E0%B8%81%E0%B8%A5%E0%B8%B2%E0%B8%A2%E0%B9%80%E0%B8%9B%E0%B9%87%E0%B8%99%E0%B9%80%E0%B8%AB%E0%B8%A2%E0%B8%B7%E0%B9%88%E0%B8%AD%E0%B8%A1%E0%B8%B4%E0%B8%88%E0%B8%89%E0%B8%B2%E0%B8%8A%E0%B8%B5%E0%B8%9E%E0%B9%82%E0%B8%94%E0%B8%A2%E0%B9%84%E0%B8%A1%E0%B9%88%E0%B8%A3%E0%B8%B9%E0%B9%89%E0%B8%95%E0%B8%B1%E0%B8%A7-%E0%B8%A1%E0%B8%B5%E0%B8%82%E0%B9%89%E0%B8%AD%E0%B9%81%E0%B8%99%E0%B8%B0%E0%B8%99%E0%B8%B3-%E0%B8%AB%E0%B8%A3%E0%B8%B7%E0%B8%AD%E0%B8%AA%E0%B8%AD%E0%B8%9A%E0%B8%96%E0%B8%B2/1270717665262628/,More videos you may like.,www.facebook.com
