Topic_Type,Date_Extracted,Published_Date,Heading,URL,Body_Snippet,Source_Site
Organic Search Result,2026-06-01,1 พ.ค. 2026,ttb เปลี่ยน...เพื่อให้ชีวิตคุณดีขึ้น | ทีเอ็มบีธนชาต ( ...,https://www.ttbbank.com/search/%E0%B8%94%E0%B8%AD%E0%B8%81%E0%B9%80%E0%B8%9A%E0%B8%B5%E0%B9%89%E0%B8%A2,ขอหนังสือรับรองดอกเบี้ยสินเชื่อบ้าน. คู่มือการใช้งานแอป ttb touch. ขอหนังสือรับรองการหักภาษี ณ ที่จ่าย (50 ทวิ). คู่มือการใช้งานแอป ttb touch. การสมัครสินเชื่อรีไฟแนนซ์. คู่มือการใช้งานแอป ttb ...,www.ttbbank.com
Organic Search Result,2026-06-01,1 เม.ย. 2026,อัตราดอกเบี้ยบัญชีเงินฝากเงินตราต่างประเทศ | ทีเอ็มบีธนชาต ( ...,https://www.ttbbank.com/th/rates/foreign-currency-deposits,บัญชีและธุรกรรมภายในประเทศ. บัญชีและธุรกรรมระหว่างประเทศ. ดิจิทัลแบงก์กิ้ง และบริการอื่นๆ. finbiz เสริมความรู้ SME · สนใจสมัครผลิตภัณฑ์ · ผลิตภัณฑ์ลูกค้าเอสเอ็มอี บุคคลธรรมดา. เข้าสู่ระบบ. ttb ...,www.ttbbank.com
Organic Search Result,2026-06-01,Unknown,เตรียมให้ครบ…ก่อนออกไปใช้ชีวิตช่วงสงกรานต์ 💦 เพราะเจ็บมา… ...,https://www.facebook.com/ttbbankofficial/posts/%E0%B9%80%E0%B8%95%E0%B8%A3%E0%B8%B5%E0%B8%A2%E0%B8%A1%E0%B9%83%E0%B8%AB%E0%B9%89%E0%B8%84%E0%B8%A3%E0%B8%9A%E0%B8%81%E0%B9%88%E0%B8%AD%E0%B8%99%E0%B8%AD%E0%B8%AD%E0%B8%81%E0%B9%84%E0%B8%9B%E0%B9%83%E0%B8%8A%E0%B9%89%E0%B8%8A%E0%B8%B5%E0%B8%A7%E0%B8%B4%E0%B8%95%E0%B8%8A%E0%B9%88%E0%B8%A7%E0%B8%87%E0%B8%AA%E0%B8%87%E0%B8%81%E0%B8%A3%E0%B8%B2%E0%B8%99%E0%B8%95%E0%B9%8C-%E0%B9%80%E0%B8%9E%E0%B8%A3%E0%B8%B2%E0%B8%B0%E0%B9%80%E0%B8%88%E0%B9%87%E0%B8%9A%E0%B8%A1%E0%B8%B2%E0%B8%84%E0%B9%88%E0%B8%B2%E0%B8%A3%E0%B8%B1%E0%B8%81%E0%B8%A9%E0%B8%B2%E0%B9%84%E0%B8%A1%E0%B9%88%E0%B9%80%E0%B8%9A%E0%B8%B2%E0%B9%80%E0%B8%A5%E0%B8%A2%E0%B9%80%E0%B8%8A%E0%B9%87%E0%B8%81%E0%B9%84%E0%B8%AD%E0%B9%80%E0%B8%97%E0%B9%87%E0%B8%A1/1034672178896563/,ค่ารักษาไม่เบาเลย เช็กไอเท็มยอดฮิตให้พร้อม ทั้งปืนฉีดน้ำ ซองกันน้ำ แว่นตากันน้ำ และสิ่งสำคัญที่ห้ามลืม คือ “ประกันอุบัติเหตุ” ที่ช่วยให้อุ่นใจ แค่มีบัญชี ttb all free และคงเงินฝากในบัญชี ttb all free ต่อ ...,www.facebook.com
Organic Search Result,2026-06-01,11 เม.ย. 2026,ttb touch - Aplicaciones en Google Play,https://play.google.com/store/apps/details/ttb_touch?id=com.TMBTOUCH.PRODUCTION&hl=es,"La nueva ttb touch, la primera app de banca preparada para adaptarse y aprender a conocerte mejor. para adaptarse a cada estilo de vida financiero y listo ...",play.google.com
Organic Search Result,2026-06-01,22 เม.ย. 2026,Investor Relations - Credit Rating | TMBThanachart (ttb),https://www.ttbbank.com/en/ir/credit-rating-and-debenture/credit-ratings,ttb analytics · Careers · Contact Us · TH · ttb-logo. MENU. Personal · SME · Corporate · ttb reserve; Rates and Fees. Search. Financial Information ...,www.ttbbank.com
Organic Search Result,2026-06-01,Unknown,Wealth RM ที่ ttb = “งานที่พร้อมให้เริ่มได้จริง” เพราะมีทั้งเครื่องมือ ...,https://www.facebook.com/ttbbankofficial/videos/wealth-rm-%E0%B8%97%E0%B8%B5%E0%B9%88-ttb-%E0%B8%87%E0%B8%B2%E0%B8%99%E0%B8%97%E0%B8%B5%E0%B9%88%E0%B8%9E%E0%B8%A3%E0%B9%89%E0%B8%AD%E0%B8%A1%E0%B9%83%E0%B8%AB%E0%B9%89%E0%B9%80%E0%B8%A3%E0%B8%B4%E0%B9%88%E0%B8%A1%E0%B9%84%E0%B8%94%E0%B9%89%E0%B8%88%E0%B8%A3%E0%B8%B4%E0%B8%87%E0%B9%80%E0%B8%9E%E0%B8%A3%E0%B8%B2%E0%B8%B0%E0%B8%A1%E0%B8%B5%E0%B8%97%E0%B8%B1%E0%B9%89%E0%B8%87%E0%B9%80%E0%B8%84%E0%B8%A3%E0%B8%B7%E0%B9%88%E0%B8%AD%E0%B8%87%E0%B8%A1%E0%B8%B7%E0%B8%AD-%E0%B8%97%E0%B8%B5%E0%B8%A1-%E0%B9%81%E0%B8%A5%E0%B8%B0%E0%B8%90%E0%B8%B2%E0%B8%99%E0%B8%A5%E0%B8%B9%E0%B8%81%E0%B8%84/27027681200150087/,Wealth RM ที่ ttb = “งานที่พร้อมให้เริ่มได้จริง” เพราะมีทั้งเครื่องมือ ทีม และฐานลูกค้า ไม่ต้องเริ่มจากศูนย์ • สายกองทุนต้องชอบ สามารถแนะนำกองทุนรวมได้หลากหลายจาก 12 บลจ.,www.facebook.com
Organic Search Result,2026-06-01,3 เม.ย. 2026,ttb wealth securities | หลักทรัพย์ ทีทีบี เวลธ์,https://www.ttbwealth.co.th/home/en,"Elevate your portfolio with global investments through ttb wealth. Maximize returns, manage risks, and own a piece of the world's top companies today.",www.ttbwealth.co.th
Organic Search Result,2026-06-01,Unknown,TTB กลยุทธ์ปี 2026: โตช้า แต่คุณภาพต้องชนะ | 10 minutes with ...,https://www.youtube.com/watch?v=tDANFdmyu5E,เปิดกลยุทธ์ TTB: “โตช้าแต่มั่นคง” ปันผล 6% ในยุคดอกเบี้ยขาลง ธนาคารจะโตยังไง… ในวันที่เศรษฐกิจยังเปราะบาง และดอกเบี้ยลดต่อเนื่อง? TTB เลือก “ไม่เร่งปล่อยสินเชื่อ” แต่โฟกัสคุณภาพพอร์ตแทน ...,www.youtube.com
Organic Search Result,2026-06-01,30 เม.ย. 2026,แจ้งปรับปรุงเงื่อนไขสิทธิประโยชน์บัตรเครดิต ttb สำหรับรายการที่ ...,https://www.ttbbank.com/th/newsroom/detail/ttb-announce-cc-tmn,การใช้จ่ายผ่านบัตรเครดิต ttb สำหรับรายการที่ทำผ่านแอปพลิเคชัน TrueMoney Wallet ทุกประเภท จะไม่นำมาคำนวณในการสะสมคะแนน สำหรับบัตรเครดิตประเภทที่มีคะแนนสะสม หรือการรับเงินคืน 1% สำหรับ ...,www.ttbbank.com
Organic Search Result,2026-06-01,Unknown,"ภารกิจออกล่าความอร่อย จากบัตรเครดิต ttb กิน 1,200 บาท รับเครดิต ...",https://www.facebook.com/ttbbankofficial/videos/%E0%B8%A0%E0%B8%B2%E0%B8%A3%E0%B8%81%E0%B8%B4%E0%B8%88%E0%B8%AD%E0%B8%AD%E0%B8%81%E0%B8%A5%E0%B9%88%E0%B8%B2%E0%B8%84%E0%B8%A7%E0%B8%B2%E0%B8%A1%E0%B8%AD%E0%B8%A3%E0%B9%88%E0%B8%AD%E0%B8%A2-%E0%B8%88%E0%B8%B2%E0%B8%81%E0%B8%9A%E0%B8%B1%E0%B8%95%E0%B8%A3%E0%B9%80%E0%B8%84%E0%B8%A3%E0%B8%94%E0%B8%B4%E0%B8%95-ttb-%E0%B8%81%E0%B8%B4%E0%B8%99-1200-%E0%B8%9A%E0%B8%B2%E0%B8%97-%E0%B8%A3%E0%B8%B1%E0%B8%9A%E0%B9%80%E0%B8%84%E0%B8%A3%E0%B8%94%E0%B8%B4%E0%B8%95%E0%B9%80%E0%B8%87%E0%B8%B4%E0%B8%99%E0%B8%84%E0%B8%B7%E0%B8%99-100-%E0%B8%9A%E0%B8%B2%E0%B8%97%E0%B8%9E%E0%B8%B4%E0%B9%80/2775163936191339/,ภารกิจออกล่าความอร่อย จากบัตรเครดิต ttb กิน 1200 บาท รับเครดิตเงินคืน 100 บาท พิเศษ กินครบ 5 ร้าน ไม่ซ้ำ รับเครดิตเงินคืนเพิ่มอีก 300 บาท...,www.facebook.com
Organic Search Result,2026-06-01,Unknown,เตรียมให้ครบ…ก่อนออกไปใช้ชีวิตช่วงสงกรานต์ 💦 เพราะเจ็บมา… ...,https://www.facebook.com/ttbbankofficial/posts/%E0%B9%80%E0%B8%95%E0%B8%A3%E0%B8%B5%E0%B8%A2%E0%B8%A1%E0%B9%83%E0%B8%AB%E0%B9%89%E0%B8%84%E0%B8%A3%E0%B8%9A%E0%B8%81%E0%B9%88%E0%B8%AD%E0%B8%99%E0%B8%AD%E0%B8%AD%E0%B8%81%E0%B9%84%E0%B8%9B%E0%B9%83%E0%B8%8A%E0%B9%89%E0%B8%8A%E0%B8%B5%E0%B8%A7%E0%B8%B4%E0%B8%95%E0%B8%8A%E0%B9%88%E0%B8%A7%E0%B8%87%E0%B8%AA%E0%B8%87%E0%B8%81%E0%B8%A3%E0%B8%B2%E0%B8%99%E0%B8%95%E0%B9%8C-%E0%B9%80%E0%B8%9E%E0%B8%A3%E0%B8%B2%E0%B8%B0%E0%B9%80%E0%B8%88%E0%B9%87%E0%B8%9A%E0%B8%A1%E0%B8%B2%E0%B8%84%E0%B9%88%E0%B8%B2%E0%B8%A3%E0%B8%B1%E0%B8%81%E0%B8%A9%E0%B8%B2%E0%B9%84%E0%B8%A1%E0%B9%88%E0%B9%80%E0%B8%9A%E0%B8%B2%E0%B9%80%E0%B8%A5%E0%B8%A2%E0%B9%80%E0%B8%8A%E0%B9%87%E0%B8%81%E0%B9%84%E0%B8%AD%E0%B9%80%E0%B8%97%E0%B9%87%E0%B8%A1/1034672178896563/,ค่ารักษาไม่เบาเลย เช็กไอเท็มยอดฮิตให้พร้อม ทั้งปืนฉีดน้ำ ซองกันน้ำ แว่นตากันน้ำ และสิ่งสำคัญที่ห้ามลืม คือ “ประกันอุบัติเหตุ” ที่ช่วยให้อุ่นใจ แค่มีบัญชี ttb all free และคงเงินฝากในบัญชี ttb all free ต่อ ...,www.facebook.com
Organic Search Result,2026-06-01,11 เม.ย. 2026,ttb touch – Applications sur Google Play,https://play.google.com/store/apps/details/ttb_touch?id=com.TMBTOUCH.PRODUCTION&hl=fr_CH,"La nouvelle ttb touch, la première appli bancaire prête à s'adapter et apprendre à mieux vous connaître. pour convenir à tous les styles de vie financiers ...",play.google.com
Organic Search Result,2026-06-01,Unknown,"ภารกิจออกล่าความอร่อย จากบัตรเครดิต ttb กิน 1,200 บาท รับเครดิต ...",https://www.facebook.com/ttbbankofficial/videos/%E0%B8%A0%E0%B8%B2%E0%B8%A3%E0%B8%81%E0%B8%B4%E0%B8%88%E0%B8%AD%E0%B8%AD%E0%B8%81%E0%B8%A5%E0%B9%88%E0%B8%B2%E0%B8%84%E0%B8%A7%E0%B8%B2%E0%B8%A1%E0%B8%AD%E0%B8%A3%E0%B9%88%E0%B8%AD%E0%B8%A2-%E0%B8%88%E0%B8%B2%E0%B8%81%E0%B8%9A%E0%B8%B1%E0%B8%95%E0%B8%A3%E0%B9%80%E0%B8%84%E0%B8%A3%E0%B8%94%E0%B8%B4%E0%B8%95-ttb-%E0%B8%81%E0%B8%B4%E0%B8%99-1200-%E0%B8%9A%E0%B8%B2%E0%B8%97-%E0%B8%A3%E0%B8%B1%E0%B8%9A%E0%B9%80%E0%B8%84%E0%B8%A3%E0%B8%94%E0%B8%B4%E0%B8%95%E0%B9%80%E0%B8%87%E0%B8%B4%E0%B8%99%E0%B8%84%E0%B8%B7%E0%B8%99-100-%E0%B8%9A%E0%B8%B2%E0%B8%97%E0%B8%9E%E0%B8%B4%E0%B9%80/2775163936191339/,ภารกิจออกล่าความอร่อย จากบัตรเครดิต ttb กิน 1200 บาท รับเครดิตเงินคืน 100 บาท พิเศษ กินครบ 5 ร้าน ไม่ซ้ำ รับเครดิตเงินคืนเพิ่มอีก 300 บาท...,www.facebook.com
Organic Search Result,2026-06-01,Unknown,TTB: Earnings Call (OPPDAY) Q1/2026 ธนาคารทหารไทยธนชาต ...,https://www.youtube.com/watch?v=xy83JfOla9w,TTB: Earnings Call (OPPDAY) Q1/2026 ธนาคารทหารไทยธนชาต จำกัด (มหาชน). 670 views · Streamed 1 month ago ...more. SET Thailand. 481K. Subscribe. 16. Share.,www.youtube.com
Organic Search Result,2026-06-01,23 เม.ย. 2026,สินเชื่อรถยนต์ใช้แล้ว ทีทีบี ไดรฟ์ (สินเชื่อรถมือสอง),https://www.ttbbank.com/th/personal/loans/hire-purchase/used-car,สินเชื่อรถยนต์ใช้แล้ว ทีทีบี ไดรฟ์ (สินเชื่อรถมือสอง) ... จัดไฟแนนซ์รถมือสอง รถเก่า รถเต็นท์ หรือรถบ้านได้ง่าย ๆ ผ่อนสบาย อนุมัติไวด้วยสินเชื่อรถมือสองดอกเบี้ยต่ำ ttb DRIVE. วงเงินสูงสุด 100%. รู้ผลอนุมัติ ...,www.ttbbank.com
Organic Search Result,2026-06-01,30 เม.ย. 2026,กองทุนเปิด ttb smart port,https://www.eastspring.co.th/THDocs/MR/tsp4-explorer_TH_08.pdf,สินทรัพย์สภาพคล่อง. 3.49%. รวม. 100.00%. กองทุนเปิด ttb smart port tsp4-explorer. สัดส่วนลงทุนแยก ...,www.eastspring.co.th
Organic Search Result,2026-06-01,21 เม.ย. 2026,TTB - 1Q69: กำไรดีกว่าคาดเล็กน้อย; อัตราผลตอบแทนเงินปันผลดี,https://www.innovestx.co.th/cafeinvest/research/company-analysis/earnings/ttb-earnings-20260421,เราคงคำแนะนำ NEUTRAL สำหรับ TTB ด้วยราคาเป้าหมายเดิมที่ 2.2 บาท โดยได้รับปัจจัยหนุนจากอัตราผลตอบแทนจากเงินปันผลที่ดีและโครงการซื้อหุ้นคืน.,www.innovestx.co.th
Organic Search Result,2026-06-01,1 เม.ย. 2026,โปรบัตรเครดิต ttb ผ่อน 0% 10 เดือน คืนเงินสุดคุ้ม,https://true.th/truestore/en/bank-promotion/ttb/,สิทธิพิเศษบัตรเครดิต ttb ผ่อน 0% นานสูงสุด 10 เดือน พร้อมรับเครดิตเงินคืนสูงสุด 7200 บาท เมื่อแบ่งชำระตามเงื่อนไขที่ทรูสโตร์.,true.th
Organic Search Result,2026-06-01,25 เม.ย. 2026,ttb bank - Jobs,https://bebee.com/th/companies/ttb-bank,ttb bank (Banking) - 172 Active jobs.,bebee.com
Organic Search Result,2026-06-01,2 เม.ย. 2026,"@fiveramusic x TTB Fly High ✨ Not just a performance, but ...",https://www.instagram.com/p/DWn7DTqAah6/,"@fiveramusic x TTB Fly High ✨ Not just a performance, but a moment where music spoke louder than words, leaving a subtle yet lasting impression. Contact us ...",www.instagram.com
Organic Search Result,2026-06-01,20 เม.ย. 2026,TTB โชว์กำไร Q1 ที่ 5.17 พันล. คุม NPL อยู่ระดับ 2.9%,https://www.hoonvision.com/hoonset/ttb-%E0%B9%82%E0%B8%8A%E0%B8%A7%E0%B9%8C%E0%B8%81%E0%B8%B3%E0%B9%84%E0%B8%A3-q1-%E0%B8%97%E0%B8%B5%E0%B9%88-5-17-%E0%B8%9E%E0%B8%B1%E0%B8%99%E0%B8%A5-%E0%B8%84%E0%B8%B8%E0%B8%A1-npl-%E0%B8%AD/,"TTB โชว์กำไร Q1 ที่ 5.17 พันล. คุม NPL อยู่ระดับ 2.9%. แชร์: Facebook twitter line link คัดลอกลิงค์. เผยแพร่วันที่ 20 เมษายน 2569. ทีทีบี รายงานกำไรสุทธิ 5,170 ...",www.hoonvision.com
Organic Search Result,2026-06-01,21 เม.ย. 2026,TTB (HOLD : Fair Price : Bt 2.20) : กำไรสุทธิใน 1Q26 ทรงตัว,https://www.pi.financial/research/ttb-hold-fair-price-bt-220-%E0%B8%81%E0%B8%B3%E0%B9%84%E0%B8%A3%E0%B8%AA%E0%B8%B8%E0%B8%97%E0%B8%98%E0%B8%B4%E0%B9%83%E0%B8%99-1q26-%E0%B8%97%E0%B8%A3%E0%B8%87%E0%B8%95%E0%B8%B1%E0%B8%A7-yoy--toceb8z,ในปี 2026 แม้มีแรงกดดันจากสินเชื่อที่ชะลอตัว และ NIM ลดลง เรามองว่า TTB ควบคุมคุณภาพสินเชื่อได้ดี และมีสำรองหนี้ฯ ส่วนเกิน (Management overlay) ราว 20% ของสำรองหนี้ฯ รวมรองรับความไม่แน่นอน ...,www.pi.financial
Organic Search Result,2026-06-01,1 เม.ย. 2026,Partner ttb - Privileges l KING POWER Duty Free,https://www.kingpower.com/content/partner-ttb-bank,"บัตรเครดิต ttb royal top brass, บัตรเครดิต ttb Disney ยกเว้น (บัตรกดเงินสด ttb flash, บัตรกดเงินสด ttb Global House, บัตรเดบิต ttb All Free, บัตรเดบิต ttb All Free Disney).",www.kingpower.com
Organic Search Result,2026-06-01,Unknown,✨ เดินทางครึ่งราคา ด้วยบัตรเครดิต ttb รับเครดิตเงินคืน ...,https://x.com/BEM_MRT/status/2039606256491749391,เดินทางครึ่งราคา ด้วยบัตรเครดิต ttb รับเครดิตเงินคืน 50% 🗓️ : 1 เม.ย. 69 – 30 มิ.ย. 69 อ่านรายละเอียดเพิ่มเติม : metro.bemplc.co.th/Promotion-Deta…,x.com
Organic Search Result,2026-06-01,19 เม.ย. 2026,EXCEL งบกำไรขาดทุน หุ้น TTB ปี 2569 - AiO,https://aio.panphol.com/stock/TTB/pl_excel/1Q2569,"EXCEL งบกำไรขาดทุน หุ้น TTB 1Q2569 ; 4,419.38 · 12,150.37 · 3,848.98 ; 5,745.80 · 13,218.76 · 3,238.54 ; -1,326.42 · -1,068.39 · 610.44.",aio.panphol.com
Organic Search Result,2026-06-01,1 พ.ค. 2026,QA Specialist (Performance) (T00026791),https://www.ttbspark.com/join-us/QASpecialist-Perf/apply,Digital Hub ของ ttb ที่มีความเชื่อและความมุ่งมั่นที่จะสร้างการเปลี่ยนแปลงที่มีความหมายให้กับชีวิตของลูกค้าผ่าน Digital Technology และไอเดียที่สร้างสรรค์.,www.ttbspark.com
Organic Search Result,2026-06-01,11 เม.ย. 2026,ttb touch – Applications sur Google Play,https://play.google.com/store/apps/details/ttb_touch?id=com.TMBTOUCH.PRODUCTION&hl=fr,"La nouvelle ttb touch, la première appli bancaire prête à s'adapter et apprendre à mieux vous connaître. pour convenir à tous les styles de vie financiers ...",play.google.com
Organic Search Result,2026-06-01,29 เม.ย. 2026,Software Engineer (Java/Kotlin) (T00030759) - ttb bank,https://bebee.com/th/jobs/software-engineer-java-kotlin-t00030759-ttb-bank-chatuchak-bangkok-city--theirstack-672074628,"กลับ. Software Engineer (Java/Kotlin) (T00030759). Technology. ttb bank. Chatuchak, ประเทศไทย 1 months ago Until 27/6/2569. เต็มเวลา ไฮบริด. บันทึก. Apply now.",bebee.com
Organic Search Result,2026-06-01,22 เม.ย. 2026,TTB analytics มองธุรกิจ IT & Telecommunication กำลังเข้าสู่ ...,https://www.techtalkthai.com/ttb-analytics-it-telecommunication-in-2026-ingisht-pr/,ศูนย์วิเคราะห์เศรษฐกิจ ทีทีบี หรือ ttb analytics มองธุรกิจ IT & Telecommunication ของไทยเริ่มเข้าสู่ช่วงอิ่มตัวจากภาวะการเติบโตที่ต่ำกว่าค่าเฉลี่ย ...,www.techtalkthai.com
Organic Search Result,2026-06-01,Unknown,โบนัสออกแล้ว ชาว ttb จะเอาไปทำอะไรกันบ้างนะ #โบนัสประจำปี ...,https://www.instagram.com/reel/DXLNAhbgcz6/,"ลองดูที่บัตรกดเงินสด ttb flash สิ... ผ่อนสินค้าดอกเบี้ย 0% นานสูงสุด 60 เดือน ประหยัดค่าไฟได้ถึงเดือนละ 4,800 บาทต่อเดือนเลยนะ. English Transcript. Wow, ...",www.instagram.com
Organic Search Result,2026-06-01,1 เม.ย. 2026,โปรโมชันประกัน | ทีเอ็มบีธนชาต (ttb),https://www.ttbbank.com/th/promotion/insurance,โปรโมชันสำหรับลูกค้าที่ซื้อและสมัครประกัน ttb ประกันชีวิต ประกันสุขภาพ ประกันรถยนต์ รับเงินคืน และสิทธิพิเศษอีกมากมายจากผลิตภัณฑ์ที่ร่วมรายการ.,www.ttbbank.com
Organic Search Result,2026-06-01,1 พ.ค. 2026,TTB เร่งซื้อหุ้นคืน เพิ่มวงเงินแตะ 3.5 หมื่นล.,https://www.hoonvision.com/hoonset/ttb-%E0%B9%80%E0%B8%A3%E0%B9%88%E0%B8%87%E0%B8%8B%E0%B8%B7%E0%B9%89%E0%B8%AD%E0%B8%AB%E0%B8%B8%E0%B9%89%E0%B8%99%E0%B8%84%E0%B8%B7%E0%B8%99-%E0%B9%80%E0%B8%9E%E0%B8%B4%E0%B9%88%E0%B8%A1%E0%B8%A7/,หุ้นวิชั่น – นายปิติ ตัณฑเกษม ประธานเจ้าหน้าที่บริหารธนาคารทหารไทยธนชาต จำกัด (มหาชน) หรือ TTB เปิดเผยถึงโครงการซื้อหุ้นคืนว่า สำหรับโครงการซื้อหุ้นคืนของทีทีบี ...,www.hoonvision.com
Organic Search Result,2026-06-01,1 พ.ค. 2026,QA Specialist (Performance) (T00026791),https://www.ttbspark.com/join-us/QASpecialist-Perf/apply,Digital Hub ของ ttb ที่มีความเชื่อและความมุ่งมั่นที่จะสร้างการเปลี่ยนแปลงที่มีความหมายให้กับชีวิตของลูกค้าผ่าน Digital Technology และไอเดียที่สร้างสรรค์.,www.ttbspark.com
Organic Search Result,2026-06-01,30 เม.ย. 2026,ซัมเมอร์นี้ กิน-ช้อปคุ้มกว่า กับบัตรเครดิต ttb ที่ เมกาบางนา,https://www.mega-bangna.com/news-events/%E0%B8%8B%E0%B8%B1%E0%B8%A1%E0%B9%80%E0%B8%A1%E0%B8%AD%E0%B8%A3%E0%B9%8C%E0%B8%99%E0%B8%B5%E0%B9%89-%E0%B8%81%E0%B8%B4%E0%B8%99-%E0%B8%8A%E0%B9%89%E0%B8%AD%E0%B8%9B%E0%B8%84%E0%B8%B8%E0%B9%89%E0%B8%A1%E0%B8%81%E0%B8%A7%E0%B9%88%E0%B8%B2-%E0%B8%81%E0%B8%B1%E0%B8%9A%E0%B8%9A%E0%B8%B1%E0%B8%95%E0%B8%A3%E0%B9%80%E0%B8%84%E0%B8%A3%E0%B8%94%E0%B8%B4%E0%B8%95-ttb-%E0%B8%97%E0%B8%B5%E0%B9%88%E0%B9%80%E0%B8%A1%E0%B8%81%E0%B8%B2%E0%B8%9A%E0%B8%B2%E0%B8%87%E0%B8%99%E0%B8%B2-%E0%B8%9E%E0%B8%B4%E0%B9%80%E0%B8%A8%E0%B8%A9%E0%B8%AA%E0%B8%B3%E0%B8%AB%E0%B8%A3%E0%B8%B1%E0%B8%9A%E0%B8%A5%E0%B8%B9%E0%B8%81%E0%B8%84%E0%B9%89%E0%B8%B2%E0%B8%9A%E0%B8%B1%E0%B8%95%E0%B8%A3%E0%B9%80%E0%B8%84%E0%B8%A3%E0%B8%94%E0%B8%B4%E0%B8%95-ttb-%E0%B8%A3%E0%B8%B1%E0%B8%9A%E0%B8%84%E0%B8%A7%E0%B8%B2%E0%B8%A1%E0%B8%9E%E0%B8%B4%E0%B9%80%E0%B8%A8%E0%B8%A9x3/1780,"พิเศษสำหรับลูกค้าบัตรเครดิต ttb รับความพิเศษ x3 ตั้งแต่วันที่ 1 เม.ย. 69 – 30 มิ.ย. 69​ .​. พิเศษ 1 : รับ MEGA VOUCHER มูลค่ารวมสูงสุด 1,000 บาท เมื่อมียอดใช้จ่ายสะสมที่ร้านอาหาร และร้านค้าใน ...",www.mega-bangna.com
Organic Search Result,2026-06-01,1 เม.ย. 2026,Partner ttb - Privileges l KING POWER Duty Free,https://www.kingpower.com/content/partner-ttb-bank,"บัตรเครดิต ttb royal top brass, บัตรเครดิต ttb Disney ยกเว้น (บัตรกดเงินสด ttb flash, บัตรกดเงินสด ttb Global House, บัตรเดบิต ttb All Free, บัตรเดบิต ttb All Free Disney).",www.kingpower.com
Organic Search Result,2026-06-01,1 เม.ย. 2026,ttb จัดให้✨ เปิดประมูลในจังหวัดชลบุรีกว่า 50 คัน 👉วันพฤหัสบดีที่ ...,https://www.instagram.com/p/DWlKk7egTiD/,"ประมูลรถยนต์ ttb จัดให้เปิดประมูลรถสวยคัดพิเศษ เปิดประมูลในวันศุกร์ที่ 24 เมษายน 2569 สามารถดูรถได้ที่ “ลานประมูลแอพเพิล ติวานนท์"" เริ่มทำการประมูลตั้งแต่เวลา 11.00 น.เป็นต้นไป",www.instagram.com
